PMID,Title,Authors,Citation,First Author,Journal/Book,Publication Year,Create Date,PMCID,NIHMS ID,DOI
"41166122","SLAMF8 expression and prognostic significance in melanoma: A multi-omics and Mendelian randomization study","Liu J, Han W, Shen G.","Cancer Biomark. 2025 Oct;42(10):18758592251392828. doi: 10.1177/18758592251392828. Epub 2025 Oct 30.","Liu J","Cancer Biomark","2025","2025/10/30","","","10.1177/18758592251392828"
"41146333","Peripheral blood mononuclear cell DNA methylation biomarkers for prognostic stratification in Chinese lung adenocarcinoma: a genome-wide epigenetic profiling study","Li P, Zhang C, Yang S, Wu Y, Chen H, Ma S, Wu Y, He Z, Wang L, Liu Y, Wang Q.","Clin Epigenetics. 2025 Oct 27;17(1):177. doi: 10.1186/s13148-025-01992-z.","Li P","Clin Epigenetics","2025","2025/10/28","PMC12560486","","10.1186/s13148-025-01992-z"
"41121288","DNA methylation profiles and cancer in children conceived after assisted reproductive technology","Ducreux B, Firmin J, Ferreux L, Patrat C, Clavel J, Ghantous A, Herceg Z, Callanan M, Fauque P.","Clin Epigenetics. 2025 Oct 21;17(1):174. doi: 10.1186/s13148-025-01982-1.","Ducreux B","Clin Epigenetics","2025","2025/10/22","PMC12542189","","10.1186/s13148-025-01982-1"
"41104469","EndoCompass project: research roadmap for pituitary and neuroendocrine tumor endocrinology","Castano JP, Dattani MT, Grozinsky-Glasberg S, Karavitaki N, Pavel ME, Andoniadou C, Alexandraki K, Capatina C, Cerbone M, Ferone D, Gan HW, Hofland J, Hofland LJ, Ibanez-Costa A, Ilie MD, Isidori AM, Korbonits M, Kos-Kudła B, Maghnie M, Mantovani G, Marazuela M, Raverot G, Scarpa A, Schilbach K, Theodoropoulou M, van Santen HM, Zatelli MC.","Eur J Endocrinol. 2025 Oct 17;193(Supplement_2):ii84-ii96. doi: 10.1093/ejendo/lvaf035.","Castano JP","Eur J Endocrinol","2025","2025/10/17","","","10.1093/ejendo/lvaf035"
"41102856","Trace element-linked DNA methylation sites and their association with type 2 diabetes and cardiovascular diseases: EPIC-Potsdam cohort study","Eroglu B, Eichelmann F, Kuxhaus O, Kipp AP, Schwerdtle T, Haase H, Schomburg L, Schulze MB.","Clin Epigenetics. 2025 Oct 16;17(1):172. doi: 10.1186/s13148-025-01991-0.","Eroglu B","Clin Epigenetics","2025","2025/10/17","PMC12529838","","10.1186/s13148-025-01991-0"
"41102398","Mapping the temporal landscape of breast cancer using epigenetic entropy","Monyak DL, Holloway ST, Gumbert GJ, Grimm LJ, Hwang ES, Marks JR, Shibata D, Ryser MD.","Commun Biol. 2025 Oct 16;8(1):1477. doi: 10.1038/s42003-025-08867-2.","Monyak DL","Commun Biol","2025","2025/10/16","PMC12533048","","10.1038/s42003-025-08867-2"
"41102163","Chromatin remodeling restrains oncogenic functions in prostate cancer","Rosti V, Lembo G, Petrini C, Gorini F, Quadri R, Cordiglieri C, Mutarelli M, Salviato E, Casari E, Di Patrizio Soldateschi E, Montanari E, Albo G, Ripa F, Fasciani A, Crosti M, De Lorenzis E, Maggioni M, Vaira V, Vivo M, Ferrari F, Lanzuolo C.","Nat Commun. 2025 Oct 16;16(1):9174. doi: 10.1038/s41467-025-64213-4.","Rosti V","Nat Commun","2025","2025/10/16","PMC12531332","","10.1038/s41467-025-64213-4"
"41098715","Integrative analysis identifies TEAD4 as a universal prognostic biomarker in human cancers","Liu M, Song Y, Kang Y, Xue N, Zhao J, Jin Y, Liu C, Wang B.","Front Immunol. 2025 Sep 30;16:1688563. doi: 10.3389/fimmu.2025.1688563. eCollection 2025.","Liu M","Front Immunol","2025","2025/10/16","PMC12518352","","10.3389/fimmu.2025.1688563"
"41094424","Integrating urinary dual-gene methylation and VI-RADS score to predict residual tumors after TURBT in NMIBC: a nomogram-based model","Qi W, Qisheng L, Weiyang W, Yuan L, Linfeng L, Bin C, Yaqiang H.","BMC Urol. 2025 Oct 15;25(1):255. doi: 10.1186/s12894-025-01857-w.","Qi W","BMC Urol","2025","2025/10/15","PMC12522956","","10.1186/s12894-025-01857-w"
"41085960","Comprehensive Analysis of Epigenetic Signatures in Non-Small Cell Lung Cancer: Development and Validation of an Epigenetics-Based Prognostic Model for Drug Sensitivity Prediction","Li Y, Jiang N, Hao Y, Zhao Y, Zhao X, Zhang W.","FASEB J. 2025 Oct 31;39(20):e71130. doi: 10.1096/fj.202502391R.","Li Y","FASEB J","2025","2025/10/14","","","10.1096/fj.202502391R"
"41083503","High-Risk neuroblastoma therapeutics Topotecan and 13-cis-Retinoic acid modulate autophagy and induce DNA damage response in hematopoietic stem cells and monocytes","Lázničková P, Tidu F, Hrdý J, Boráková K, Hortová Kohoutková M, Frič J.","Sci Rep. 2025 Oct 13;15(1):35723. doi: 10.1038/s41598-025-19454-0.","Lázničková P","Sci Rep","2025","2025/10/13","PMC12518863","","10.1038/s41598-025-19454-0"
"41058458","INTERPLAY OF EPIGENETIC REGULATION OF KI-67 AND P53 BY MIR-21 AND MIR-34A IN CERVICAL INTRAEPITHELIAL NEOPLASIA","Svintsitska A, Lygyrda N, Svintsitskyi V, Borikun T, Kryzhanivska A.","Exp Oncol. 2025 Oct 7;47(2):223-229. doi: 10.15407/exp-oncology.2025.02.223.","Svintsitska A","Exp Oncol","2025","2025/10/08","","","10.15407/exp-oncology.2025.02.223"
"41057337","Epigenetic modulation of VEGF-A/VEGFR2 pathway genes in OC/TME axis driving genetic upregulation and tumor plasticity","Bhat A, Bashir Y, Baba AB, Dar S, Ahmad SZ, Yasin SB, Mir AW, Ahmad SN, Yousuf T, Afroze D.","Sci Rep. 2025 Oct 7;15(1):34856. doi: 10.1038/s41598-025-04483-6.","Bhat A","Sci Rep","2025","2025/10/07","PMC12504760","","10.1038/s41598-025-04483-6"
"41057303","Helicobacter pylori-induced aberrant methylation of ID4 mediated by DNMT3B drives gastric cancer progression via DEC1-SHH signaling pathway","Luan M, Zhu W, Feng Z, Jing F, Xing Y, Ma X, Wang Y, Ning B, Jia Y.","Cell Death Dis. 2025 Oct 7;16(1):713. doi: 10.1038/s41419-025-08042-9.","Luan M","Cell Death Dis","2025","2025/10/07","PMC12504463","","10.1038/s41419-025-08042-9"
"41054139","A histone acetylation-based predictive model for immunotherapy response and combinatorial targeting in cervical cancer","Zhang X, Li M, Wang K, Sun Z, Mao J, Zhang L, Ji R.","Medicine (Baltimore). 2025 Oct 3;104(40):e44946. doi: 10.1097/MD.0000000000044946.","Zhang X","Medicine (Baltimore)","2025","2025/10/07","PMC12499837","","10.1097/MD.0000000000044946"
"41053817","Identification of C4BPA as a genetically informed drug target in NSCLC: an integrative single-cell and multi-omics study based on the druggable genes","Xiao Z, Liu X, Tang W, Lv Y, Zhang T, Zhan X, Sun Q, Omindo WW, Wang Q, Zhang R, Ping W, Zhang N.","Hum Genomics. 2025 Oct 6;19(1):113. doi: 10.1186/s40246-025-00829-3.","Xiao Z","Hum Genomics","2025","2025/10/07","PMC12502296","","10.1186/s40246-025-00829-3"
"41053099","Adipose-tumor crosstalk in colorectal cancer: Identifying (Epi)genetic biomarkers for tumor progression and cachexia","Pesapane A, Capasso L, Del Sorbo MR, Scisciola L, Troiani T, Mele D, Franzese M, Puocci A, Tortorella G, Surina S, Fuschillo G, Caraglia F, De Falco V, Selvaggi L, Fontanella RA, Ciardiello F, Selvaggi F, Altucci L, Paolisso G, Barbieri M, Nebbioso A.","Cell Death Dis. 2025 Oct 6;16(1):675. doi: 10.1038/s41419-025-07982-6.","Pesapane A","Cell Death Dis","2025","2025/10/06","PMC12500986","","10.1038/s41419-025-07982-6"
"41044657","Epigenetic risk stratification in juvenile myelomonocytic leukemia by targeted methylation analysis of the BMP4 locus","Ghanjati F, Heck A, Lebrecht D, Nöllke P, Andresen F, Rotari N, Schoof M, Schönung M, Lipka DB, Dworzak M, De Moerloose B, Sukova M, Hasle H, Jahnukainen K, Malone A, Masetti R, Buechner J, Ussowicz M, Catala A, Turkiewicz D, de Haas V, Schmugge M, Erlacher M, Niemeyer CM, Flotho C.","Clin Epigenetics. 2025 Oct 3;17(1):154. doi: 10.1186/s13148-025-01983-0.","Ghanjati F","Clin Epigenetics","2025","2025/10/04","PMC12492826","","10.1186/s13148-025-01983-0"
"41044650","Highly variable genomic methylation in the Beckwith-Wiedemann syndrome associated with multi-locus imprinting disturbances","Cecere F, Pignata L, D'Angelo E, Giaccari C, Saadat A, Sparago A, Angelini C, Hay Mele B, Mussa A, Ferrero GB, Scarano G, Gori G, Di Maria E, Romano C, Tarani L, Piscopo C, Scala I, Tenorio JA, Lapunzina P, Cerrato F, Riccio A.","Clin Epigenetics. 2025 Oct 3;17(1):160. doi: 10.1186/s13148-025-01971-4.","Cecere F","Clin Epigenetics","2025","2025/10/04","PMC12495795","","10.1186/s13148-025-01971-4"
"41035034","Gastric microbiome in gastric cancer sequence depicts diverse microbial structures associated with cancer risk and prognosis","Shimogama T, Tahara T, Shijimaya T, Yamazaki J, Kobayashi S, Nakamura N, Takahashi Y, Tomiyama T, Honzawa Y, Fukui T, Naganuma M.","J Transl Med. 2025 Oct 1;23(1):1039. doi: 10.1186/s12967-025-07046-5.","Shimogama T","J Transl Med","2025","2025/10/02","PMC12487302","","10.1186/s12967-025-07046-5"
"41033106","DNA methylation mediates the immunosuppressive tumour microenvironment in metastatic endometrial clear cell carcinoma","Jia H, Chen Y, Ma G, Xu S, Zhang X, Chang L, Yang P, Xiao Y, Xia X, Zhang S, Tang H, Mou Y, Zhang L, Wang H, Bai J, Yi X, Xing X.","EBioMedicine. 2025 Oct;120:105954. doi: 10.1016/j.ebiom.2025.105954. Epub 2025 Sep 30.","Jia H","EBioMedicine","2025","2025/10/01","PMC12517104","","10.1016/j.ebiom.2025.105954"
"41028045","Epigenetic aging acceleration among World Trade Center-exposed community members","Tuminello S, Ashebir YA, Schroff C, Ramaswami S, Durmus N, Chen Y, Snuderl M, Shao Y, Reibman J, Arslan AA.","Sci Rep. 2025 Sep 30;15(1):33942. doi: 10.1038/s41598-025-10141-8.","Tuminello S","Sci Rep","2025","2025/09/30","PMC12484928","","10.1038/s41598-025-10141-8"
"41027193","PARP1 promoter hypermethylation promotes arsenic-induced skin damage by driving telomere dysfunction-mediated keratinocyte senescence","Yang L, Wang W, Zhang A.","Ecotoxicol Environ Saf. 2025 Oct 1;304:119108. doi: 10.1016/j.ecoenv.2025.119108. Epub 2025 Sep 29.","Yang L","Ecotoxicol Environ Saf","2025","2025/09/30","","","10.1016/j.ecoenv.2025.119108"
"41026782","Telomeres control human telomerase (TERT) expression through non-telomeric TRF2","Sengupta A, Vinayagamurthy S, Soni D, Deb R, Mukherjee AK, Dutta S, Jaiswal J, Yadav M, Sharma S, Bagri S, Roy SS, Poonia P, Singh A, Khanna D, Bhatt AKK, Sharma A, Saurav S, Motiani RK, Chowdhury S.","Elife. 2025 Sep 30;14:RP104045. doi: 10.7554/eLife.104045.","Sengupta A","Elife","2025","2025/09/30","PMC12483519","","10.7554/eLife.104045"
"41023574","Hypermethylated Long Non-Coding RNA Genes KCNK15-AS1, MAGI2-AS3, and SSTR5-AS1 in Ovarian Cancer and Their Diagnostic Potential","Lukina SS, Burdenyy AM, Filippova EA, Loginov VI, Pronina IV, Ivanova NA, Selezneva AD, Selezneva AD, Arzhanukhina NA, Kazubskaya TP, Kushlinskii NE, Braga EA.","Bull Exp Biol Med. 2025 Jul;179(3):342-347. doi: 10.1007/s10517-025-06486-9. Epub 2025 Sep 29.","Lukina SS","Bull Exp Biol Med","2025","2025/09/30","","","10.1007/s10517-025-06486-9"
"41022800","Genetic determinants of monocyte splicing are enriched for disease susceptibility loci","Nassiri I, Gilchrist JJ, Tong O, Lau E, Danielli S, Mossawi HA, Neville MJ, Knight JC, Fairfax BP.","Nat Commun. 2025 Sep 29;16(1):8616. doi: 10.1038/s41467-025-63624-7.","Nassiri I","Nat Commun","2025","2025/09/29","PMC12480492","","10.1038/s41467-025-63624-7"
"41016387","Aflatoxin B1 induces subtle but coordinated histone modifications in Epstein-Barr virus infected and non-infected Burkitt lymphoma cells","Michailidis TM, Corveleyn L, Almey R, Bader Y, Odongo GA, Herceg Z, Khoueiry R, Saeger S, Boevre M, Dhaenens M.","Environ Int. 2025 Oct;204:109813. doi: 10.1016/j.envint.2025.109813. Epub 2025 Sep 23.","Michailidis TM","Environ Int","2025","2025/09/28","","","10.1016/j.envint.2025.109813"
"41000388","Integrated analysis of single-cell and bulk transcriptomics reveals the prognostic value and underlying mechanisms of crotonylation in ovarian cancer","Li X, Wu W, Tao J, Guo X.","Front Immunol. 2025 Sep 10;16:1596080. doi: 10.3389/fimmu.2025.1596080. eCollection 2025.","Li X","Front Immunol","2025","2025/09/26","PMC12457283","","10.3389/fimmu.2025.1596080"
"41000380","Cytotoxic T lymphocyte-associated protein 4 gene polymorphisms are associated with ANCA-associated vasculitis in the Guangxi population of China","Bu K, Yang B, He P, Xue C.","Front Immunol. 2025 Sep 9;16:1631088. doi: 10.3389/fimmu.2025.1631088. eCollection 2025.","Bu K","Front Immunol","2025","2025/09/26","PMC12457943","","10.3389/fimmu.2025.1631088"
"40997874","Foundation model based multimodal transformer framework for survival analysis in HER2 stratified breast cancer","Li Q, Wang S, Safari M, Hu X, Qiu R, Roper J, Lin M, Lin J, Torres MA, Yang X.","Phys Med Biol. 2025 Oct 8;70(20). doi: 10.1088/1361-6560/ae0be6.","Li Q","Phys Med Biol","2025","2025/09/25","","","10.1088/1361-6560/ae0be6"
"40997682","Higher levels of host-cell DNA methylation markers ZNF582 and ASCL1 on anal smears are predictive for progression to anal cancer in patients with previous high-grade lesions","Ferré VM, Dupont A, Draullette M, Valette E, Collin G, Bucau M, Siproudhis L, Staumont G, Roy C, Hesselink AT, Bouchard D, Radenne S, Spindler L, Naji A, Bergeron C, Couvelard A, Descamps D, Steenbergen RDM, Charpentier C, Abramowitz L; AIN3 National Cohort; GREP.","EBioMedicine. 2025 Oct;120:105936. doi: 10.1016/j.ebiom.2025.105936. Epub 2025 Sep 24.","Ferré VM","EBioMedicine","2025","2025/09/25","PMC12508813","","10.1016/j.ebiom.2025.105936"
"40984004","Gut microbiota-mediated targeting of EHMT2 in individuals of European ancestry: A novel therapeutic approach for Alzheimer's disease","Yan Y, Pan Y, Lu S, Kou J, Chen X, Zeng W, Luo D, Qiu L, Zhang H, Chen D.","J Alzheimers Dis. 2025 Oct;107(4):1575-1593. doi: 10.1177/13872877251372945. Epub 2025 Sep 22.","Yan Y","J Alzheimers Dis","2025","2025/09/22","","","10.1177/13872877251372945"
"40983577","Caregiving stress and biological aging measured by epigenetic clocks: protocol for a scoping review","Lee LJ, Son E, Butera G, Park J, Hussain T, Wallen GR.","BMJ Open. 2025 Sep 22;15(9):e095895. doi: 10.1136/bmjopen-2024-095895.","Lee LJ","BMJ Open","2025","2025/09/22","PMC12458698","","10.1136/bmjopen-2024-095895"
"40962798","RBM39 degrader invigorates innate immunity to eradicate neuroblastoma despite cancer cell plasticity","Singh S, Fang J, Jin H, Van De Velde LA, Cortes A, Chen J, Natarajan S, Poon E, Wu Q, Morton CL, Woolard MA, Quarni W, Steele JA, Connelly JP, He L, Thorne R, Turner G, Confer T, Johnson M, Caufield WV, Freeman BB 3rd, Lockey T, Murphy AJ, Murray PJ, Owa T, Pruett-Miller SM, Wang R, Chesler L, Park JR, Davidoff AM, Easton J, Chen X, Thomas PG, Yang J.","Nat Commun. 2025 Sep 17;16(1):8287. doi: 10.1038/s41467-025-63979-x.","Singh S","Nat Commun","2025","2025/09/17","PMC12443969","","10.1038/s41467-025-63979-x"
"40961678","Dietary short-chain fatty acid Sodium Butyrate orchestrates pro-apoptotic and anti-angiogenic pathways in HCC cells by targeting the novel SND1/hTERT axis","Charmanna SO, Karunakara SH, Srinivasa S, Panchakshari PM, Prakash M, Mehtani R, Kumar DP, Santhekadur PK.","Biochem Biophys Res Commun. 2025 Oct 10;784:152651. doi: 10.1016/j.bbrc.2025.152651. Epub 2025 Sep 14.","Charmanna SO","Biochem Biophys Res Commun","2025","2025/09/17","","","10.1016/j.bbrc.2025.152651"
"40952538","S1PR5 as a prognostic biomarker in colon cancer: insights into efferocytosis-related mechanisms and immune modulation","Pei A, Lu L, Wu X.","J Mol Histol. 2025 Sep 15;56(5):315. doi: 10.1007/s10735-025-10608-y.","Pei A","J Mol Histol","2025","2025/09/15","","","10.1007/s10735-025-10608-y"
"40943642","Cell-Free DNA Bisulfite Sequencing Reveals Epithelial-Mesenchymal Transition Signatures for Breast Cancer","Jeon MS, Ding Z, Pei C, Li J, Xie L, Sauter E, Zhang KK.","Int J Mol Sci. 2025 Sep 7;26(17):8723. doi: 10.3390/ijms26178723.","Jeon MS","Int J Mol Sci","2025","2025/09/13","PMC12429146","","10.3390/ijms26178723"
"40939530","Multi-omics investigation of Bisphenol A in gastrointestinal carcinogenesis: a network toxicology and molecular docking approach","Guan J, Yang K, Chen T, Li Z, Gao Y, Huang Y, Zhou R, Huang Z, Du Y, Li T, Zhuang B, Rong X.","Environ Int. 2025 Sep;203:109785. doi: 10.1016/j.envint.2025.109785. Epub 2025 Sep 8.","Guan J","Environ Int","2025","2025/09/12","","","10.1016/j.envint.2025.109785"
"40935222","PCGMMF: a prediction method for breast cancer prognostic recurrence and metastasis risk based on enhanced multimodal feature fusion","Du W, Gao L, Xu X, Yao Y, Li Z.","J Biomed Inform. 2025 Oct;170:104907. doi: 10.1016/j.jbi.2025.104907. Epub 2025 Sep 9.","Du W","J Biomed Inform","2025","2025/09/11","","","10.1016/j.jbi.2025.104907"
"40924347","Targeting the Epigenetic Remodeler GCN5 Prevents Vascular Oxidative Stress and Endothelial Dysfunction in Obesity: Insights in Patients with Cardiometabolic Disease","Costantino S, Mohammed S, Mengozzi A, Duranti E, Delfine V, Geiger MA, Hamdani N, Taddei S, Masi S, Virdis A, Paneni F.","High Blood Press Cardiovasc Prev. 2025 Sep;32(5):577-589. doi: 10.1007/s40292-025-00739-4. Epub 2025 Sep 8.","Costantino S","High Blood Press Cardiovasc Prev","2025","2025/09/09","PMC12474637","","10.1007/s40292-025-00739-4"
"40897307","Bibliometric and visualization analysis of cancer associated with intestinal flora through genetics and epigenetics from 1991 to 2024","Li Y, Shi K, Qi H, Cui W, Cai Q, Yan T, Zhuo B, He W.","Chin Clin Oncol. 2025 Aug;14(4):39. doi: 10.21037/cco-25-13.","Li Y","Chin Clin Oncol","2025","2025/09/02","","","10.21037/cco-25-13"
"40890601","A novel SWI/SNF complex promotes triple-negative breast cancer progression","Sheng WY, Zhu Y, Liu SQ, Huang QY, Qian WF, Cheng JL, Huang HH, Wang WJ, Meng Y.","Cell Mol Biol Lett. 2025 Sep 1;30(1):105. doi: 10.1186/s11658-025-00788-6.","Sheng WY","Cell Mol Biol Lett","2025","2025/09/01","PMC12403323","","10.1186/s11658-025-00788-6"
"40886387","STAT3/Snail Signaling and Progression of Hypoxia Tolerance in Breast Cancer Cells","Andreeva OE, Sorokin DV, Scherbakov AM, Vinokurova SV, Kopnin PB, Elkina NV, Fedorova MD, Katargin AN, Elkin DS, Krasil'nikov MA.","Biochemistry (Mosc). 2025 Aug;90(8):1064-1076. doi: 10.1134/S0006297925601315.","Andreeva OE","Biochemistry (Mosc)","2025","2025/08/31","","","10.1134/S0006297925601315"
"40869316","Vitamin D as an Epigenetic Regulator: A Hypothetical Mechanism for Cancer Prevention via Inhibition of Oncogenic lncRNA HOTAIR","Trujano-Camacho S, Pulido-Capiz Á, García-González V, López-Urrutia E, Pérez-Plasencia C.","Int J Mol Sci. 2025 Aug 19;26(16):7997. doi: 10.3390/ijms26167997.","Trujano-Camacho S","Int J Mol Sci","2025","2025/08/28","PMC12386503","","10.3390/ijms26167997"
"40858599","Peripheral blood DNA methylation predicts the early onset of primary tumor in TP53 mutation carriers","Subasri V, Brew B, Laverty B, Erdman L, Guha T, Hansford JR, Cairney E, Portwine C, Elser C, Finlay JL, Nichols KE, Anson J, Kohlmann W, Gong H, Lees J, Alon N, Brunga L, Villani A, de Andrade KC, Khincha PP, Savage SA, Schiffman JD, Pugh TJ, Malkin D, Goldenberg A.","Nat Commun. 2025 Aug 26;16(1):7976. doi: 10.1038/s41467-025-62894-5.","Subasri V","Nat Commun","2025","2025/08/26","PMC12381258","","10.1038/s41467-025-62894-5"
"40864336","Integration of Multi-omics Data Based on Deep Learning for Subtyping of Low-Grade Glioma","Li H, Li M, Sun Y, Yu E, Pan J, Wu Y, Lu Z, Wo H, Shao F, You D, Tang S, Zhao Y, Dai J, Yi H.","J Mol Neurosci. 2025 Aug 27;75(3):110. doi: 10.1007/s12031-025-02393-w.","Li H","J Mol Neurosci","2025","2025/08/27","","","10.1007/s12031-025-02393-w"
"40834023","Common molecular links and therapeutic insights between type 2 diabetes and kidney cancer","Ahmmed R, Islam MA, Hasan MT, Sarker A, Ali MA, Islam MS, Sultana MZ, Mollah MNH.","PLoS One. 2025 Aug 20;20(8):e0330619. doi: 10.1371/journal.pone.0330619. eCollection 2025.","Ahmmed R","PLoS One","2025","2025/08/20","PMC12367126","","10.1371/journal.pone.0330619"
"40830169","DNA methylation patterns associated with prior tuberculosis infection in people with HIV","Baluku JB, Namiiro S, Zawedde DK, Namanda B, Kawalya H, Najjingo I, Geoffrey W, Niyonzima N, Bogere N, Nuwagira E, Rhein J, Jones N, Kraef C, Shaughnessy M, Chauhan A, Nankya I, Mfinanga S, Gerson S, Kirenga B.","Sci Rep. 2025 Aug 19;15(1):30349. doi: 10.1038/s41598-025-15532-5.","Baluku JB","Sci Rep","2025","2025/08/19","PMC12365075","","10.1038/s41598-025-15532-5"
"40827617","Methylation-based alcohol consumption scores as prognostic biomarkers in colorectal cancer: Insights from a population-based cohort","Yuan T, Tagscherer KE, Roth W, Bewerunge-Hudler M, Brobeil A, Kloor M, Bläker H, Brenner H, Hoffmeister M.","Int J Cancer. 2025 Dec 15;157(12):2521-2531. doi: 10.1002/ijc.70086. Epub 2025 Aug 19.","Yuan T","Int J Cancer","2025","2025/08/19","PMC12541559","","10.1002/ijc.70086"
"40825417","Genome-wide alterations of DNA methylation and hydroxymethylation in uroepithelial cells revealed potential carcinogenicity of halobenzoquinone disinfection byproducts","Zhao X, Du M, Guo P, Zhao J, Zhu L, Wang W.","Environ Pollut. 2025 Nov 1;384:127001. doi: 10.1016/j.envpol.2025.127001. Epub 2025 Aug 16.","Zhao X","Environ Pollut","2025","2025/08/18","","","10.1016/j.envpol.2025.127001"
"40820938","Development of a prognostic risk model for clear cell renal cell carcinoma by systematic evaluation of DNA methylation markers: an update after ISUP/WHO 2022 classification","Odeh S, Samarska I, Matoso A, Baldewijns MM, Hulsbergen-van de Kaa CA, Zur Hausen A, van Engeland M, Schouten LJ, Smits KM.","J Pathol Clin Res. 2025 Sep;11(5):e70030. doi: 10.1002/2056-4538.70030.","Odeh S","J Pathol Clin Res","2025","2025/08/18","PMC12358803","","10.1002/2056-4538.70030"
"40814833","Multiple Loci DNA Methylation Profiling for Rapid Colorectal Cancer Diagnosis Based on a Smartphone-Integrated Microfluidic Biosensing Platform","Cai S, Shi K, Ji A, Long Y, Wang X, Zhang Y, Zhou N.","Anal Chem. 2025 Aug 26;97(33):18343-18354. doi: 10.1021/acs.analchem.5c03822. Epub 2025 Aug 15.","Cai S","Anal Chem","2025","2025/08/15","","","10.1021/acs.analchem.5c03822"
"40813526","Prognostic and therapeutic implications related to glycosylation profiles of cancer-associated fibroblasts in colorectal cancer: insights from single-cell and bulk transcriptomics","Chen K, Huang H, Hu Z, Zhu Y, Yao Y, Wang Y, Chen J, Li Y, Li D, Wei P.","Funct Integr Genomics. 2025 Aug 15;25(1):169. doi: 10.1007/s10142-025-01675-1.","Chen K","Funct Integr Genomics","2025","2025/08/14","PMC12354152","","10.1007/s10142-025-01675-1"
"40806487","Self-Normalizing Multi-Omics Neural Network for Pan-Cancer Prognostication","Waqas A, Tripathi A, Ahmed S, Mukund A, Farooq H, Johnson JO, Stewart PA, Naeini M, Schabath MB, Rasool G.","Int J Mol Sci. 2025 Jul 30;26(15):7358. doi: 10.3390/ijms26157358.","Waqas A","Int J Mol Sci","2025","2025/08/14","PMC12347193","","10.3390/ijms26157358"
"40796804","Epigenetic control of topoisomerase 1 activity presents a cancer vulnerability","Lee TH, Qiao CX, Kuzin V, Shi Y, Farkas M, Zhao Z, Ramanarayanan V, Wu T, Guan T, Zhou X, Corujo D, Buschbeck M, Baranello L, Oberdoerffer P.","Nat Commun. 2025 Aug 12;16(1):7458. doi: 10.1038/s41467-025-62598-w.","Lee TH","Nat Commun","2025","2025/08/12","PMC12343833","","10.1038/s41467-025-62598-w"
"40791616","Serum levels of per- and polyfluoroalkylated substances and methylation of DNA from peripheral blood","Omichessan H, Dragic D, Perduca V, Truong T, Polidoro S, Kvaskoff M, Cano-Sancho G, Antignac JP, Baglietto L, Mancini FR, Severi G.","Front Public Health. 2025 Jul 28;13:1621495. doi: 10.3389/fpubh.2025.1621495. eCollection 2025.","Omichessan H","Front Public Health","2025","2025/08/12","PMC12336190","","10.3389/fpubh.2025.1621495"
"40791581","Combining the DNA methylation markers of circulating tumor cells with immune infiltrating cells to assess recurrence and prognosis and to suggest a therapeutic strategy in stage III-IV colorectal cancer","Zhou J, Ye D, Li Y, Lai X, Cui W, He W, Yu L, Wu J, Yan G, Lei C, Wang W.","Front Immunol. 2025 Jul 28;16:1607548. doi: 10.3389/fimmu.2025.1607548. eCollection 2025.","Zhou J","Front Immunol","2025","2025/08/12","PMC12336224","","10.3389/fimmu.2025.1607548"
"40770637","N6-methyladenosine-modified circDCP2 promotes carbon black nanoparticle-induced malignancy in human bronchial epithelial cells via PI3K-AKT pathway and macrophage homeostasis","Qin S, Chen K, Chen S, Chen X, Hu Y, Peng W, Pan Z, Ji X, Pang P, Luo Q, Liu W.","J Nanobiotechnology. 2025 Aug 7;23(1):555. doi: 10.1186/s12951-025-03632-3.","Qin S","J Nanobiotechnology","2025","2025/08/07","PMC12329977","","10.1186/s12951-025-03632-3"
"40764366","Analysis of the prognostic and immune role of MCM6 in pan-cancer and experimental validation in lung adenocarcinoma cells","Liao M, Li C, Lv J, Yang R, Li J, Wu K, Zhang J, Zhu Q, Shi Y, Zhang X.","Sci Rep. 2025 Aug 5;15(1):28648. doi: 10.1038/s41598-025-13598-9.","Liao M","Sci Rep","2025","2025/08/05","PMC12325616","","10.1038/s41598-025-13598-9"
"40759888","Virus-human chromatin interactions reorganise 3D genome and hijack KDM5B for promoting metastasis in nasopharyngeal carcinoma","Chung DL, Hou Z, Wang Y, Islam KA, Liu S, Liu J, Chow LK, Wong YY, Chak CP, Zhang Y, Gong L, Qi Z, Cheng KW, Yu Z, Feng P, Huang Z, Ngan RK, Guan X, Ng WT, Liu Z, Tsang AC, Kwong DL, Lee AW, Lee VH, Chen H, Xia Y, Dai W.","Nat Commun. 2025 Aug 4;16(1):7149. doi: 10.1038/s41467-025-61597-1.","Chung DL","Nat Commun","2025","2025/08/04","PMC12322282","","10.1038/s41467-025-61597-1"
"40757819","Integrating cell-free DNA methylation of SEPT9 and SFRP2 into a machine learning model for early diagnosis of HCC","Wang D, Dai Z, Bai M, Liu D, Feng Y, Sun Q, Zhang T, Han L, Wang R, Zhu J, Hong W, Li W.","Biomark Med. 2025 Aug;19(16):737-745. doi: 10.1080/17520363.2025.2541574. Epub 2025 Aug 4.","Wang D","Biomark Med","2025","2025/08/04","PMC12416165","","10.1080/17520363.2025.2541574"
