PMID,Title,Authors,Citation,First Author,Journal/Book,Publication Year,Create Date,PMCID,NIHMS ID,DOI
"39848689","Stratification system with dual human endogenous retroviruses for predicting immunotherapy efficacy in metastatic clear-cell renal cell carcinoma","Lu X, Vano YA, Su X, Verkarre V, Sun CM, Cheng W, Xu L, Yan F, Kotti S, Fridman WH, Sautes-Fridman C, Oudard S, Malouf GG.","J Immunother Cancer. 2025 Jan 22;13(1):e010386. doi: 10.1136/jitc-2024-010386.","Lu X","J Immunother Cancer","2025","2025/01/23","PMC11784120","","10.1136/jitc-2024-010386"
"39844333","DNA methylation profiling at base-pair resolution reveals unique epigenetic features of early-onset colorectal cancer in underrepresented populations","Li JS, Riggins K, Yang L, Chen C, Castro P, Alfarkh W, Zarrin-Khameh N, Scheurer ME, Creighton CJ, Musher B, Li W, Shen L.","Clin Epigenetics. 2025 Jan 22;17(1):11. doi: 10.1186/s13148-025-01817-z.","Li JS","Clin Epigenetics","2025","2025/01/23","PMC11753045","","10.1186/s13148-025-01817-z"
"39835657","Glutamine, Serine and Glycine at Increasing Concentrations Regulate Cisplatin Sensitivity in Gastric Cancer by Posttranslational Modifications of KDM4A","Fu J, Ni Y, Hu Y, Tang W, Fu J, Wang Y, Yu S, Xu W.","Mol Carcinog. 2025 Apr;64(4):703-715. doi: 10.1002/mc.23881. Epub 2025 Jan 21.","Fu J","Mol Carcinog","2025","2025/01/21","","","10.1002/mc.23881"
"39833322","Differential effects of β-hydroxybutyrate and α-ketoglutarate on HCT-116 colorectal cancer cell viability under normoxic and hypoxic low-glucose conditions: exploring the role of SRC, HIF1α, ACAT1, and SIRT2 genes","Badameh P, Akhlaghi Tabar F, Mohammadipoor N, Rezaei R, Ranjkesh R, Maleki MH, Vakili O, Shafiee SM.","Mol Genet Genomics. 2025 Jan 20;300(1):14. doi: 10.1007/s00438-024-02211-9.","Badameh P","Mol Genet Genomics","2025","2025/01/20","","","10.1007/s00438-024-02211-9"
"39823205","Cannabis vaping elicits transcriptomic and metabolomic changes involved in inflammatory, oxidative stress, and cancer pathways in human bronchial epithelial cells","Arlen MT, Patterson SJ, Page MK, Liu R, Caruana V, Wilson ET, Laporte SA, Goniewicz ML, Harris CS, Eidelman DH, Baglole CJ.","Am J Physiol Lung Cell Mol Physiol. 2025 Mar 1;328(3):L478-L496. doi: 10.1152/ajplung.00131.2024. Epub 2025 Jan 17.","Arlen MT","Am J Physiol Lung Cell Mol Physiol","2025","2025/01/17","","","10.1152/ajplung.00131.2024"
"39818101","Dual effect of targeting LSD1 on the invasiveness and the mechanical response of acute lymphoblastic leukemia cells","González-Novo R, Armesto M, González-Murillo Á, Dreger M, Hurlstone AFL, Benito A, Samaniego R, Ramírez M, Redondo-Muñoz J.","Biomed Pharmacother. 2025 Feb;183:117830. doi: 10.1016/j.biopha.2025.117830. Epub 2025 Jan 15.","González-Novo R","Biomed Pharmacother","2025","2025/01/16","","","10.1016/j.biopha.2025.117830"
"39796173","Research on Prediction of Multiple Degenerative Diseases and Biomarker Screening Based on DNA Methylation","Tian R, Zhang H, Wang C, Zhou S, Zhang L, Wang H.","Int J Mol Sci. 2025 Jan 1;26(1):313. doi: 10.3390/ijms26010313.","Tian R","Int J Mol Sci","2025","2025/01/11","PMC11719970","","10.3390/ijms26010313"
"39792289","Modeling DNA methyltransferase function to predict epigenetic correlation patterns in healthy and cancer cells","Tse AY, Spakowitz AJ.","Proc Natl Acad Sci U S A. 2025 Jan 14;122(2):e2415530121. doi: 10.1073/pnas.2415530121. Epub 2025 Jan 10.","Tse AY","Proc Natl Acad Sci U S A","2025","2025/01/10","PMC11745332","","10.1073/pnas.2415530121"
"39792009","Selective adsorption of unmethylated DNA on ZnO nanowires for separation of methylated DNA","Musa M, Zhu Z, Takahashi H, Shinoda W, Baba Y, Yasui T.","Lab Chip. 2025 Mar 25;25(7):1637-1646. doi: 10.1039/d4lc00893f.","Musa M","Lab Chip","2025","2025/01/10","","","10.1039/d4lc00893f"
"39791266","Modeling Malignant Mesothelioma in Genetically Engineered Mice","Kadariya Y, Sementino E, Hua X, Kappes DJ, Testa JR.","Curr Protoc. 2025 Jan;5(1):e70086. doi: 10.1002/cpz1.70086.","Kadariya Y","Curr Protoc","2025","2025/01/10","PMC11737608","NIHMS2044136","10.1002/cpz1.70086"
"39789354","Short-chain fatty acid metabolites propionate and butyrate are unique epigenetic regulatory elements linking diet, metabolism and gene expression","Nshanian M, Gruber JJ, Geller BS, Chleilat F, Lancaster SM, White SM, Alexandrova L, Camarillo JM, Kelleher NL, Zhao Y, Snyder MP.","Nat Metab. 2025 Jan;7(1):196-211. doi: 10.1038/s42255-024-01191-9. Epub 2025 Jan 9.","Nshanian M","Nat Metab","2025","2025/01/09","PMC11774759","","10.1038/s42255-024-01191-9"
"39788295","Association between dietary fructose and human colon DNA methylation: implication for racial disparities in colorectal cancer risk using a cross-sectional study","Devall MA, Eaton S, Hu G, Sun X, Jakum E, Venkatesh S, Powell SM, Yoshida C, Weisenberger DJ, Cooper GS, Willis J, Ebrahim S, Zoellner J, Casey G, Li L.","Am J Clin Nutr. 2025 Mar;121(3):522-534. doi: 10.1016/j.ajcnut.2025.01.005. Epub 2025 Jan 7.","Devall MA","Am J Clin Nutr","2025","2025/01/09","PMC11923427","","10.1016/j.ajcnut.2025.01.005"
"39780110","Identification of cancer cell-intrinsic biomarkers associated with tumor progression and characterization of SFTA3 as a tumor suppressor in lung adenocarcinomas","Zhao Y, Zhou C, Zuo L, Yan H, Gu Y, Liu H, Yu G, Zhou X.","BMC Cancer. 2025 Jan 8;25(1):36. doi: 10.1186/s12885-024-13395-z.","Zhao Y","BMC Cancer","2025","2025/01/08","PMC11707868","","10.1186/s12885-024-13395-z"
"39766220","NALCN Promoter Methylation as a Biomarker for Metastatic Risk in a Cohort of Non-Small Cell Lung Cancer Patients","Thanou E, Lontra D, Balgouranidou I, Efthimiadou E, Delipetrou A, Tsaroucha E, Theodosiou M, Georgoulias V, Kotsakis A, Lianidou E, Markou A.","Biomolecules. 2024 Nov 27;14(12):1514. doi: 10.3390/biom14121514.","Thanou E","Biomolecules","2024","2025/01/08","PMC11673096","","10.3390/biom14121514"
"39764911","Toxicological Impact of Chronic Chlorpyrifos Exposure: DNA Damage and Epigenetic Alterations Induces Neoplastic Transformation of Liver Cells","Balakrishnan P, Thirunavukarasu K, Tamizhmani P, Michael AA, Velusamy T.","Biochem Biophys Res Commun. 2025 Feb;746:151287. doi: 10.1016/j.bbrc.2025.151287. Epub 2025 Jan 2.","Balakrishnan P","Biochem Biophys Res Commun","2025","2025/01/07","","","10.1016/j.bbrc.2025.151287"
"39754971","Exploration of rutin derivatives as potential inhibitors of prostate cancer signaling pathways: A comprehensive in-silico study","Modanwal S, Mishra A, Mishra N.","Biochem Biophys Res Commun. 2025 Feb;746:151279. doi: 10.1016/j.bbrc.2024.151279. Epub 2024 Dec 31.","Modanwal S","Biochem Biophys Res Commun","2025","2025/01/04","","","10.1016/j.bbrc.2024.151279"
"39748587","Pityriasis Lichenoides Chronica-Like Mycosis Fungoides: A Diagnostic Dilemma","Pawar PM, Mandli SJ, Solanki K, Sutaria AH.","Skinmed. 2024 Dec 31;22(6):482-484. eCollection 2024.","Pawar PM","Skinmed","2024","2025/01/03","","",""
"39730941","Therapy response monitoring in blood plasma from esophageal adenocarcinoma patients using cell-free DNA methylation profiling","Schoofs K, Ferro Dos Santos MR, De Wilde J, Roelandt S, Van de Velde S, Decruyenaere P, Meuris L, Thas O, Philippron A, Depypere L, Nafteux P, Vanommeslaeghe H, Van Daele E, Pattyn P, Vandesompele J, De Preter K.","Sci Rep. 2024 Dec 28;14(1):31112. doi: 10.1038/s41598-024-82325-7.","Schoofs K","Sci Rep","2024","2024/12/28","PMC11681053","","10.1038/s41598-024-82325-7"
"39725880","Detection of a novel DNA methylation marker panel for esophageal cancer diagnosis using circulating tumor DNA","Zheng Y, Xing W, BingWei, Liu X, Liang G, Yuan D, Yang K, Wang W, Chen D, Ma J.","BMC Cancer. 2024 Dec 26;24(1):1578. doi: 10.1186/s12885-024-13301-7.","Zheng Y","BMC Cancer","2024","2024/12/26","PMC11670433","","10.1186/s12885-024-13301-7"
"39725264","KCNJ15 inhibits chemical-induced lung carcinogenesis and progression through GNB1 mediated Hippo pathway","Chen HQ, Wang N, Zeng Y, Shi Y, Zhang Z, Li JY, Li YW, Deng SW, Zhou ZY, Liu WB.","Toxicology. 2025 Feb;511:154034. doi: 10.1016/j.tox.2024.154034. Epub 2024 Dec 25.","Chen HQ","Toxicology","2025","2024/12/26","","","10.1016/j.tox.2024.154034"
"39724000","Prognostic importance of direct assignment of parent of origin via long-read genome and epigenome sequencing in retinoblastoma","Stacey AW, Nakamichi K, Huey J, Stevens J, Waligorski N, Crotty EE, Van Gelder RN, Mustafi D.","JCI Insight. 2024 Dec 26;10(4):e188216. doi: 10.1172/jci.insight.188216.","Stacey AW","JCI Insight","2024","2024/12/26","PMC11949030","","10.1172/jci.insight.188216"
"39719705","3D chromatin hubs as regulatory units of identity and survival in human acute leukemia","Gambi G, Boccalatte F, Rodriguez Hernaez J, Lin Z, Nadorp B, Polyzos A, Tan J, Avrampou K, Inghirami G, Kentsis A, Apostolou E, Aifantis I, Tsirigos A.","Mol Cell. 2025 Jan 2;85(1):42-60.e7. doi: 10.1016/j.molcel.2024.11.040. Epub 2024 Dec 23.","Gambi G","Mol Cell","2025","2024/12/25","PMC11934262","NIHMS2060688","10.1016/j.molcel.2024.11.040"
"39716470","DNAJC12 downregulation induces neuroblastoma progression via increased histone H4K5 lactylation","Yang Y, Wen J, Lou S, Han Y, Pan Y, Zhong Y, He Q, Zhang Y, Mo X, Ma J, Shen N.","J Mol Cell Biol. 2025 May 22;16(11):mjae056. doi: 10.1093/jmcb/mjae056.","Yang Y","J Mol Cell Biol","2025","2024/12/24","PMC12096081","","10.1093/jmcb/mjae056"
"39716176","Attenuated sex-related DNA methylation differences in cancer highlight the magnitude bias mediating existing disparities","Zhou J, Li M, Chen Y, Wang S, Wang D, Suo C, Chen X.","Biol Sex Differ. 2024 Dec 23;15(1):106. doi: 10.1186/s13293-024-00682-4.","Zhou J","Biol Sex Differ","2024","2024/12/23","PMC11664931","","10.1186/s13293-024-00682-4"
"39711312","Identification of ALDH7A1 as a DNA-methylation-driven gene in lung squamous cell carcinoma","Liang G, He J, Chen T, Zhang L, Yu K, Shen W.","Ann Med. 2025 Dec;57(1):2442529. doi: 10.1080/07853890.2024.2442529. Epub 2024 Dec 23.","Liang G","Ann Med","2025","2024/12/23","PMC11703541","","10.1080/07853890.2024.2442529"
"39709423","Single-cell transcriptomics reveal the prognostic roles of epithelial and T cells and DNA methylation-based prognostic models in pancreatic cancer","Du J, Zhao Y, Dong J, Li P, Hu Y, Fan H, Zhang F, Sun L, Zhang D, Zhang Y.","Clin Epigenetics. 2024 Dec 21;16(1):188. doi: 10.1186/s13148-024-01800-0.","Du J","Clin Epigenetics","2024","2024/12/21","PMC11663335","","10.1186/s13148-024-01800-0"
"39705824","A combined model of circulating tumor DNA methylated SHOX2/SCT/HOXA7 and clinical features facilitates the discrimination of malignant from benign pulmonary nodules","He L, Zhang B, Zhou C, Zhao Q, Wang Y, Fang Y, Hu Z, Lv P, Miao L, Yang R, Yang J.","Lung Cancer. 2025 Jan;199:108064. doi: 10.1016/j.lungcan.2024.108064. Epub 2024 Dec 16.","He L","Lung Cancer","2025","2024/12/20","","","10.1016/j.lungcan.2024.108064"
"39704700","cfDNA UniFlow: a unified preprocessing pipeline for cell-free DNA data from liquid biopsies","Röner S, Burkard L, Speicher MR, Kircher M.","Gigascience. 2024 Jan 2;13:giae102. doi: 10.1093/gigascience/giae102.","Röner S","Gigascience","2024","2024/12/20","PMC11659977","","10.1093/gigascience/giae102"
"39701407","Cancer memory as a mechanism to establish malignancy","Lissek T.","Biosystems. 2025 Jan;247:105381. doi: 10.1016/j.biosystems.2024.105381. Epub 2024 Dec 17.","Lissek T","Biosystems","2025","2024/12/19","","","10.1016/j.biosystems.2024.105381"
"39699292","Differential DNA Methylation in the Benign and Cancerous Prostate Tissue of African American and European American Men","Chernoff M, Demanelis K, Gillard M, Delgado D, Gleason KJ, Oliva M, Chen L, Williams A, Szmulewitz RZ, Vander Griend DJ, Pierce BL.","Cancer Epidemiol Biomarkers Prev. 2025 Mar 3;34(3):428-438. doi: 10.1158/1055-9965.EPI-24-0288.","Chernoff M","Cancer Epidemiol Biomarkers Prev","2025","2024/12/19","","","10.1158/1055-9965.EPI-24-0288"
"39693801","Associations of HLA-G 3'UTR polymorphisms and increased HLA-G expression with gastric cancer susceptibility and prognosis","Zemni I, Bortolotti D, Dhouioui S, Baroudi S, Ferjani M, Nasri I, Zenzri Y, Rahman MA, Harrath AH, Rizzo R, Boujelbene N, Zidi I.","Immunobiology. 2025 Jan;230(1):152864. doi: 10.1016/j.imbio.2024.152864. Epub 2024 Dec 15.","Zemni I","Immunobiology","2025","2024/12/18","","","10.1016/j.imbio.2024.152864"
"39686532","Colposcopy referrals and CIN3 detection after triage by host cell DNA methylation and/or HPV genotyping in HPV positive women with low-grade cytology from a population-based Dutch primary HPV screening trial","Verhoef L, Bleeker MCG, Polman N, Kroon KR, Steenbergen RDM, Ebisch RMF, Melchers WJG, Bekkers RLM, Molijn AC, van Kemenade F, Meijer CJLM, Heideman DAM, Berkhof J.","Int J Cancer. 2025 Mar 1;156(5):1065-1073. doi: 10.1002/ijc.35289. Epub 2024 Dec 16.","Verhoef L","Int J Cancer","2025","2024/12/17","PMC11701402","","10.1002/ijc.35289"
"39669580","Multi-omics characterization and machine learning of lung adenocarcinoma molecular subtypes to guide precise chemotherapy and immunotherapy","Zhang Y, Wang Y, Qian H.","Front Immunol. 2024 Nov 28;15:1497300. doi: 10.3389/fimmu.2024.1497300. eCollection 2024.","Zhang Y","Front Immunol","2024","2024/12/13","PMC11634853","","10.3389/fimmu.2024.1497300"
"39660659","Uncovering the lung cancer mechanisms through the chromosome structural ensemble characteristics and nucleation seeds","Chu WT, Wang J.","J Chem Phys. 2024 Dec 14;161(22):225101. doi: 10.1063/5.0238929.","Chu WT","J Chem Phys","2024","2024/12/11","","","10.1063/5.0238929"
"39655428","Biological Age Acceleration and Colonic Polyps in Persons under Age 50","Brown CM, Yow MV, Kumar S.","Cancer Prev Res (Phila). 2025 Feb 3;18(2):57-62. doi: 10.1158/1940-6207.CAPR-24-0317.","Brown CM","Cancer Prev Res (Phila)","2025","2024/12/10","PMC11790358","NIHMS2039367","10.1158/1940-6207.CAPR-24-0317"
"39652453","Functional effect of adiponectin and body composition assessment in lung cancer subjects after video-assisted thoracoscopic surgery (VATS) lobectomy","Messina G, Natale G, Fiorelli A, Puca MA, Moscatelli F, Monda V, Monda M, Di Domenico M, Corte CMD, Marsala G, Vicario G, Dalia C, Bassi P, Leonardi B, De Maria A, Monda A, Messina G, Messina A, Polito R.","Thorac Cancer. 2025 Jan;16(2):e15260. doi: 10.1111/1759-7714.15260. Epub 2024 Dec 9.","Messina G","Thorac Cancer","2025","2024/12/09","PMC11738959","","10.1111/1759-7714.15260"
"39642870","DNA-methylation age and accelerated epigenetic aging in blood as a tumor marker for predicting breast cancer susceptibility","Jung SY, Yu H, Deng Y, Pellegrini M.","Aging (Albany NY). 2024 Dec 5;16(22):13534-13562. doi: 10.18632/aging.206169. Epub 2024 Dec 5.","Jung SY","Aging (Albany NY)","2024","2024/12/06","PMC11723651","","10.18632/aging.206169"
"39633428","Multimodal genome-wide survey of progressing and non-progressing breast ductal carcinoma in-situ","Debeljak M, Cho S, Downs BM, Considine M, Avin-McKelvey B, Wang Y, Perez PN, Grizzle WE, Hoadley KA, Lynch CF, Hernandez BY, van Diest PJ, Cozen W, Hamilton AS, Hawes D, Gabrielson E, Cimino-Mathews A, Florea LD, Cope L, Umbricht CB.","Breast Cancer Res. 2024 Dec 4;26(1):178. doi: 10.1186/s13058-024-01927-1.","Debeljak M","Breast Cancer Res","2024","2024/12/05","PMC11616160","","10.1186/s13058-024-01927-1"
"39633048","Ageing limits stemness and tumorigenesis by reprogramming iron homeostasis","Zhuang X, Wang Q, Joost S, Ferrena A, Humphreys DT, Li Z, Blum M, Krause K, Ding S, Landais Y, Zhan Y, Zhao Y, Chaligne R, Lee JH, Carrasco SE, Bhanot UK, Koche RP, Bott MJ, Katajisto P, Soto-Feliciano YM, Pisanic T, Thomas T, Zheng D, Wong ES, Tammela T.","Nature. 2025 Jan;637(8044):184-194. doi: 10.1038/s41586-024-08285-0. Epub 2024 Dec 4.","Zhuang X","Nature","2025","2024/12/05","","","10.1038/s41586-024-08285-0"
"39631069","Single-cell multiomics reveal divergent effects of DNMT3A- and TET2-mutant clonal hematopoiesis in inflammatory response","Mohammed Ismail W, Fernandez JA, Binder M, Lasho TL, Kim M, Geyer SM, Mazzone A, Finke CM, Mangaonkar AA, Lee JH, Wang L, Kim KH, Simon VA, Rakhshan Rohakthar F, Munankarmy A, Byeon SK, Schwager SM, Harrington JJ, Snyder MR, Robertson KD, Pandey A, Wieben ED, Chia N, Gaspar-Maia A, Patnaik MM.","Blood Adv. 2025 Jan 28;9(2):402-416. doi: 10.1182/bloodadvances.2024014467.","Mohammed Ismail W","Blood Adv","2025","2024/12/04","PMC11787483","","10.1182/bloodadvances.2024014467"
"39625179","Elucidating epigenetic landscape of gastric premalignant lesions through genome-wide mapping of 5-hydroxymethylcytosines: A 12-year median follow-up study","Luo Z, Li W, Zheng W, Shi Y, Ye M, Guo X, Fu K, Yan C, Wang B, Lv B, Mo S, Zhang H, Zhang J, He C, Luo F, Zhang W, Liu J.","Clin Transl Med. 2024 Dec;14(12):e70114. doi: 10.1002/ctm2.70114.","Luo Z","Clin Transl Med","2024","2024/12/03","PMC11613102","","10.1002/ctm2.70114"
"39624886","Smoking-independent DNA methylation markers for lung cancer risk: External validation in a large population-based cohort study","Zhao Z, Bhardwaj M, Fan Z, Li X, Schrotz-King P, Brenner H.","Cancer Sci. 2025 Mar;116(3):775-782. doi: 10.1111/cas.16414. Epub 2024 Dec 3.","Zhao Z","Cancer Sci","2025","2024/12/03","PMC11875777","","10.1111/cas.16414"
"39611913","Anticancer Properties of Garlic and Ginger Extract in Colon Cancer Cell Line","Fayed AM, S N H, Samy W, Bassiouny K, Abd-El-Aziz AA, AlKhafaf DMR, Shareef HK, AbdElrahman M, Aldhalmi AK, Obaida DS, Khalil H, Elbadee AA.","Asian Pac J Cancer Prev. 2024 Nov 1;25(11):3895-3905. doi: 10.31557/APJCP.2024.25.11.3895.","Fayed AM","Asian Pac J Cancer Prev","2024","2024/11/29","PMC11996100","","10.31557/APJCP.2024.25.11.3895"
"39604913","Colorectal cancer screening using a multi-locus blood-based assay targeting circulating tumor DNA methylation: a cross-sectional study in an average-risk population","Wang B, Zhang Y, Liu J, Deng B, Li Q, Liu H, Sui Y, Wang N, Xiao Q, Liu W, Chen Y, Li Y, Jia H, Yuan Q, Wang C, Pan W, Li F, Yang H, Wang Y, Ding Y, Xu D, Liu R, Fang JY, Wu J.","BMC Med. 2024 Nov 27;22(1):560. doi: 10.1186/s12916-024-03777-2.","Wang B","BMC Med","2024","2024/11/28","PMC11600563","","10.1186/s12916-024-03777-2"
"39603822","Triage performance of DNA methylation for women with high-risk human papillomavirus infection","Kong L, Xiao X, Wu H, You Y, Jin X, Liou Y, Liu P, Lang J, Li L.","Oncologist. 2025 Mar 10;30(3):oyae324. doi: 10.1093/oncolo/oyae324.","Kong L","Oncologist","2025","2024/11/27","PMC11954506","","10.1093/oncolo/oyae324"
"39602041","In silico screening of phytochemicals against chromatin modifier, SETD7 for remodeling of the immunosuppressive tumor microenvironment in renal cancer","Gadewal N, Patidar D, Natu A, Gupta S, Bastikar V.","Mol Divers. 2025 Oct;29(5):4359-4369. doi: 10.1007/s11030-024-11038-w. Epub 2024 Nov 27.","Gadewal N","Mol Divers","2025","2024/11/27","PMC12454513","","10.1007/s11030-024-11038-w"
"39601999","Slowed epigenetic aging in Olympic champions compared to non-champions","Radák Z, Aczél D, Fejes I, Mozaffaritabar S, Pavlik G, Komka Z, Balogh L, Babszki Z, Babszki G, Koltai E, McGreevy KM, Gordevicius J, Horvath S, Kerepesi C.","Geroscience. 2025 Apr;47(2):2555-2565. doi: 10.1007/s11357-024-01440-5. Epub 2024 Nov 27.","Radák Z","Geroscience","2025","2024/11/27","PMC11978583","","10.1007/s11357-024-01440-5"
"39601242","LINE-1 hypomethylation characterizes the inflammatory response in coeliac disease associated-intestinal mucosa and small bowel adenocarcinomas","Libera L, Vanoli A, Sahnane N, Adnan M, Guerini C, Arpa G, Bianchi PI, Lenti MV, Corazza GR, La Rosa S, Di Sabatino A, Furlan D.","J Pathol. 2025 Jan;265(1):99-109. doi: 10.1002/path.6371. Epub 2024 Nov 27.","Libera L","J Pathol","2025","2024/11/27","PMC11638666","","10.1002/path.6371"
"39600260","Identification of new tissue markers for the monitoring and standardization of penile cancer according to the degree of differentiation","Casanova-Martín C, Liviu Boaru D, Fraile-Martinez O, Garcia-Montero C, De Leon-Oliva D, De Castro-Martinez P, Gimeno-Longas MJ, Bujan J, García-Honduvilla N, Guijarro LG, Gragera R, Lopez-Gonzalez L, Saez MA, Ferrara-Coppola C, Baena-Romero V, Diaz-Pedrero R, Alvarez-Mon M, Toledo-Lobo MV, Ortega MA.","Histol Histopathol. 2025 Jul;40(7):1013-1039. doi: 10.14670/HH-18-846. Epub 2024 Nov 7.","Casanova-Martín C","Histol Histopathol","2025","2024/11/27","","","10.14670/HH-18-846"
"39600074","Lack of WDFY4 leads to impaired immune response and poor cancer prognosis","Bao H, Zhang C, Peng X, Jia J, Yang Y.","FASEB J. 2024 Nov 30;38(22):e70128. doi: 10.1096/fj.202302498RRR.","Bao H","FASEB J","2024","2024/11/27","PMC11599783","","10.1096/fj.202302498RRR"
"39595571","Single-Cell RNA-Seq Analysis Links DNMT3B and PFKFB4 Transcriptional Profiles with Metastatic Traits in Hepatoblastoma","Desterke C, Francés R, Monge C, Marchio A, Pineau P, Mata-Garrido J.","Biomolecules. 2024 Oct 31;14(11):1394. doi: 10.3390/biom14111394.","Desterke C","Biomolecules","2024","2024/11/27","PMC11591731","","10.3390/biom14111394"
"39592856","Understanding the biological processes of kidney carcinogenesis: an integrative multi-omics approach","Cortez Cardoso Penha R, Sexton Oates A, Senkin S, Park HA, Atkins J, Holcatova I, Hornakova A, Savic S, Ognjanovic S, Świątkowska B, Lissowska J, Zaridze D, Mukeria A, Janout V, Chabrier A, Cahais V, Cuenin C, Scelo G, Foll M, Herceg Z, Brennan P, Smith-Byrne K, Alcala N, Mckay JD.","Mol Syst Biol. 2024 Dec;20(12):1282-1302. doi: 10.1038/s44320-024-00072-3. Epub 2024 Nov 26.","Cortez Cardoso Penha R","Mol Syst Biol","2024","2024/11/26","PMC11612429","","10.1038/s44320-024-00072-3"
"39587706","Road traffic noise and breast cancer: DNA methylation in four core circadian genes","Thacher JD, Snigireva A, Dauter UM, Delaval MN, Oudin A, Mattisson K, Sørensen M, Borgquist S, Albin M, Broberg K.","Clin Epigenetics. 2024 Nov 25;16(1):168. doi: 10.1186/s13148-024-01774-z.","Thacher JD","Clin Epigenetics","2024","2024/11/26","PMC11590349","","10.1186/s13148-024-01774-z"
"39587369","Comprehensive single-cell aging atlas of healthy mammary tissues reveals shared epigenomic and transcriptomic signatures of aging and cancer","Angarola BL, Sharma S, Katiyar N, Kang HG, Nehar-Belaid D, Park S, Gott R, Eryilmaz GN, LaBarge MA, Palucka K, Chuang JH, Korstanje R, Ucar D, Anczukόw O.","Nat Aging. 2025 Jan;5(1):122-143. doi: 10.1038/s43587-024-00751-8. Epub 2024 Nov 25.","Angarola BL","Nat Aging","2025","2024/11/26","PMC11754115","","10.1038/s43587-024-00751-8"
"39585882","Exploring bacterial key genes and therapeutic agents for breast cancer among the Ghanaian female population: Insights from In Silico analyses","Kibria MK, Ali MA, Mollah MNH.","PLoS One. 2024 Nov 25;19(11):e0312493. doi: 10.1371/journal.pone.0312493. eCollection 2024.","Kibria MK","PLoS One","2024","2024/11/25","PMC11588272","","10.1371/journal.pone.0312493"
"39584911","Investigating the Matrix of Factor V Leiden (G1691A), Factor II Prothrombin (G2021A), MTHFR C677T and A1298G Polymorphisms in Greek Population: A Preliminary Study","Spanoudaki M, Itziou A, Cheimaras A, Tsiripidis O, Risvas G, Tsitlakidou N, Balis V.","Med Sci (Basel). 2024 Nov 5;12(4):61. doi: 10.3390/medsci12040061.","Spanoudaki M","Med Sci (Basel)","2024","2024/11/25","PMC11587029","","10.3390/medsci12040061"
"39578904","Epigenetic age and long-term cancer risk following a stroke","Suárez-Pérez A, Macias-Gómez A, Fernández-Pérez I, Vallverdú-Prats M, Cuadrado-Godia E, Giralt-Steinhauer E, Campanale M, Guisado-Alonso D, Rodríguez-Campello A, Jiménez-Balado J, Jiménez-Conde J, Ois A.","Genome Med. 2024 Nov 22;16(1):135. doi: 10.1186/s13073-024-01408-2.","Suárez-Pérez A","Genome Med","2024","2024/11/23","PMC11583382","","10.1186/s13073-024-01408-2"
"39575407","Plasma DNA methylation detection for early screening, diagnosis, and monitoring of esophageal adenocarcinoma and squamous cell carcinoma","Liu XJ, Pi GL, Wang S, Kai JD, Yu HF, Shi HW, Yu J, Zeng H.","World J Gastroenterol. 2024 Nov 21;30(43):4609-4619. doi: 10.3748/wjg.v30.i43.4609.","Liu XJ","World J Gastroenterol","2024","2024/11/22","PMC11572633","","10.3748/wjg.v30.i43.4609"
"39571735","LUC7L2 accelerates the growth of liver cancer cells by enhancing DNA damage repair via RRAS","Liu X, Xie S, Jiang X, Song S, Wang L, Li S, Lu D.","Cells Dev. 2024 Dec;180:203976. doi: 10.1016/j.cdev.2024.203976. Epub 2024 Nov 19.","Liu X","Cells Dev","2024","2024/11/21","","","10.1016/j.cdev.2024.203976"
"39571724","Dietary Pattern, Sputum DNA Methylation, and Lung Health: An Epidemiological Study in People Who Ever Smoked","Feng Y, Kang H, Sood A, Guest DD, Fung TT, Rowe CL, Picchi MA, Pankratz VS, Belinsky SA, Leng S.","Chest. 2025 May;167(5):1333-1345. doi: 10.1016/j.chest.2024.11.007. Epub 2024 Nov 19.","Feng Y","Chest","2025","2024/11/21","PMC12106961","","10.1016/j.chest.2024.11.007"
"39567612","Comprehensive analysis identifies endocrine fibroblast growth factors as promising prognostic markers for colorectal carcinoma","Rejali L, Piroozkhah M, Jahanbin M, Jalali P, Khanabadi B, Abkenar ED, Asghari Z, Hashemi M, Sadeghi A, Salehi Z, Nazemalhosseini-Mojarad E.","Sci Rep. 2024 Nov 20;14(1):28754. doi: 10.1038/s41598-024-79341-y.","Rejali L","Sci Rep","2024","2024/11/20","PMC11579457","","10.1038/s41598-024-79341-y"
"39560804","Association between the variations in metabolic pathways and oral cancer risk: results from a Pakistani case-control study","Shabbir A, Rashid MU, Awad EM, Naeemi H, Barisani-Asenbauer T, Malkani N.","Mol Biol Rep. 2024 Nov 19;51(1):1165. doi: 10.1007/s11033-024-10100-y.","Shabbir A","Mol Biol Rep","2024","2024/11/19","","","10.1007/s11033-024-10100-y"
