PMID,Title,Authors,Citation,First Author,Journal/Book,Publication Year,Create Date,PMCID,NIHMS ID,DOI
"40457471","Impact of DNA methylation on the recurrence risk of stage I non-small cell lung cancer with EGFR mutations","Li Y, Yang Z, Wu F, Liang Q, Herman JG, Brock MV, Liu W, Yu F, He X, Chen C.","Clin Epigenetics. 2025 Jun 2;17(1):90. doi: 10.1186/s13148-025-01899-9.","Li Y","Clin Epigenetics","2025","2025/06/02","PMC12131548","","10.1186/s13148-025-01899-9"
"40454483","PROX1 is an early driver of lineage plasticity in prostate cancer","Duan Z, Shi M, Kumaraswamy A, Lin D, Khokhani D, Wang Y, Zhang C, Flores D, Rodansky E, Swaim OA, Storck WK, Beck HN, Patel RA, Sayar E, Hanratty BP, Xue H, Dong X, Maylin ZR, Wan R, Quigley DA, Sjöström M, Hu YM, Zhao F, Xia Z, Cheng S, Yu X, Feng FY, Zhang L, Aggarwal R, Small EJ, Ravikumar V, Rao A, Bedi K, Lee JK, Morrissey C, Coleman I, Nelson PS, Corey E, Udager AM, Rebernick RJ, Cieslik MP, Chinnaiyan AM, Yates JA, Haffner MC, Wang Y, Alumkal JJ.","J Clin Invest. 2025 Jun 2;135(11):e187490. doi: 10.1172/JCI187490. eCollection 2025 Jun 2.","Duan Z","J Clin Invest","2025","2025/06/02","PMC12126232","","10.1172/JCI187490"
"40439417","CervicalMethDx: A Precision DNA Methylation Test to Identify Risk of High-Grade Intraepithelial Lesions in Cervical Cancer Screening Algorithms","Palmieri L, Zamuner FT, de Lima DG, Gosala K, Winkler E, Prashar Y, Purcell-Wiltz A, García-Negrón A, Ramos-Lopez A, Romaguera J, Trock BJ, Díaz-Montes T, Sidransky D, Brait M, Guerrero-Preston R.","Cancer Prev Res (Phila). 2025 Sep 2;18(9):531-540. doi: 10.1158/1940-6207.CAPR-25-0029.","Palmieri L","Cancer Prev Res (Phila)","2025","2025/05/29","PMC12402793","","10.1158/1940-6207.CAPR-25-0029"
"40437442","Cancer-associated fibroblasts-derived exosomal piR-35462 promotes the progression of oral squamous cell carcinoma via FTO/Twist1 pathway","Ye Y, Wu F, Li B, Ma H, Mai L, Peng Y, Feng X, Tan X, Fu M, Tan Y, Lan T, Wang R, Ren S, Li J, Chang S, Xie S.","BMC Oral Health. 2025 May 28;25(1):840. doi: 10.1186/s12903-025-06082-3.","Ye Y","BMC Oral Health","2025","2025/05/28","PMC12121191","","10.1186/s12903-025-06082-3"
"40435135","Integrative analysis of epigenetic subtypes in acute myeloid Leukemia: A multi-center study combining machine learning for prognostic and therapeutic insights","Li J, Wang S.","PLoS One. 2025 May 28;20(5):e0324380. doi: 10.1371/journal.pone.0324380. eCollection 2025.","Li J","PLoS One","2025","2025/05/28","PMC12118855","","10.1371/journal.pone.0324380"
"40434103","Contrasting interferon-mediated antiviral responses in human lung adenocarcinoma cells","Esparza M, El Zahed SS, Karakus U, Niederstrasser H, Gao B, Batten K, Shay JW, Posner B, Hirsch FR, Girard L, Huang LJ-s, Minna J, García-Sastre A, Fontoura BMA.","J Virol. 2025 Jun 17;99(6):e0046925. doi: 10.1128/jvi.00469-25. Epub 2025 May 28.","Esparza M","J Virol","2025","2025/05/28","PMC12172473","","10.1128/jvi.00469-25"
"40409520","Gut microbiota and well-being: A comprehensive summary of the special issue","Sen U.","Pharmacol Res. 2025 Jun;216:107791. doi: 10.1016/j.phrs.2025.107791. Epub 2025 May 21.","Sen U","Pharmacol Res","2025","2025/05/23","","","10.1016/j.phrs.2025.107791"
"40409268","Mapping chromatin interactions at melanoma susceptibility loci uncovers distant cis-regulatory gene targets","Thakur R, Xu M, Sowards H, Yon J, Jessop L, Myers T, Zhang T, Chari R, Long E, Rehling T, Hennessey R, Funderburk K, Yin J, Machiela MJ, Johnson ME, Wells AD, Chesi A, Grant SFA, Iles MM, Landi MT, Law MH; Melanoma Meta-Analysis Consortium; Choi J, Brown KM.","Am J Hum Genet. 2025 Jul 3;112(7):1625-1648. doi: 10.1016/j.ajhg.2025.04.015. Epub 2025 May 22.","Thakur R","Am J Hum Genet","2025","2025/05/23","PMC12256899","","10.1016/j.ajhg.2025.04.015"
"40402951","Epigenetic assessments of alcohol consumption predict mortality in smokers at risk for lung cancer in the prostate, lung, colorectal and ovarian cancer screening trial","Philibert R, Beach SRH, Mills JA, Dawes K, Hoffman RM, Sieren JC, Froehlich EM, deBlois KM, Long JD.","PLoS One. 2025 May 22;20(5):e0322783. doi: 10.1371/journal.pone.0322783. eCollection 2025.","Philibert R","PLoS One","2025","2025/05/22","PMC12097613","","10.1371/journal.pone.0322783"
"40392058","Risk-Based Triage Strategy by Extended HPV Genotyping for Women With LSIL Cytology: A Real-World Study","Ye C, Liu Y, Huang H, Chen R, Li Y, Zhang X, Fu Y, Feng L, Li X.","J Med Virol. 2025 May;97(5):e70404. doi: 10.1002/jmv.70404.","Ye C","J Med Virol","2025","2025/05/20","PMC12090974","","10.1002/jmv.70404"
"40388307","Multiomics analysis of umbilical cord hematopoietic stem cells from a multiethnic cohort of Hawaii reveals the intergenerational effect of maternal prepregnancy obesity and risks for cancers","Du Y, Benny PA, Shao Y, Schlueter RJ, Gurary A, Lum-Jones A, Lassiter CB, AlAkwaa FM, Tiirikainen M, Towner D, Ward WS, Garmire LX.","Gigascience. 2025 Jan 6;14:giaf039. doi: 10.1093/gigascience/giaf039.","Du Y","Gigascience","2025","2025/05/19","PMC12087453","","10.1093/gigascience/giaf039"
"40381378","Deciphering human endogenous retrovirus expression in colorectal cancers: exploratory analysis regarding prognostic value in liver metastases","Viot J, Loyon R, Adib N, Laurent-Puig P, de Reyniès A, André F, Monnien F, André T, Svrcek M, Turpin A, Selmani Z, Arnould L, Guyard L, Gilbert N, Boureux A, Adotevi O, Vienot A, Abdeljaoued S, Vernerey D, Borg C, Gautheret D.","EBioMedicine. 2025 Jun;116:105727. doi: 10.1016/j.ebiom.2025.105727. Epub 2025 May 16.","Viot J","EBioMedicine","2025","2025/05/17","PMC12145686","","10.1016/j.ebiom.2025.105727"
"40381190","M6A Methylation Regulators METTL3 and ALKBH5 are Risk Factors for EGFR-Mutant NSCLC","Zhi Y, Liu S, Chang X, Guan W, Li R, Liu Q, Chen J, Ling J, Zhao X, Liu A, Chen J, Zhang X, Huang Y.","Cancer Control. 2025 Jan-Dec;32:10732748251342685. doi: 10.1177/10732748251342685. Epub 2025 May 17.","Zhi Y","Cancer Control","2025","2025/05/17","PMC12085754","","10.1177/10732748251342685"
"40355770","Overexpression of KMT9α is associated with poor outcome in cholangiocarcinoma patients","Kinzler MN, Metzger E, Schulz R, Bankov K, Ramos-Triguero A, Schulze F, Gretser S, Abedin N, Wiegering A, Zeuzem S, Walter D, Reis H, Schüle R, Wild PJ.","J Cancer Res Clin Oncol. 2025 May 13;151(5):161. doi: 10.1007/s00432-025-06214-w.","Kinzler MN","J Cancer Res Clin Oncol","2025","2025/05/12","PMC12069507","","10.1007/s00432-025-06214-w"
"40350013","Per- and polyfluoroalkyl substances (PFAS) and microRNA: An epigenome-wide association study in firefighters","Furlong MA, Liu T, Jung A, Beitel S, Hughes J, Krause R, Graber JM, Calkins MM, Calafat AM, Botelho JC, Huentelman M, Gulotta J, Goodrich JM, Burgess JL.","Environ Res. 2025 Aug 15;279(Pt 2):121766. doi: 10.1016/j.envres.2025.121766. Epub 2025 May 9.","Furlong MA","Environ Res","2025","2025/05/11","PMC12203895","NIHMS2083291","10.1016/j.envres.2025.121766"
"40346709","Endometrial tumorigenesis involves epigenetic plasticity demarcating non-coding somatic mutations and 3D-genome alterations","Gregoricchio S, Kojic A, Hoogstraat M, Schuurman K, Stelloo S, Severson TM, O'Mara TA, Droog M, Singh AA, Glubb DM, Wessels LFA, Vermeulen M, van Leeuwen FE, Zwart W.","Genome Biol. 2025 May 9;26(1):124. doi: 10.1186/s13059-025-03596-5.","Gregoricchio S","Genome Biol","2025","2025/05/09","PMC12063248","","10.1186/s13059-025-03596-5"
"40342066","Demethylated miR-184 regulates EPB41L5 and downregulates Notch signaling to inhibit metastasis in colorectal cancer","Shu Y, Cai X, Yang X, Yang Y, Ge L.","J Mol Histol. 2025 May 8;56(3):152. doi: 10.1007/s10735-025-10434-2.","Shu Y","J Mol Histol","2025","2025/05/09","","","10.1007/s10735-025-10434-2"
"40340749","Distinct pathways for genetic and epigenetic predisposition in familial and bilateral Wilms tumor","Wegert J, Appenzeller S, Treger TD, Streitenberger H, Ziegler B, Bausenwein S, Vokuhl C, Parks C, Jüttner E, Gramlich S, Ernestus K, Warman SW, Fuchs J, Hubertus J, von Schweinitz D, Fröhlich B, Jorch N, Knöfler R, Friedrich C, Corbacioglu S, Frühwald MC, Pekrun A, Schneider DT, Faber J, Stursberg J, Metzler M, Welter N, Pritchard-Jones K, Graf N, Furtwängler R, Behjati S, Gessler M.","Genome Med. 2025 May 8;17(1):49. doi: 10.1186/s13073-025-01482-0.","Wegert J","Genome Med","2025","2025/05/09","PMC12060375","","10.1186/s13073-025-01482-0"
"40313132","Cancer-Type-Specific DNA Methylation Is a Source of Vulnerability in Liver Cancer Cells","Minowa K, Seki M, Nagai Y, Yamashita S.","Cancer Sci. 2025 Jul;116(7):2020-2031. doi: 10.1111/cas.70092. Epub 2025 May 2.","Minowa K","Cancer Sci","2025","2025/05/02","PMC12210040","","10.1111/cas.70092"
"40312834","Causal Associations Between Lipids, NPC1L1, and Liver Cancer Risk: Insights From Mendelian Randomization and Bioinformatics","Guo X, Wu L, Lai J, Wu Y, Chen D.","J Gastroenterol Hepatol. 2025 Jun;40(6):1602-1615. doi: 10.1111/jgh.16897. Epub 2025 May 1.","Guo X","J Gastroenterol Hepatol","2025","2025/05/02","","","10.1111/jgh.16897"
"40311780","Clinical Validation of a Noninvasive Multi-Omics Method for Multicancer Early Detection in Retrospective and Prospective Cohorts","Li S, Geng S, Chen Y, Ren Q, Luan Y, Liang W, Chang Y, Zhang L, Zhu D, Wu W, Zhang Y, Zhang L, Wang Y, Zhong G, Wei B, Ma J, Chang Y, Wang X, Li Z, Duan C, Long G, Mao M.","J Mol Diagn. 2025 Jul;27(7):657-670. doi: 10.1016/j.jmoldx.2025.04.001. Epub 2025 Apr 29.","Li S","J Mol Diagn","2025","2025/05/01","","","10.1016/j.jmoldx.2025.04.001"
"40307595","BRCA1/2 methylation and expression dynamics in hereditary breast and ovarian cancer: insights from gene, protein, and TCGA analysis","Tarapara B, Shah F.","Clin Transl Oncol. 2025 Oct;27(10):3911-3923. doi: 10.1007/s12094-025-03934-w. Epub 2025 Apr 30.","Tarapara B","Clin Transl Oncol","2025","2025/04/30","","","10.1007/s12094-025-03934-w"
"40305358","Germline PDCDL1 Gene Variants Are Associated with Increased Primary Melanoma Thickness","Córdoba-Lanús E, García-Pérez O, Melgar-Vilaplana L, Domínguez-de-Barros A, Fernández-de-Misa R.","Biomolecules. 2025 Apr 15;15(4):584. doi: 10.3390/biom15040584.","Córdoba-Lanús E","Biomolecules","2025","2025/04/30","PMC12024702","","10.3390/biom15040584"
"40301858","Integration of multi-omics data to unveil the molecular landscape and role of piRNAs in early-onset colorectal cancer","Zhou S, Yu L, Zhao J, Xiao Q, Sun J, Wang L, Zhou Y, Lu Y, Dunlop MG, Theodoratou E, Zhang H, Ding K, Li X.","BMC Med. 2025 Apr 29;23(1):250. doi: 10.1186/s12916-025-04074-2.","Zhou S","BMC Med","2025","2025/04/29","PMC12042543","","10.1186/s12916-025-04074-2"
"40301431","Mitochondrial membrane hyperpolarization modulates nuclear DNA methylation and gene expression through phospholipid remodeling","Mori MP, Lozoya OA, Brooks AM, Bortner CD, Nadalutti CA, Ryback B, Rickard BP, Overchuk M, Rizvi I, Rogasevskaia T, Huang KT, Hasan P, Hajnóczky G, Santos JH.","Nat Commun. 2025 Apr 29;16(1):4029. doi: 10.1038/s41467-025-59427-5.","Mori MP","Nat Commun","2025","2025/04/29","PMC12041266","","10.1038/s41467-025-59427-5"
"40298030","Disruption of DNA methylation underpins the neuroinflammation induced by targeted CNS radiotherapy","Millner TO, Panday P, Xiao Y, Nicholson JG, Boot JR, Arpe Z, Stevens PA, Rahman NN, Zhang X, Mein C, Kitchen N, McEvoy AW, McKintosh E, McKenna GS, Paraskevopoulos D, Zabet NR, Lewis R, Badodi S, Marino S.","Brain. 2025 Sep 3;148(9):3137-3152. doi: 10.1093/brain/awaf163.","Millner TO","Brain","2025","2025/04/29","PMC12404709","","10.1093/brain/awaf163"
"40295056","Contribution of Methylenetetrahydrofolate Reductase Genotypes to Brain Tumor Risk Determination in Taiwan","Chen CH, Chen CC, Chen XX, Chang WS, Tsai CW, Mong MC, Hsu SW, Bau DT.","Anticancer Res. 2025 May;45(5):1861-1870. doi: 10.21873/anticanres.17565.","Chen CH","Anticancer Res","2025","2025/04/28","","","10.21873/anticanres.17565"
"40294979","Identification of Common miRNAs Differentially Expressed in Periodontitis and Pancreatic Cancer","Sunnetci-Akkoyunlu D, Ugurtas C, Kulcu-Sarikaya N, Ozer T, Cine N, Eren-Keskin S, Kanli A, Savli H.","In Vivo. 2025 May-Jun;39(3):1422-1439. doi: 10.21873/invivo.13944.","Sunnetci-Akkoyunlu D","In Vivo","2025","2025/04/28","PMC12042002","","10.21873/invivo.13944"
"40288580","Randomized dose-response trial of n-3 fatty acids in hormone receptor negative breast cancer survivors - impact on breast adipose oxylipin and DNA methylation patterns","Frankhouser DE, DeWees T, Snodgrass IF, Cole RM, Steck S, Thomas D, Kalu C, Belury MA, Clinton SK, Newman JW, Yee LD.","Am J Clin Nutr. 2025 Jul;122(1):70-82. doi: 10.1016/j.ajcnut.2025.04.021. Epub 2025 Apr 25.","Frankhouser DE","Am J Clin Nutr","2025","2025/04/27","PMC12308080","","10.1016/j.ajcnut.2025.04.021"
"40285850","LINE-1 DNA methylation mediates smoking-related risk in site-specific urothelial carcinoma: a Taiwan case-control study","Lin CH, Hung PH, Chang CH, Chang H, Chung MC, Chang WC, Chung CJ.","Arch Toxicol. 2025 Jul;99(7):3035-3046. doi: 10.1007/s00204-025-04051-x. Epub 2025 Apr 26.","Lin CH","Arch Toxicol","2025","2025/04/26","PMC12198073","","10.1007/s00204-025-04051-x"
"40281443","Suppressor protein plasma levels and inflammatory indices in colorectal cancer patients","Chigvinadze N, Pantsulaia I, Lejava T, Aladashvili A, Atamashvili T, Khvichia N, Rekhviashvili K.","BMC Cancer. 2025 Apr 25;25(1):774. doi: 10.1186/s12885-025-14200-1.","Chigvinadze N","BMC Cancer","2025","2025/04/25","PMC12023565","","10.1186/s12885-025-14200-1"
"40280313","Pilot study on CpG methylation of the NRF2 promoter across different ages and sexes in healthy and lung cancer prediagnostic individuals","Hong KJ, Choi YJ, Kim J, Cho MC, Kim JH.","Free Radic Biol Med. 2025 Aug 1;235:86-94. doi: 10.1016/j.freeradbiomed.2025.04.036. Epub 2025 Apr 23.","Hong KJ","Free Radic Biol Med","2025","2025/04/25","","","10.1016/j.freeradbiomed.2025.04.036"
"40279344","Noninvasive prognostication of hepatocellular carcinoma based on cell-free DNA methylation","Hu R, Tran B, Li S, Stackpole ML, Zeng W, Zhou Y, Melehy A, Sadeghi S, Finn RS, Zhou XJ, Li W, Agopian VG.","PLoS One. 2025 Apr 25;20(4):e0321736. doi: 10.1371/journal.pone.0321736. eCollection 2025.","Hu R","PLoS One","2025","2025/04/25","PMC12026916","","10.1371/journal.pone.0321736"
"40260909","Identification of Eight Histone Methylation Modification Regulators Associated With Breast Cancer Prognosis","Cao YN, Li XH, Chen XJ, Xu KC, Zhang JY, Lin H, Liu YX.","IET Syst Biol. 2025 Jan-Dec;19(1):e70012. doi: 10.1049/syb2.70012.","Cao YN","IET Syst Biol","2025","2025/04/22","PMC12012758","","10.1049/syb2.70012"
"40259856","Etiome Study Using Molecular Epigenetic Markers and Lung Organoid in Korean School Meal Service Workers (Etiome Study in S-meal Workers): Study Protocol","Moon S, Sung S, Park SK.","J Prev Med Public Health. 2025 May;58(3):231-240. doi: 10.3961/jpmph.25.020. Epub 2025 Apr 10.","Moon S","J Prev Med Public Health","2025","2025/04/22","PMC12149841","","10.3961/jpmph.25.020"
"40259495","Accelerated Epigenetic Aging and Prospective Morbidity and Mortality Among U.S. Veterans","Bourassa KJ, Anderson L, Woolson S, Dennis PA, Garrett ME, Hair L, Dennis M, Sugden K, Williams B, Houts R, Calhoun PS, Naylor JC, Ashley-Koch AE, Beckham JC, Caspi A, Taylor GA, Hall KS, Moffitt TE, Kimbrel NA.","J Gerontol A Biol Sci Med Sci. 2025 Jun 10;80(7):glaf088. doi: 10.1093/gerona/glaf088.","Bourassa KJ","J Gerontol A Biol Sci Med Sci","2025","2025/04/22","PMC12199239","","10.1093/gerona/glaf088"
"40244633","From Therapy to Cancer Prevention Using HRD Testing on Patients with High-grade Ovarian Cancer","Tibiletti MG, Carnevali I, Facchi S, Pensotti V, Formenti G, Sahnane N, Libera L, Ronchi S, Volorio S, Pierotti MA, La Rosa S, Sessa F.","Cancer Prev Res (Phila). 2025 Jul 1;18(7):393-400. doi: 10.1158/1940-6207.CAPR-24-0474.","Tibiletti MG","Cancer Prev Res (Phila)","2025","2025/04/17","","","10.1158/1940-6207.CAPR-24-0474"
"40243746","GAS5 rs145204276 Ins/Del Polymorphism Is Associated with CRC Susceptibility in a Romanian Population","Mirea CS, Schenker M, Petre-Mandache B, Cucu MG, Camen GC, Vîlcea ID, Albu BC, Obleagă CV, Ciorbagiu MC, Streață I, Pleșea RM, Riza AL, Burada F.","Int J Mol Sci. 2025 Mar 27;26(7):3078. doi: 10.3390/ijms26073078.","Mirea CS","Int J Mol Sci","2025","2025/04/17","PMC11988689","","10.3390/ijms26073078"
"40243460","Diagnostic and Prognostic Value of hsa_piR_022710, hsa_piR_019822, and hsa_piR_020840 in Early-Stage Non-Small-Cell Lung Cancer: Implications for Recurrence and Survival in Squamous Cell Carcinoma Patients","He Y, Altuna-Coy A, Acosta-Plasencia M, Molins L, Sánchez-Lorente D, Martinez D, Díaz T, Na R, Marrades RM, Navarro A.","Int J Mol Sci. 2025 Mar 21;26(7):2870. doi: 10.3390/ijms26072870.","He Y","Int J Mol Sci","2025","2025/04/17","PMC11989015","","10.3390/ijms26072870"
"40241383","Exploring methylation signatures for high de novo recurrence risk in hepatocellular carcinoma","Kim DW, Park JH, Hong SK, Jung MH, Pyeon JO, Lee JY, Suh KS, Yi NJ, Choi Y, Lee KW, Kim YJ.","Clin Mol Hepatol. 2025 Apr;31(2):563-576. doi: 10.3350/cmh.2024.0899. Epub 2025 Jan 13.","Kim DW","Clin Mol Hepatol","2025","2025/04/17","PMC12016632","","10.3350/cmh.2024.0899"
"40241172","Colorectal cancer progression to metastasis is associated with dynamic genome-wide biphasic 5-hydroxymethylcytosine accumulation","Murcott B, Honig F, Halliwell DO, Tian Y, Robson JL, Manasterski P, Pinnell J, Dix-Peek T, Uribe-Lewis S, Ibrahim AEK, Sero J, Gurevich D, Nikolaou N, Murrell A.","BMC Biol. 2025 Apr 16;23(1):100. doi: 10.1186/s12915-025-02205-y.","Murcott B","BMC Biol","2025","2025/04/16","PMC12004686","","10.1186/s12915-025-02205-y"
"40240063","Precision risk stratification of primary gastric cancer after eradication of H. pylori by a DNA methylation marker: a multicentre prospective study","Yamada H, Abe S, Charvat H, Ando T, Maeda M, Murakami K, Oka S, Maekita T, Sugimoto M, Furuta T, Kaise M, Yamamichi N, Takamaru H, Sasaki A, Oda I, Nanjo S, Suzuki N, Sugiyama T, Kodama M, Mizukami K, Ito M, Kotachi T, Shimazu T, Yamamoto S, Ushijima T.","Gut. 2025 Aug 7;74(9):1410-1418. doi: 10.1136/gutjnl-2025-335039.","Yamada H","Gut","2025","2025/04/16","PMC12418579","","10.1136/gutjnl-2025-335039"
"40239196","Interventions to Reduce Serum Per- and Poly-Fluoroalkyl Substances Levels, Improve Cardiovascular Risk Profiles, and Improve Epigenetic Age Acceleration in US Firefighters: Protocol for Randomized Controlled Trial","Conner R, Porter C, Lutrick K, Beitel SC, Hollister J, Healy O, Kern KJ, Wardenaar F, Gulotta JJ, Jack K, Huentelman M, Burgess JL, Furlong M.","JMIR Res Protoc. 2025 Apr 16;14:e67120. doi: 10.2196/67120.","Conner R","JMIR Res Protoc","2025","2025/04/16","PMC12044307","","10.2196/67120"
"40238123","Cytologic DNA methylation for managing minimally abnormal cervical cancer screening results","Shang X, Kong L, You Y, Wu H, Liou Y, Jin X, Liu P, Lang J, Li L.","Int J Gynaecol Obstet. 2025 Oct;171(1):405-414. doi: 10.1002/ijgo.70167. Epub 2025 Apr 16.","Shang X","Int J Gynaecol Obstet","2025","2025/04/16","PMC12447664","","10.1002/ijgo.70167"
"40235333","Genetic variants of HOTAIR (rs920778) and miR-3117 (rs7512692) influence susceptibility to colorectal cancer in a Mexican population","Trujillo-Fernández YGV, Rodríguez-Torres DE, Tovar-Jácome CJ, Barros-Núñez P, Godínez-Rodríguez MY, Pérez-Bojórquez PJ, Flores-Martínez LA, Pineda-Razo TD, Marín-Contreras ME, Alcaraz-Wong AA, Mariscal-Ramirez I, Rosales-Reynoso MA.","Cell Mol Biol (Noisy-le-grand). 2025 Apr 15;71(3):31-41. doi: 10.14715/cmb/2025.71.3.4.","Trujillo-Fernández YGV","Cell Mol Biol (Noisy-le-grand)","2025","2025/04/16","","","10.14715/cmb/2025.71.3.4"
"40229748","Identification of m6 A-regulated ferroptosis biomarkers for prognosis in laryngeal cancer","Wang X, Zhang W, Liang K, Wang Y, Zhang J, Wang J, Li A, Yun Y, Liu H, Sun Y.","BMC Cancer. 2025 Apr 14;25(1):694. doi: 10.1186/s12885-025-14134-8.","Wang X","BMC Cancer","2025","2025/04/14","PMC11998228","","10.1186/s12885-025-14134-8"
"40228756","Downregulated granzyme M expression: implications for the immune system and prognosis of thyroid cancer","Pan J, Fu B, Huang S, Jiang Y, Zhou X, Zhou M, Yu Z, Geng X, Zhu Y, Zheng H, Gong Y, Huang D, Guo L.","Gene. 2025 Aug 15;961:149494. doi: 10.1016/j.gene.2025.149494. Epub 2025 Apr 12.","Pan J","Gene","2025","2025/04/14","","","10.1016/j.gene.2025.149494"
"40228145","Cis-Regulatory Alterations in FOXP4 Modulate Esophageal Cancer Susceptibility Induced by Chronic Alcohol Exposure","Niu S, Ma J, Liu S, Li Y, Yue X, Pan M, Song L, Wu Y, Yang Z, Tan Y, Gu L, Wang C, Chang J.","Cancer Res. 2025 Jul 15;85(14):2591-2607. doi: 10.1158/0008-5472.CAN-24-3839.","Niu S","Cancer Res","2025","2025/04/14","","","10.1158/0008-5472.CAN-24-3839"
"40221151","Memory-promoting function of miR-379-5p attenuates CD8(+) T cell exhaustion by targeting immune checkpoints","Lin YZ, Liu CH, Wu WR, Liao TY, Lee CC, Li HW, Chung FC, Shen YC, Zhuo GY, Liu LC, Cheng WC, Wang SC.","J Immunother Cancer. 2025 Apr 12;13(4):e010363. doi: 10.1136/jitc-2024-010363.","Lin YZ","J Immunother Cancer","2025","2025/04/12","PMC11997822","","10.1136/jitc-2024-010363"
"40209748","Prognostic Assessment and Analysis of Underlying Biological Mechanisms of Prostate Cancer Based on Estrogen-Related Genes","Zhang H, Fan MD, Hu Y, Yang Q, Jiang JW, Xu M.","Horm Metab Res. 2025 Apr;57(4):273-285. doi: 10.1055/a-2548-1568. Epub 2025 Apr 10.","Zhang H","Horm Metab Res","2025","2025/04/10","","","10.1055/a-2548-1568"
"40190762","The relationship between epigenetic biomarkers and the risk of diabetes and cancer: a machine learning modeling approach","Zhang S, Jin J, Xu B, Zheng Q, Mou H.","Front Public Health. 2025 Mar 21;13:1509458. doi: 10.3389/fpubh.2025.1509458. eCollection 2025.","Zhang S","Front Public Health","2025","2025/04/07","PMC11968389","","10.3389/fpubh.2025.1509458"
"40188654","Resveratrol interrupts Wnt/β-catenin signalling in cervical cancer by activating ten-eleven translocation 5-methylcytosine dioxygenase 1","Ren J, Xie L, Zhu X, Chen X, Wei L, Xu D, Qiao K, Min S, Ding Y, Tan Y.","Cytokine. 2025 Jun;190:156930. doi: 10.1016/j.cyto.2025.156930. Epub 2025 Apr 5.","Ren J","Cytokine","2025","2025/04/06","","","10.1016/j.cyto.2025.156930"
"40187215","Plasma tRNA-derived small RNAs mediated the association between benzo[a]pyrene exposure with lung cancer risk among Chinese adults from a case-control study","Xiao Y, Liu C, Guan X, Fu Y, Fu M, Hong S, Wang C, Zhou Y, Li Y, He M, Zhang X, Guo H.","Ecotoxicol Environ Saf. 2025 Apr 15;295:118129. doi: 10.1016/j.ecoenv.2025.118129. Epub 2025 Apr 5.","Xiao Y","Ecotoxicol Environ Saf","2025","2025/04/05","","","10.1016/j.ecoenv.2025.118129"
"40181048","The interaction between ΔNp63α and TAp63α, mediated by miR-205-5p, inhibits the migration of lung adenocarcinoma cells","Qobadi-Nasr S, Pourgholami MH, Mowla SJ.","Sci Rep. 2025 Apr 3;15(1):11501. doi: 10.1038/s41598-025-95206-4.","Qobadi-Nasr S","Sci Rep","2025","2025/04/03","PMC11968970","","10.1038/s41598-025-95206-4"
"40180954","Epigenetic mechanisms controlling human leukemia stem cells and therapy resistance","Takao S, Morell V, Uni M, Slavit A, Rha S, Cheng S, Schmalbrock LK, Brown FC, Beneyto-Calabuig S, Koche RP, Velten L, Kentsis A.","Nat Commun. 2025 Apr 3;16(1):3196. doi: 10.1038/s41467-025-58370-9.","Takao S","Nat Commun","2025","2025/04/03","PMC11968996","","10.1038/s41467-025-58370-9"
"40179807","The critical role of COL1A1 revealed by integrated bioinformatics analysis of differentially-expressed genes in colorectal cancer and inflammatory bowel disease","Pawlak M, Kałuzińska-Kołat Ż, Pasieka ZW, Kołat D, Płuciennik E.","Comput Biol Med. 2025 May;190:110116. doi: 10.1016/j.compbiomed.2025.110116. Epub 2025 Apr 3.","Pawlak M","Comput Biol Med","2025","2025/04/03","","","10.1016/j.compbiomed.2025.110116"
"40175335","Systems epigenetic approach towards non-invasive breast cancer detection","Herzog CMS, Theeuwes B, Jones A, Evans I, Bjørge L, Zikan M, Cibula D, Harbeck N, Colombo N, Pashayan N, Widschwendter M.","Nat Commun. 2025 Apr 2;16(1):3082. doi: 10.1038/s41467-024-53696-2.","Herzog CMS","Nat Commun","2025","2025/04/02","PMC11965495","","10.1038/s41467-024-53696-2"
"40169782","Nicotine promotes the progression and metastasis of non-small cell lung cancer by modulating the OTUB1-c-Myc-EZH2 axis","Huang H, Ding C, Zhao WH, Zhang HB, Zhao ZX, Li XG, Wang YJ, Chen PJ, Li BS, Li XB, Li YW, Liu HY, Chen J.","Acta Pharmacol Sin. 2025 Sep;46(9):2509-2521. doi: 10.1038/s41401-025-01527-5. Epub 2025 Apr 1.","Huang H","Acta Pharmacol Sin","2025","2025/04/01","PMC12373944","","10.1038/s41401-025-01527-5"
"40164799","Comprehensive multimodal and multiomic profiling reveals epigenetic and transcriptional reprogramming in lung tumors","Wu P, Liu Z, Zheng L, Du Y, Zhou Z, Wang W, Lu C.","Commun Biol. 2025 Mar 31;8(1):527. doi: 10.1038/s42003-025-07954-8.","Wu P","Commun Biol","2025","2025/03/31","PMC11958746","","10.1038/s42003-025-07954-8"
"40152245","SETBP1-R54P mutation promotes malignant transformation of cadmium-induced 16HBE cells by down-regulating circ_0007095 expression","Chen W, Liu Y, Li M, Wang Y, Shang K, Li R, Lin Q, Chen Y, Zeng H, Ling Y, Qin X, Hua Q, Zhang Y, Lin T, Zhou Y, Jiang Y.","Toxicol Sci. 2025 Jul 1;206(1):169-182. doi: 10.1093/toxsci/kfaf040.","Chen W","Toxicol Sci","2025","2025/03/28","","","10.1093/toxsci/kfaf040"
"40151107","Chemical Modification Coupled with Isothermal CRISPR-Based Assay for Sensitive Detection of DNA Hydroxymethylation","Zou G, Si P, Wang J, Yang M, Chen J, Liu C, Luo Z.","ACS Sens. 2025 Mar 28;10(3):2073-2079. doi: 10.1021/acssensors.4c03312. Epub 2025 Mar 1.","Zou G","ACS Sens","2025","2025/03/28","","","10.1021/acssensors.4c03312"
