PMID,Title,Authors,Citation,First Author,Journal/Book,Publication Year,Create Date,PMCID,NIHMS ID,DOI
"38908846","Generation Scotland: an update on Scotland's longitudinal family health study","Milbourn H, McCartney D, Richmond A, Campbell A, Flaig R, Robertson S, Fawns-Ritchie C, Hayward C, Marioni RE, McIntosh AM, Porteous DJ, Whalley HC, Sudlow C.","BMJ Open. 2024 Jun 21;14(6):e084719. doi: 10.1136/bmjopen-2024-084719.","Milbourn H","BMJ Open","2024","2024/06/22","PMC11340249","","10.1136/bmjopen-2024-084719"
"38908367","TERT activation targets DNA methylation and multiple aging hallmarks","Shim HS, Iaconelli J, Shang X, Li J, Lan ZD, Jiang S, Nutsch K, Beyer BA, Lairson LL, Boutin AT, Bollong MJ, Schultz PG, DePinho RA.","Cell. 2024 Jul 25;187(15):4030-4042.e13. doi: 10.1016/j.cell.2024.05.048. Epub 2024 Jun 21.","Shim HS","Cell","2024","2024/06/22","PMC11552617","NIHMS2023456","10.1016/j.cell.2024.05.048"
"38908277","Circular RNA circNIPBL regulates TP53-H179R mutations in NNK-induced bronchial epithelial carcinogenesis","Liu Y, Fang S, Lin T, Chen W, Chen Y, Wang Y, Xiao X, Zheng H, Liu L, Zhou J, Jiang Y, Hua Q, Jiang Y.","Environ Int. 2024 Aug;190:108829. doi: 10.1016/j.envint.2024.108829. Epub 2024 Jun 18.","Liu Y","Environ Int","2024","2024/06/22","","","10.1016/j.envint.2024.108829"
"38904462","Folate Metabolism and Risk of Childhood Acute Lymphoblastic Leukemia: A Genetic Pathway Analysis from the Childhood Cancer and Leukemia International Consortium","Metayer C, Spector LG, Scheurer ME, Jeon S, Scott RJ, Takagi M, Clavel J, Manabe A, Ma X, Hailu EM, Lupo PJ, Urayama KY, Bonaventure A, Kato M, Meirhaeghe A, Chiang CWK, Morimoto LM, Wiemels JL.","Cancer Epidemiol Biomarkers Prev. 2024 Sep 3;33(9):1248-1252. doi: 10.1158/1055-9965.EPI-24-0189.","Metayer C","Cancer Epidemiol Biomarkers Prev","2024","2024/06/21","PMC11369612","NIHMS2005956","10.1158/1055-9965.EPI-24-0189"
"38903931","FGL2 as a predictive biomarker for prognosis and immunotherapy in bladder cancer","Huang Z, Wang Z, Xu C, Yan Y, Cao X, Zhang F, Shen B.","Int J Med Sci. 2024 May 27;21(8):1447-1460. doi: 10.7150/ijms.91874. eCollection 2024.","Huang Z","Int J Med Sci","2024","2024/06/21","PMC11186416","","10.7150/ijms.91874"
"38902313","Sex-related DNA methylation is associated with inflammation and gene expression in the lungs of healthy individuals","Patel D, McElroy JP, Weng DY, Sahar K, Reisinger SA, Freudenheim JL, Wewers MD, Shields PG, Song MA.","Sci Rep. 2024 Jun 20;14(1):14280. doi: 10.1038/s41598-024-65027-y.","Patel D","Sci Rep","2024","2024/06/20","PMC11190195","","10.1038/s41598-024-65027-y"
"38891848","Exploring the DNA Methylation Profile of Genes Associated with Bladder Cancer in Bladder Tissue of Patients with Neurogenic Lower Urinary Tract Dysfunction","Koukourikis P, Papaioannou M, Pervana S, Apostolidis A.","Int J Mol Sci. 2024 May 23;25(11):5660. doi: 10.3390/ijms25115660.","Koukourikis P","Int J Mol Sci","2024","2024/06/19","PMC11171624","","10.3390/ijms25115660"
"38890593","Oral pimonidazole unveils clinicopathologic and epigenetic features of hypoxic tumour aggressiveness in localized prostate cancer","Ci X, Chen S, Zhu R, Zarif M, Jain R, Guo W, Ramotar M, Gong L, Xu W, Singh O, Mansouri S, Zadeh G, Wei GH, Xu W, Bristow R, Berlin A, Koritzinsky M, van der Kwast T, He HH.","BMC Cancer. 2024 Jun 18;24(1):744. doi: 10.1186/s12885-024-12505-1.","Ci X","BMC Cancer","2024","2024/06/18","PMC11186205","","10.1186/s12885-024-12505-1"
"38888515","Identification of a signature of histone modifiers in kidney renal clear cell carcinoma","Huang Y, Yang Z, Tang Y, Chen H, Liu T, Peng G, Huang X, He X, Mei M, Du C.","Aging (Albany NY). 2024 Jun 17;16(12):10489-10511. doi: 10.18632/aging.205944. Epub 2024 Jun 17.","Huang Y","Aging (Albany NY)","2024","2024/06/18","PMC11236308","","10.18632/aging.205944"
"38887155","Helicobacter Pylori-Enhanced hnRNPA2B1 Coordinates with PABPC1 to Promote Non-m(6)A Translation and Gastric Cancer Progression","Yu Y, Yang YL, Chen XY, Chen ZY, Zhu JS, Zhang J.","Adv Sci (Weinh). 2024 Aug;11(30):e2309712. doi: 10.1002/advs.202309712. Epub 2024 Jun 17.","Yu Y","Adv Sci (Weinh)","2024","2024/06/18","PMC11321670","","10.1002/advs.202309712"
"38879526","DNA methylation in peripheral blood is associated with renal aging and renal function decline: a national community study","Yang PL, Lai TS, Chou YH, Lai LC, Lin SL, Chen YM.","Clin Epigenetics. 2024 Jun 15;16(1):80. doi: 10.1186/s13148-024-01694-y.","Yang PL","Clin Epigenetics","2024","2024/06/15","PMC11180394","","10.1186/s13148-024-01694-y"
"38877387","The relationship between innate/adaptive immunity and gastrointestinal cancer : a multi-omics Mendelian randomization study","Lv CX, Zhou LP, Yang YB, Shi J, Dong FH, Wei HR, Shan YQ.","BMC Gastroenterol. 2024 Jun 14;24(1):197. doi: 10.1186/s12876-024-03284-x.","Lv CX","BMC Gastroenterol","2024","2024/06/14","PMC11177483","","10.1186/s12876-024-03284-x"
"38874986","Next-generation sequencing reveals that miR-16-5p, miR-19a-3p, miR-451a, and miR-25-3p cargo in plasma extracellular vesicles differentiates sedentary young males from athletes","Fernandez-Sanjurjo M, Pinto-Hernandez P, Dávalos A, Díaz-Martínez ÁE, Martín-Hernández R, Castilla-Silgado J, Toyos-Rodríguez C, Whitham M, Amado-Rodríguez L, Muñiz-Albaiceta G, Terrados N, Fernández-García B, Iglesias-Gutiérrez E.","Eur J Sport Sci. 2024 Jun;24(6):766-776. doi: 10.1002/ejsc.12087. Epub 2024 Mar 19.","Fernandez-Sanjurjo M","Eur J Sport Sci","2024","2024/06/14","PMC11235846","","10.1002/ejsc.12087"
"38869474","Cell-free DNA methylation patterns in aging and their association with inflamm-aging","Li SJ, Gao X, Wang ZH, Li J, Zeng LT, Dang YM, Ma YQ, Zhang LQ, Wang QY, Zhang YM, Liu HL, Qi RM, Cai JP.","Epigenomics. 2024;16(10):715-731. doi: 10.1080/17501911.2024.2340958. Epub 2024 May 15.","Li SJ","Epigenomics","2024","2024/06/13","PMC11318736","","10.1080/17501911.2024.2340958"
"38865940","DNA demethylase TET2-mediated reduction of HADHB expression contributes to cadmium-induced malignant progression of colorectal cancer","Li L, Jiang M, Wang W, Cao X, Ma Q, Han J, Liu Z, Huang Y, Chen Y.","Ecotoxicol Environ Saf. 2024 Jul 15;280:116579. doi: 10.1016/j.ecoenv.2024.116579. Epub 2024 Jun 11.","Li L","Ecotoxicol Environ Saf","2024","2024/06/12","","","10.1016/j.ecoenv.2024.116579"
"38863714","Integrated bioinformatics combined with machine learning to analyze shared biomarkers and pathways in psoriasis and cervical squamous cell carcinoma","Liu L, Yin P, Yang R, Zhang G, Wu C, Zheng Y, Wu S, Liu M.","Front Immunol. 2024 May 28;15:1351908. doi: 10.3389/fimmu.2024.1351908. eCollection 2024.","Liu L","Front Immunol","2024","2024/06/12","PMC11165063","","10.3389/fimmu.2024.1351908"
"38860458","Association between gut microbiota and CpG island methylator phenotype in colorectal cancer","Park PH, Keith K, Calendo G, Jelinek J, Madzo J, Gharaibeh RZ, Ghosh J, Sapienza C, Jobin C, Issa JJ.","Gut Microbes. 2024 Jan-Dec;16(1):2363012. doi: 10.1080/19490976.2024.2363012. Epub 2024 Jun 11.","Park PH","Gut Microbes","2024","2024/06/11","PMC11174071","","10.1080/19490976.2024.2363012"
"38851302","Molecular and epigenetic ex vivo profiling of testis cancer-associated fibroblasts and their interaction with germ cell tumor cells and macrophages","Stephan A, Suhrmann JH, Skowron MA, Che Y, Poschmann G, Petzsch P, Kresbach C, Wruck W, Pongratanakul P, Adjaye J, Stühler K, Köhrer K, Schüller U, Nettersheim D.","Matrix Biol. 2024 Sep;132:10-23. doi: 10.1016/j.matbio.2024.06.001. Epub 2024 Jun 6.","Stephan A","Matrix Biol","2024","2024/06/08","","","10.1016/j.matbio.2024.06.001"
"38848365","Epigenetic predictors of species maximum life span and other life-history traits in mammals","Li CZ, Haghani A, Yan Q, Lu AT, Zhang J, Fei Z, Ernst J, Yang XW, Gladyshev VN, Robeck TR, Chavez AS, Cook JA, Dunnum JL, Raj K, Seluanov A, Gorbunova V, Horvath S.","Sci Adv. 2024 Jun 7;10(23):eadm7273. doi: 10.1126/sciadv.adm7273. Epub 2024 Jun 7.","Li CZ","Sci Adv","2024","2024/06/07","PMC11160467","","10.1126/sciadv.adm7273"
"38847740","Systematic Characterization of DNA Methyltransferases Family in Tumor Progression and Antitumor Immunity","Huang F, Wu X, Du Q, Lin J, Ma W, Liu J.","Technol Cancer Res Treat. 2024 Jan-Dec;23:15330338241260658. doi: 10.1177/15330338241260658.","Huang F","Technol Cancer Res Treat","2024","2024/06/07","PMC11162131","","10.1177/15330338241260658"
"38840170","Colorectal cancer microbiome programs DNA methylation of host cells by affecting methyl donor metabolism","Liu Z, Zhang Q, Zhang H, Yi Z, Ma H, Wang X, Wang J, Liu Y, Zheng Y, Fang W, Huang P, Liu X.","Genome Med. 2024 Jun 5;16(1):77. doi: 10.1186/s13073-024-01344-1.","Liu Z","Genome Med","2024","2024/06/05","PMC11151592","","10.1186/s13073-024-01344-1"
"38840106","Integrated analysis of the role of PR/SET domain 14 in gastric cancer","Li X, Wang C, Wang Y, Chen X, Li Z, Wang J, Liu Y.","BMC Cancer. 2024 Jun 5;24(1):685. doi: 10.1186/s12885-024-12424-1.","Li X","BMC Cancer","2024","2024/06/05","PMC11151633","","10.1186/s12885-024-12424-1"
"38837897","The TERT Promoter is Polycomb-Repressed in Neuroblastoma Cells with Long Telomeres","Graham MK, Xu B, Davis C, Meeker AK, Heaphy CM, Yegnasubramanian S, Dyer MA, Zeineldin M.","Cancer Res Commun. 2024 Jun 20;4(6):1533-1547. doi: 10.1158/2767-9764.CRC-22-0287.","Graham MK","Cancer Res Commun","2024","2024/06/05","PMC11188873","","10.1158/2767-9764.CRC-22-0287"
"38832974","Prognostic value of genomic mutation signature associated with immune microenvironment in southern Chinese patients with esophageal squamous cell carcinoma","Zhou Y, Chu L, Li S, Chu X, Ni J, Jiang S, Pang Y, Zheng D, Lu Y, Lan F, Cai X, Yang X, Zhu Z.","Cancer Immunol Immunother. 2024 Jun 4;73(8):141. doi: 10.1007/s00262-024-03725-2.","Zhou Y","Cancer Immunol Immunother","2024","2024/06/04","PMC11150228","","10.1007/s00262-024-03725-2"
"38829766","Prognosis and diagnosis of prostate cancer based on hypergraph regularization sparse least partial squares regression algorithm","Huang RH, Ge ZL, Xu G, Zeng QM, Jiang B, Xiao GC, Xia W, Wu YT, Liao YF.","Aging (Albany NY). 2024 May 31;16(11):9599-9624. doi: 10.18632/aging.205889. Epub 2024 May 31.","Huang RH","Aging (Albany NY)","2024","2024/06/03","PMC11210239","","10.18632/aging.205889"
"38823583","Transcriptomic and epigenetic landscape of nimorazole-enhanced radiochemotherapy in head and neck cancer","Besso MJ, Bitto V, Koi L, Wijaya Hadiwikarta W, Conde-Lopez C, Euler-Lange R, Bonrouhi M, Schneider K, Linge A, Krause M, Baumann M, Kurth I.","Radiother Oncol. 2024 Oct;199:110348. doi: 10.1016/j.radonc.2024.110348. Epub 2024 May 31.","Besso MJ","Radiother Oncol","2024","2024/06/01","","","10.1016/j.radonc.2024.110348"
"38823395","Nucleotide depletion promotes cell fate transitions by inducing DNA replication stress","Do BT, Hsu PP, Vermeulen SY, Wang Z, Hirz T, Abbott KL, Aziz N, Replogle JM, Bjelosevic S, Paolino J, Nelson SA, Block S, Darnell AM, Ferreira R, Zhang H, Milosevic J, Schmidt DR, Chidley C, Harris IS, Weissman JS, Pikman Y, Stegmaier K, Cheloufi S, Su XA, Sykes DB, Vander Heiden MG.","Dev Cell. 2024 Aug 19;59(16):2203-2221.e15. doi: 10.1016/j.devcel.2024.05.010. Epub 2024 May 31.","Do BT","Dev Cell","2024","2024/06/01","PMC11444020","NIHMS2001186","10.1016/j.devcel.2024.05.010"
"38822599","Expanded phenotype and cancer risk in patients with Beckwith-Wiedemann spectrum caused by CDKN1C variants","George AM, Viswanathan A, Best LG, Monahan C, Limmina M, Ganguly A, Kalish JM.","Am J Med Genet A. 2024 Oct;194(10):e63777. doi: 10.1002/ajmg.a.63777. Epub 2024 Jun 1.","George AM","Am J Med Genet A","2024","2024/06/01","","","10.1002/ajmg.a.63777"
"38810730","Methylation Analysis to Detect CIN3+ in High-Risk Human Papillomavirus-Positive Self-Samples From the Population-Based Cervical Cancer Screening Program","de Waard J, Bhattacharya A, de Boer MT, van Hemel BM, Esajas MD, Vermeulen KM, de Bock GH, Schuuring E, Wisman GBA.","Mod Pathol. 2024 Aug;37(8):100528. doi: 10.1016/j.modpat.2024.100528. Epub 2024 May 27.","de Waard J","Mod Pathol","2024","2024/05/29","","","10.1016/j.modpat.2024.100528"
"38806109","BMSC derived EVs inhibit colorectal Cancer progression by transporting MAGI2-AS3 or something similar","Ma T, Wang M, Wang S, Hu H, Zhang X, Wang H, Wang G, Jin Y.","Cell Signal. 2024 Sep;121:111235. doi: 10.1016/j.cellsig.2024.111235. Epub 2024 May 26.","Ma T","Cell Signal","2024","2024/05/28","","","10.1016/j.cellsig.2024.111235"
"38805171","Prolactin receptor potentiates chemotherapy through miRNAs-induced G6PD/TKT inhibition in pancreatic cancer","Liao YN, Huang PQ, Pan H, Gai YZ, Zhan YF, Li SX, Nie HZ.","FASEB J. 2024 May 31;38(10):e23705. doi: 10.1096/fj.202302287RR.","Liao YN","FASEB J","2024","2024/05/28","","","10.1096/fj.202302287RR"
"38803501","Global research progress of gut microbiota and epigenetics: bibliometrics and visualized analysis","Tian S, Chen M.","Front Immunol. 2024 May 13;15:1412640. doi: 10.3389/fimmu.2024.1412640. eCollection 2024.","Tian S","Front Immunol","2024","2024/05/28","PMC11128553","","10.3389/fimmu.2024.1412640"
"38802425","A novel combinatorial approach using sulforaphane- and withaferin A-rich extracts for prevention of estrogen receptor-negative breast cancer through epigenetic and gut microbial mechanisms","Rahman MM, Wu H, Tollefsbol TO.","Sci Rep. 2024 May 27;14(1):12091. doi: 10.1038/s41598-024-62084-1.","Rahman MM","Sci Rep","2024","2024/05/27","PMC11130158","","10.1038/s41598-024-62084-1"
"38796789","Breast cancer clinical outcomes and tumor immune microenvironment: cross-dialogue of multiple epigenetic modification profiles","Teng C, Song X, Fan C, Man S, Hu Y, Hou Y, Xin T.","Aging (Albany NY). 2024 May 22;16(10):8998-9022. doi: 10.18632/aging.205853. Epub 2024 May 22.","Teng C","Aging (Albany NY)","2024","2024/05/26","PMC11164499","","10.18632/aging.205853"
"38795318","PCDHGC3 hypermethylation as a potential biomarker of intestinal neuroendocrine carcinomas","Cubiella T, Celada L, San-Juan-Guardado J, Rodríguez-Aguilar R, Suárez-Priede Á, Poch M, Dominguez F, Fernández-Vega I, Montero-Pavón P, Fraga MF, Nakatani Y, Takata S, Yachida S, Valdés N, Chiara MD.","J Pathol. 2024 Aug;263(4-5):418-428. doi: 10.1002/path.6291. Epub 2024 May 25.","Cubiella T","J Pathol","2024","2024/05/25","","","10.1002/path.6291"
"38782099","Analysis of MicroRNA-371-373 supports that a subset of spermatocytic tumors demonstrates biologic features similar to those of GCNIS-derived germ cell tumors","Lobo J, Tavares NT, Jerónimo C, Henrique R, Dvindenko E, Cornejo KM, Berney DM, Ulbright TM, Gupta S, Acosta AM.","Hum Pathol. 2024 Jun;148:66-71. doi: 10.1016/j.humpath.2024.05.005. Epub 2024 May 21.","Lobo J","Hum Pathol","2024","2024/05/23","","","10.1016/j.humpath.2024.05.005"
"38776382","CCDC12 gene methylation in peripheral blood as a potential biomarker for breast cancer detection","Liu J, Qu Y, Zhao Y, Liang F, Ji L, Wang Z, Li J, Zang Z, Huang H, Zhang J, Gu W, Dai L, Yang R.","Biomarkers. 2024 Jul;29(5):265-275. doi: 10.1080/1354750X.2024.2358302. Epub 2024 Jun 7.","Liu J","Biomarkers","2024","2024/05/22","","","10.1080/1354750X.2024.2358302"
"38775076","Association Between Vitamin B12 Intake and Mortality in Patients with Colorectal Cancer: The US National Health and Nutrition Examination Survey, 1999-2018","Zhou Y, Wang Q, Yin T, Zhao D, Zhou G, Sun X, Tan C, Zhou L, Yao S.","Nutr Cancer. 2024;76(7):619-627. doi: 10.1080/01635581.2024.2353938. Epub 2024 May 22.","Zhou Y","Nutr Cancer","2024","2024/05/22","","","10.1080/01635581.2024.2353938"
"38773738","Prevotella copri exhausts intrinsic indole-3-pyruvic acid in the host to promote breast cancer progression: inactivation of AMPK via UHRF1-mediated negative regulation","Su J, Lin X, Li D, Yang C, Lv S, Chen X, Yang X, Pan B, Xu R, Ren L, Zhang Y, Xie Y, Chen Q, Xia C.","Gut Microbes. 2024 Jan-Dec;16(1):2347757. doi: 10.1080/19490976.2024.2347757. Epub 2024 May 21.","Su J","Gut Microbes","2024","2024/05/22","PMC11123460","","10.1080/19490976.2024.2347757"
"38773655","Semimethylation is a feature of diffuse large B-cell lymphoma, and subgroups with poor prognosis are characterized by global hypomethylation and short telomere length","Carlund O, Thörn E, Osterman P, Fors M, Dernstedt A, Forsell MNE, Erlanson M, Landfors M, Degerman S, Hultdin M.","Clin Epigenetics. 2024 May 21;16(1):68. doi: 10.1186/s13148-024-01680-4.","Carlund O","Clin Epigenetics","2024","2024/05/22","PMC11110316","","10.1186/s13148-024-01680-4"
"38760444","Epigenetic activation of SOX11 is associated with recurrence and progression of ductal carcinoma in situ to invasive breast cancer","Treekitkarnmongkol W, Shah V, Kai K, Katayama H, Wong J, Ladha FA, Nguyen T, Menegaz B, Lu W, Yang F, Mino B, Tang X, Gagea M, Batra H, Raso MG, Wistuba II, Krishnamurthy S, Pinder SE, Sawyer EJ, Thompson AM, Sen S.","Br J Cancer. 2024 Jul;131(1):171-183. doi: 10.1038/s41416-024-02697-5. Epub 2024 May 17.","Treekitkarnmongkol W","Br J Cancer","2024","2024/05/17","PMC11231151","","10.1038/s41416-024-02697-5"
"38760334","An improved epigenetic counter to track mitotic age in normal and precancerous tissues","Zhu T, Tong H, Du Z, Beck S, Teschendorff AE.","Nat Commun. 2024 May 17;15(1):4211. doi: 10.1038/s41467-024-48649-8.","Zhu T","Nat Commun","2024","2024/05/17","PMC11101651","","10.1038/s41467-024-48649-8"
"38751238","Identifying genes associated with disease outcomes using joint sparse canonical correlation analysis-An application in renal clear cell carcinoma","Dutta D, Sen A, Satagopan JM.","Genet Epidemiol. 2024 Dec;48(8):414-432. doi: 10.1002/gepi.22566. Epub 2024 May 15.","Dutta D","Genet Epidemiol","2024","2024/05/16","PMC11589067","","10.1002/gepi.22566"
"38741204","Early detection and prognosis evaluation for hepatocellular carcinoma by circulating tumour DNA methylation: A multicentre cohort study","Guo DZ, Huang A, Wang YC, Zhou S, Wang H, Xing XL, Zhang SY, Cheng JW, Xie KH, Yang QC, Ma CC, Li Q, Chen Y, Su ZX, Fan J, Liu R, Liu XL, Zhou J, Yang XR.","Clin Transl Med. 2024 May;14(5):e1652. doi: 10.1002/ctm2.1652.","Guo DZ","Clin Transl Med","2024","2024/05/14","PMC11091019","","10.1002/ctm2.1652"
"38739012","High performance of the DNA methylation-based WID-qEC test for detecting uterine cancers independent of sampling modalities","Illah O, Scott M, Redl E, Barrett JE, Schreiberhuber L, Herzog C, Vavourakis CD, Jones A, Evans I, Reisel D, Chandrasekaran D, Doufekas K, Graham R, Kotsopoulos IC, MacDonald N, Arora R, Olaitan A, Rosenthal A, Widschwendter M.","Int J Cancer. 2024 Sep 1;155(5):800-806. doi: 10.1002/ijc.35000. Epub 2024 May 13.","Illah O","Int J Cancer","2024","2024/05/13","","","10.1002/ijc.35000"
"38732069","Blood-Based Epigenetic Age Acceleration and Incident Colorectal Cancer Risk: Findings from a Population-Based Case-Control Study","Malyutina S, Chervova O, Maximov V, Nikitenko T, Ryabikov A, Voevoda M.","Int J Mol Sci. 2024 Apr 29;25(9):4850. doi: 10.3390/ijms25094850.","Malyutina S","Int J Mol Sci","2024","2024/05/11","PMC11084311","","10.3390/ijms25094850"
"38731939","Gene Expression and DNA Methylation Profiling Suggest Potential Biomarkers for Azacitidine Resistance in Myelodysplastic Syndrome","Kim DY, Shin DY, Oh S, Kim I, Kim EJ.","Int J Mol Sci. 2024 Apr 26;25(9):4723. doi: 10.3390/ijms25094723.","Kim DY","Int J Mol Sci","2024","2024/05/11","PMC11083267","","10.3390/ijms25094723"
"38730335","Identification of DNA methylation characteristics associated with metastasis and prognosis in colorectal cancer","Qian F, Li Q, Chang H, Wei K, Chen X, Huang T, Li Y.","BMC Med Genomics. 2024 May 10;17(1):127. doi: 10.1186/s12920-024-01898-4.","Qian F","BMC Med Genomics","2024","2024/05/10","PMC11088068","","10.1186/s12920-024-01898-4"
"38728474","Development and assessment of an RNA editing-based risk model for the prognosis of cervical cancer patients","Zhu Z, Lu J.","Medicine (Baltimore). 2024 May 10;103(19):e38116. doi: 10.1097/MD.0000000000038116.","Zhu Z","Medicine (Baltimore)","2024","2024/05/10","PMC11081546","","10.1097/MD.0000000000038116"
"38716804","Evaluating the utility of ZNF331 promoter methylation as a prognostic and predictive marker in stage III colon cancer: results from CALGB 89803 (Alliance)","Nakasone ES, Zemla TJ, Yu M, Lin SY, Ou FS, Carter K, Innocenti F, Saltz L, Grady WM, Cohen SA.","Epigenetics. 2024 Dec;19(1):2349980. doi: 10.1080/15592294.2024.2349980. Epub 2024 May 8.","Nakasone ES","Epigenetics","2024","2024/05/08","PMC11085945","","10.1080/15592294.2024.2349980"
"38714870","Comprehensive pan-cancer analysis of inflammatory age-clock-related genes as prognostic and immunity markers based on multi-omics data","Yan B, Liao P, Liu S, Lei P.","Sci Rep. 2024 May 7;14(1):10468. doi: 10.1038/s41598-024-61381-z.","Yan B","Sci Rep","2024","2024/05/07","PMC11076581","","10.1038/s41598-024-61381-z"
"38711158","Novel genome-wide DNA methylation profiling reveals distinct epigenetic landscape, prognostic model and cellular composition of early-stage lung adenocarcinoma","Gan J, Huang M, Wang W, Fu G, Hu M, Zhong H, Ye X, Cao Q.","J Transl Med. 2024 May 6;22(1):428. doi: 10.1186/s12967-024-05146-2.","Gan J","J Transl Med","2024","2024/05/06","PMC11075300","","10.1186/s12967-024-05146-2"
"38704802","Lung adenocarcinomas without driver genes converge to common adaptive strategies through diverse genetic, epigenetic, and niche construction evolutionary pathways","Gatenby RA, Luddy KA, Teer JK, Berglund A, Freischel AR, Carr RM, Lam AE, Pienta KJ, Amend SR, Austin RH, Hammarlund EU, Cleveland JL, Tsai KY, Brown JS.","Med Oncol. 2024 May 5;41(6):135. doi: 10.1007/s12032-024-02344-2.","Gatenby RA","Med Oncol","2024","2024/05/05","PMC11070398","","10.1007/s12032-024-02344-2"
"38702190","Epigenome-wide association study of lung cancer among never smokers in two prospective cohorts in Shanghai, China","Rahman ML, Breeze CE, Shu XO, Wong JYY, Blechter B, Cardenas A, Wang X, Ji BT, Hu W, Cai Q, Hosgood HD, Yang G, Shi J, Long J, Gao YT, Bell DA, Zheng W, Rothman N, Lan Q.","Thorax. 2024 Jul 16;79(8):735-744. doi: 10.1136/thorax-2023-220352.","Rahman ML","Thorax","2024","2024/05/03","PMC11251856","NIHMS1983001","10.1136/thorax-2023-220352"
"38696167","Medically Assisted Reproduction and Risk of Cancer Among Offspring","Rios P, Herlemont P, Fauque P, Lacour B, Jouannet P, Weill A, Zureik M, Clavel J, Dray-Spira R.","JAMA Netw Open. 2024 May 1;7(5):e249429. doi: 10.1001/jamanetworkopen.2024.9429.","Rios P","JAMA Netw Open","2024","2024/05/02","PMC11066701","","10.1001/jamanetworkopen.2024.9429"
"38680109","Methylation markers for anal cancer screening: A repeated cross-sectional analysis of people living with HIV, 2015-2016","Vasavada A, Stankiewicz Karita HC, Lin J, Schouten J, Hawes SE, Barnabas RV, Wasserheit J, Feng Q, Winer RL.","Int J Cancer. 2024 Sep 15;155(6):1091-1100. doi: 10.1002/ijc.34977. Epub 2024 Apr 29.","Vasavada A","Int J Cancer","2024","2024/04/29","PMC11250920","NIHMS1986908","10.1002/ijc.34977"
"38679999","LncRNA ANRIL Promotes Glucose Metabolism and Proliferation of Colon Cancer in a High-Glucose Environment and is Associated with Worse Outcome in Diabetic Colon Cancer Patients","Mosaad H, Shalaby SM, Mahmoud NM, Ahmed MM, Fayed A, Ashour HR, Sarhan W.","Asian Pac J Cancer Prev. 2024 Apr 1;25(4):1371-1381. doi: 10.31557/APJCP.2024.25.4.1371.","Mosaad H","Asian Pac J Cancer Prev","2024","2024/04/29","PMC11162718","","10.31557/APJCP.2024.25.4.1371"
"38678617","Naive and regulatory B-cell transcription patterns guide the increased risk of papillary thyroid carcinoma in obesity","Yu Z, Xu Z, Li S, Tian Z, Yuan J.","Cell Mol Biol (Noisy-le-grand). 2024 Apr 28;70(4):118-126. doi: 10.14715/cmb/2024.70.4.19.","Yu Z","Cell Mol Biol (Noisy-le-grand)","2024","2024/04/28","","","10.14715/cmb/2024.70.4.19"
"38668267","FAM19A4 and hsa-miR124-2 Double Methylation as Screening for ASC-H- and CIN1 HPV-Positive Women","Peronace C, Cione E, Abrego-Guandique DM, Fazio M, Panduri G, Caroleo MC, Cannataro R, Minchella P.","Pathogens. 2024 Apr 11;13(4):312. doi: 10.3390/pathogens13040312.","Peronace C","Pathogens","2024","2024/04/26","PMC11054986","","10.3390/pathogens13040312"
"38657098","Clonal Hematopoiesis in Patients With Human Immunodeficiency Virus and Cancer","Gillis N, Dickey BL, Colin-Leitzinger C, Tang YH, Putney RM, Mesa TE, Yoder SJ, Suneja G, Spivak AM, Patel AB, Extermann M, Giuliano AR, Teng M, Kresovich J, Berglund A, Coghill AE.","J Infect Dis. 2024 Sep 23;230(3):680-688. doi: 10.1093/infdis/jiae212.","Gillis N","J Infect Dis","2024","2024/04/24","","","10.1093/infdis/jiae212"
"38639726","Dual-Responsive Nanomedicine Activates Programmed Antitumor Immunity through Targeting Lymphatic System","Xiao H, Li X, Liang S, Yang S, Han S, Huang J, Shuai X, Ren J.","ACS Nano. 2024 Apr 30;18(17):11070-11083. doi: 10.1021/acsnano.3c11464. Epub 2024 Apr 19.","Xiao H","ACS Nano","2024","2024/04/19","","","10.1021/acsnano.3c11464"
"38632255","The prognostic value of sialylation-related long non-coding RNAs in lung adenocarcinoma","Wang B, Hou C, Yu X, Liu J, Wang J.","Sci Rep. 2024 Apr 17;14(1):8879. doi: 10.1038/s41598-024-59130-3.","Wang B","Sci Rep","2024","2024/04/17","PMC11024174","","10.1038/s41598-024-59130-3"
"38629454","DNA methylation-based telomere length is associated with HIV infection, physical frailty, cancer, and all-cause mortality","Liang X, Aouizerat BE, So-Armah K, Cohen MH, Marconi VC, Xu K, Justice AC.","Aging Cell. 2024 Jul;23(7):e14174. doi: 10.1111/acel.14174. Epub 2024 Apr 17.","Liang X","Aging Cell","2024","2024/04/17","PMC11258465","","10.1111/acel.14174"
