pmid,title,authors,journal,pubdate,doi,abstract,has_epigenetic_content
41083503,High-Risk neuroblastoma therapeutics Topotecan and 13-cis-Retinoic acid modulate autophagy and induce DNA damage response in hematopoietic stem cells and monocytes.,Lázničková P; Tidu F; Hrdý J; Boráková K; Hortová Kohoutková M; Frič J,Scientific reports,2025 Oct 13,10.1038/s41598-025-19454-0,"1. Sci Rep. 2025 Oct 13;15(1):35723. doi: 10.1038/s41598-025-19454-0.

High-Risk neuroblastoma therapeutics Topotecan and 13-cis-Retinoic acid modulate 
autophagy and induce DNA damage response in hematopoietic stem cells and 
monocytes.

Lázničková P(1)(2), Tidu F(1), Hrdý J(3), Boráková K(4), Hortová Kohoutková 
M(5)(6), Frič J(7)(8)(9).

Author information:
(1)International Clinical Research Center, St. Anne's University Hospital Brno, 
Pekarska 53, Brno, 60200, Czech Republic.
(2)International Clinical Research Center, Faculty of Medicine, Masaryk 
University, Pekarska 53, Brno, 60200, Czech Republic.
(3)Institute of Clinical Immunology and Allergology, First Faculty of Medicine, 
Charles University and General University Hospital in Prague, Studnickova 7, 
Prague, 12800, Czech Republic.
(4)Institute for the Care of Mother and Child, Podolske nabrezi 157/36, Prague, 
14700, Czech Republic.
(5)International Clinical Research Center, St. Anne's University Hospital Brno, 
Pekarska 53, Brno, 60200, Czech Republic. marcela.hortova@fnusa.cz.
(6)International Clinical Research Center, Faculty of Medicine, Masaryk 
University, Pekarska 53, Brno, 60200, Czech Republic. marcela.hortova@fnusa.cz.
(7)International Clinical Research Center, St. Anne's University Hospital Brno, 
Pekarska 53, Brno, 60200, Czech Republic. jan.fric@uhkt.cz.
(8)International Clinical Research Center, Faculty of Medicine, Masaryk 
University, Pekarska 53, Brno, 60200, Czech Republic. jan.fric@uhkt.cz.
(9)Institute of Hematology and Blood Transfusion, U Nemocnice 2094/1, Prague, 
12800, Czech Republic. jan.fric@uhkt.cz.

Autologous hematopoietic stem and progenitor cell (HSPC) transplantation is 
performed after myeloablation in cancer treatment to restore blood cell 
production and support immune recovery. Despite its success in achieving 
survivorship, many recipients later suffer from recurrent infections and 
pulmonary complications. The mechanisms driving the complications after HSPC 
transplantation later in life are unknown. However, the induction and/or 
maintenance therapeutics might be driving the negative outcomes in treated 
patients. We investigated the effects of the cancer therapeutics topotecan and 
13-cis-retinoic acid (13cisRA) on cell phenotype and functions of HSPCs isolated 
from cord blood and primary monocytes from adult donors. In HSPCs, 13cisRA 
reduced autophagy and lysosomal activity, triggered a DNA damage response 
through increased γH2A.X and CDKN2 expression (including the spliced p14ARF 
isoform), and upregulated the epigenetic regulator SIRT3. 13cisRA also activated 
primary monocytes, inducing CXCL8 and CCL2 production. By contrast, topotecan 
had no effects on mature monocytes but induced DNA damage, metabolic remodeling, 
and epigenetic alterations in HSPCs. These changes included increased CDKN1A 
expression, higher γH2A.X-positive cell frequency, autophagy activation, and 
SIRT1 upregulation. The differential effects of 13cisRA and topotecan on HSPCs 
and monocytes might underlie the long-term complications of autologous HSPC 
transplantation. By modulating DNA damage, autophagy, and epigenetic pathways, 
these therapies could influence hematopoietic recovery and immune 
reconstitution, offering insights for improving transplantation outcomes.

© 2025. The Author(s).

DOI: 10.1038/s41598-025-19454-0
PMCID: PMC12518863
PMID: 41083503 [Indexed for MEDLINE]

Conflict of interest statement: Declarations. Ethics approval and consent to 
participate: All donors included in this study were enrolled based on written 
signed informed consent, which was obtained directly from healthy blood donors 
and pregnant women. All procedures were in accordance with the Helsinki 
Declaration of 1975, as revised in 2013. The study has been approved by the 
Ethical Committee of the Institute for the Care of Mother and Child (date of 
approval 31st March 2014, code of approval: 31032014). Consent for publication: 
All authors gave consent for manuscript publication. Competing interests: The 
authors declare no competing interests.",TRUE
41058458,INTERPLAY OF EPIGENETIC REGULATION OF KI-67 AND P53 BY MIR-21 AND MIR-34A IN CERVICAL INTRAEPITHELIAL NEOPLASIA.,Svintsitska A; Lygyrda N; Svintsitskyi V; Borikun T; Kryzhanivska A,Experimental oncology,2025 Oct 7,10.15407/exp-oncology.2025.02.223,"1. Exp Oncol. 2025 Oct 7;47(2):223-229. doi: 10.15407/exp-oncology.2025.02.223.

INTERPLAY OF EPIGENETIC REGULATION OF KI-67 AND P53 BY MIR-21 AND MIR-34A IN 
CERVICAL INTRAEPITHELIAL NEOPLASIA.

Svintsitska A(1), Lygyrda N(2), Svintsitskyi V(1), Borikun T(3), Kryzhanivska 
A(4).

Author information:
(1)Nonprofit organization ""National Cancer Institute"", Kyiv, Ukraine.
(2)Medical Center of Colposcopy ""LyNa"", Kyiv, Ukraine.
(3)R.E. Kavetsky Institute of Experimental Pathology, Oncology and Radiobiology, 
the National Academy of Sciences of Ukraine, Kyiv, Ukraine.
(4)Ivano-Frankivsk National Medical University, Department of Oncology, 
Ivano-Frankivsk, Ukraine.

BACKGROUND: Cervical cancer (CC), primarily linked to persistent HPV infection, 
arises from complex genetic and epigenetic alterations. The early detection of 
cervical intraepithelial neoplasia (CIN) allows for CC prevention. Recent data 
highlights the importance of epigenetic biomarkers, including non-coding RNAs 
such as miR-21 and miR-34a. Our aim was to investigate the interplay between 
Ki-67 and p53 expression and their epigenetic regulation by miR-21 and miR-34a 
to better predict the course of CIN.
MATERIALS AND METHODS: Tumor biopsies from 50 patients with CIN 1-3/HSIL were 
analyzed. We performed immunohistochemical analysis of Ki-67 and p53 expression 
and qRT-PCR for the analysis of miRNA expression.
RESULTS: The average miR-21 and miR-34a levels were 5.8 ± 2.8 and 1.42 ± 0.85 
(a.u.), respectively, while Ki-67 and p53 averaged 136.9 ± 79.9 and 93.15 ± 49.5 
H-score points. Positive correlations were found between miR-21 and Ki-67 (r = 
0.76) and miR-34a and p53 expressions (r = 0.65). Tumors with low Ki-67 showed 
2.48-fold lower miR-21 levels, and low p53 tumors showed 4.2-fold lower miR-34a 
levels. While no correlation with age or menstrual status was found, miR-21 (r = 
0.78), Ki-67 (r = 0.68), and miR-34a (r = -0.59) correlated with CIN grading (p 
< 0.05). The miR-21 and Ki-67 levels increased in CIN 2 and CIN 3 compared to 
CIN 1 in both HPV-positive and HPV-negative samples. The miR-34a levels were the 
lowest in CIN 3 HPV-negative samples and significantly decreased with CIN 
progression in HPV-positive samples. The p53 levels were significantly higher in 
CIN 3 cases of both the HPV-positive and HPV-negative groups.
CONCLUSION: Our study demonstrates that the miR‑21, miR-34a, Ki-67, and p53 
expression levels are significantly correlated with each other and are 
distinctly associated with the progression of CIN grades and HPV status, 
highlighting their potential as crucial CC biomarkers.

DOI: 10.15407/exp-oncology.2025.02.223
PMID: 41058458 [Indexed for MEDLINE]",TRUE
41057337,Epigenetic modulation of VEGF-A/VEGFR2 pathway genes in OC/TME axis driving genetic upregulation and tumor plasticity.,Bhat A; Bashir Y; Baba AB; Dar S; Ahmad SZ; Yasin SB; Mir AW; Ahmad SN; Yousuf T; Afroze D,Scientific reports,2025 Oct 7,10.1038/s41598-025-04483-6,"1. Sci Rep. 2025 Oct 7;15(1):34856. doi: 10.1038/s41598-025-04483-6.

Epigenetic modulation of VEGF-A/VEGFR2 pathway genes in OC/TME axis driving 
genetic upregulation and tumor plasticity.

Bhat A(1), Bashir Y(#)(2), Baba AB(#)(2), Dar S(2), Ahmad SZ(#)(3), Yasin 
SB(#)(4), Mir AW(#)(3), Ahmad SN(#)(5), Yousuf T(1), Afroze D(6)(7).

Author information:
(1)Department of Immunology and Molecular Medicine, Sher-i-Kashmir Institute of 
Medical Sciences, Soura, Srinagar, Jammu & Kashmir, India.
(2)Advanced Centre for Human Genetics, Sher-i-Kashmir Institute of Medical 
Sciences, Soura, Jammu & Kashmir, India.
(3)Department of Surgical Oncology, Sher-i-Kashmir Institute of Medical 
Sciences, Soura, Jammu & Kashmir, India.
(4)Department of Pathology, Sher-i-Kashmir Institute of Medical Sciences, Soura, 
Jammu & Kashmir, India.
(5)Department of Medical Oncology, Sher-i-Kashmir Institute of Medical Sciences, 
Soura, Jammu & Kashmir, India.
(6)Department of Immunology and Molecular Medicine, Sher-i-Kashmir Institute of 
Medical Sciences, Soura, Srinagar, Jammu & Kashmir, India. afrozedil@gmail.com.
(7)Advanced Centre for Human Genetics, Sher-i-Kashmir Institute of Medical 
Sciences, Soura, Jammu & Kashmir, India. afrozedil@gmail.com.
(#)Contributed equally

Tumor heterogeneity has been recognized as a critical characteristic of Ovarian 
Cancer (OC), significantly influencing chemotherapeutic response and overall 
patient survival. The VEGF/VEGFR2 signaling pathway genes serve as risk factor 
for metastasis and are associated with poor prognosis in many cancers including 
OC. DNA methylation of VEGF-A, VEGF-C and VEGFR2 genes contributing to their 
genetic changes based on histological sub-types has not been thoroughly explored 
in OC. Thus, the study aimed to determine the DNA methylation status of these 
genes in relation to their expression in tumor tissues and associated peritoneal 
fluid samples to evaluate usefulness of methylation as a prognostic indicator in 
ovarian carcinoma for future targeted therapies. Bisulfite-modified DNA 
methylation was assessed via Methylation-Specific Polymerase chain reaction 
(MSP) and mRNA expression was examined via quantitative reverse transcription 
PCR (RT-PCR), respectively. Gene expression and promoter methylation were 
examined in relation with clinical parameters in 100 OC samples. The methylation 
frequency of VEGF-A, VEGF-C and VEGFR2 promoters was higher in tumor tissues and 
matched Peritoneal Fluid (PF) compared to normal samples, while VEGF-A, VEGF-C 
and VEGFR2 mRNA expression levels were significantly elevated. Promoter 
methylation levels for VEGF-A (82%), VEGF-C (76%) and VEGFR2 (82%) showed 
significantly higher levels compared to benign cystadenomas, whereas amounts of 
VEGF-A and VEGFR2 were significantly higher than benign samples (p = 0.0003 and 
0.001). Expression and promoter methylation for VEGF-A (p = 0.0004, 0.0001) and 
VEGFR2 (p = 0.005, 0.001) significantly correlated with differences in 
histological sub-types in OC samples. No significant correlation was observed 
between promoter methylation and expression levels for VEGF-A, VEGF-C and VEGFR2 
genes. Kaplan-Meier survival analysis predicts poor prognosis for concurrent 
high expression and methylation of VEGF-A and VEGFR2 significantly correlated 
with advanced stage (log-rank p = 0.03, 0.01) and tumor histology (log rank 
p = 0.02, 0.01 respectively) in OC patients. Promoter methylation status of the 
VEGF-A and VEGFR2 genes could serve as valuable prognostic indicator in 
predicting poor prognosis in OC patients based on tumor histological sub-types.

© 2025. The Author(s).

DOI: 10.1038/s41598-025-04483-6
PMCID: PMC12504760
PMID: 41057337 [Indexed for MEDLINE]

Conflict of interest statement: Declarations. Competing interests: The authors 
declare no competing interests. Ethics approval and consent to participate: 
Institutional committee of the Sher-i-Kashmir Institute of Medical Sciences 
(SKIMS) under notification no. #61/2019. All the participants provided written 
informed consent. Consent for publication: Our manuscript does not contain any 
individual person data or personal information.",TRUE
41057303,Helicobacter pylori-induced aberrant methylation of ID4 mediated by DNMT3B drives gastric cancer progression via DEC1-SHH signaling pathway.,Luan M; Zhu W; Feng Z; Jing F; Xing Y; Ma X; Wang Y; Ning B; Jia Y,Cell death & disease,2025 Oct 7,10.1038/s41419-025-08042-9,"1. Cell Death Dis. 2025 Oct 7;16(1):713. doi: 10.1038/s41419-025-08042-9.

Helicobacter pylori-induced aberrant methylation of ID4 mediated by DNMT3B 
drives gastric cancer progression via DEC1-SHH signaling pathway.

Luan M(1), Zhu W(2), Feng Z(3), Jing F(1), Xing Y(1)(2), Ma X(1)(2), Wang 
Y(1)(2), Ning B(4), Jia Y(5)(6)(7).

Author information:
(1)Research Center of Basic Medicine, Jinan Central Hospital, Shandong 
University, Jinan, People's Republic of China.
(2)Research Center of Basic Medicine, Central Hospital Affiliated to Shandong 
First Medical University, Jinan, People's Republic of China.
(3)Department of Medical Laboratory, Shandong Second Medical University, 
Weifang, People's Republic of China.
(4)Central Hospital Affiliated to Shandong First Medical University, Shandong 
First Medical University, Jinan, People's Republic of China. bning@sdfmu.edu.cn.
(5)Research Center of Basic Medicine, Jinan Central Hospital, Shandong 
University, Jinan, People's Republic of China. jiayanfei_@126.com.
(6)Research Center of Basic Medicine, Central Hospital Affiliated to Shandong 
First Medical University, Jinan, People's Republic of China. jiayanfei_@126.com.
(7)Department of Medical Laboratory, Shandong Second Medical University, 
Weifang, People's Republic of China. jiayanfei_@126.com.

Helicobacter pylori (H. pylori) infection mediates activation of oncogenes and 
inhibition of tumor suppressor genes through aberrant DNA methylation, which is 
the predominant risk factor for gastric tumorigenesis. Here, by integrating 
transcriptome and epigenetic multi-omics analyses of gastric tissues and mouse 
models, we identified that inhibitor of differentiation 4 (ID4) was 
downregulated in H. pylori-infected gastric tissues and associated with 
prognosis of gastric cancer (GC). H. pylori infection remarkably increased the 
methylation level of the ID4 promoter region in the GC patients and mouse 
models. ID4 served as a tumor suppressor gene in GC and was required for H. 
pylori-mediated tumorigenic activities in vitro cellular and in vivo 
tumor-bearing mouse models. Moreover, H. pylori infection induced DNMT3B 
upregulation through recruiting KLF5 to its promoter and further promoted ID4 
DNA methylation modification. Notably, ID4 formed heterodimers with the basic 
HLH transcription factors DEC1 to inhibit its transcriptional activity; 
therefore, downregulation of ID4 promoted SHH/GLI1 signaling through a DEC1 
dependent transcriptional modulation. Collectively, our findings indicate H. 
pylori infection depends on DNMT3B to induce ID4 DNA methylation and ID4 
promoter hypermethylation status is a potential biomarker to identify GC. Loss 
of ID4 could be a key component of H. pylori-mediated gastric tumorigenesis 
through dysregulation of DEC1/SHH/GLI1 axis, which provides potential 
therapeutic targets in GC.

© 2025. The Author(s).

DOI: 10.1038/s41419-025-08042-9
PMCID: PMC12504463
PMID: 41057303 [Indexed for MEDLINE]

Conflict of interest statement: Competing interests: The authors declare no 
competing interests. Ethics approval and consent to participate: All animal 
experiments were approved by the Committee for Animal Research of Jinan Central 
Hospital. The approval ID for the use of animals was W202303090259. The gastric 
cancer tissue samples used in the study were derived from patients who gave 
written informed consent for the use of the specimen. The studies were approved 
by the Medical Ethics Committee of Jinan Central Hospital.",TRUE
41054139,A histone acetylation-based predictive model for immunotherapy response and combinatorial targeting in cervical cancer.,Zhang X; Li M; Wang K; Sun Z; Mao J; Zhang L; Ji R,Medicine,2025 Oct 3,10.1097/MD.0000000000044946,"1. Medicine (Baltimore). 2025 Oct 3;104(40):e44946. doi: 
10.1097/MD.0000000000044946.

A histone acetylation-based predictive model for immunotherapy response and 
combinatorial targeting in cervical cancer.

Zhang X(1)(2), Li M(3), Wang K(1)(2), Sun Z(1), Mao J(1), Zhang L(1), Ji R(1).

Author information:
(1)Nantong Tumor Hospital, The Affiliated Tumor Hospital of Nantong University, 
Nantong, China.
(2)School of Medicine, Nantong University, Nantong, China.
(3)Maternal and Child Health Hospital in Yancheng City, Yancheng, China.

Histone acetylation, a fundamental component of epigenetic modification, plays a 
pivotal role in the progression, treatment, and prognosis of numerous cancers. 
In this study, we systematically investigated, for the first time, the clinical 
value of histone acetylation (HAT) modification in the prognostic assessment of 
cervical cancer. Utilizing the GSE44001 and The Cancer Genome Atlas-CESC 
databases, a HAT-associated prognostic model comprising 7 pivotal genes was 
formulated through Lasso-Cox regression analysis. The integration of multiple 
bioinformatics algorithms (including Cibersort, ESTIMATE, ssGSEA, and TIDE) has 
enabled the profound delineation of immune microenvironmental characteristics 
among disparate risk groups. Utilizing molecular docking technology, we 
conducted a screening process that identified 2 potential target drugs. The 
prognostic model's predictive efficacy was successfully validated in an 
independent cohort. The analysis has revealed that the high-risk group exhibits 
a pronounced immunosuppressive phenotype. The study identified 2 additional 
factors that contribute to the prognosis of cervical cancer: CPE and PGK1. These 
factors have been shown to be significantly associated with poor clinical 
outcomes. In addition, we have identified 2 drugs that may target CPE and PGK1, 
namely Z-LLNle-CHO and OSU-03-012. The discovery of these drugs has opened up a 
new potential pathway for overcoming resistance to immunotherapy. This study 
addresses a significant research gap concerning HAT in the prognostic assessment 
of cervical cancer. Furthermore, it offers a crucial molecular basis for 
clinical decisions regarding individualized therapeutic interventions.

Copyright © 2025 the Author(s). Published by Wolters Kluwer Health, Inc.

DOI: 10.1097/MD.0000000000044946
PMCID: PMC12499837
PMID: 41054139 [Indexed for MEDLINE]

Conflict of interest statement: The authors have no conflicts of interest to 
disclose.",TRUE
41053817,Identification of C4BPA as a genetically informed drug target in NSCLC: an integrative single-cell and multi-omics study based on the druggable genes.,Xiao Z; Liu X; Tang W; Lv Y; Zhang T; Zhan X; Sun Q; Omindo WW; Wang Q; Zhang R; Ping W; Zhang N,Human genomics,2025 Oct 6,10.1186/s40246-025-00829-3,"1. Hum Genomics. 2025 Oct 6;19(1):113. doi: 10.1186/s40246-025-00829-3.

Identification of C4BPA as a genetically informed drug target in NSCLC: an 
integrative single-cell and multi-omics study based on the druggable genes.

Xiao Z(#)(1), Liu X(#)(1), Tang W(#)(1), Lv Y(#)(1), Zhang T(2), Zhan X(1), Sun 
Q(1), Omindo WW(1), Wang Q(1), Zhang R(1), Ping W(3), Zhang N(4).

Author information:
(1)Department of Thoracic Surgery, Tongji Hospital, Tongji Medical College, 
Huazhong University of Science and Technology, Wuhan, 430030, China.
(2)Department of Thoracic Surgery, The First Affiliated Hospital of Nanjing 
Medical University, Nanjing, 210003, China.
(3)Department of Thoracic Surgery, Tongji Hospital, Tongji Medical College, 
Huazhong University of Science and Technology, Wuhan, 430030, China. 
pingwei@tjh.tjmu.edu.cn.
(4)Department of Thoracic Surgery, Tongji Hospital, Tongji Medical College, 
Huazhong University of Science and Technology, Wuhan, 430030, China. 
nizhang@tjh.tjmu.edu.cn.
(#)Contributed equally

BACKGROUND: Non-small cell lung cancer (NSCLC) remains a leading cause of 
cancer-related mortality worldwide. Despite advancements in treatment, drug 
resistance and limited therapeutic efficacy persist, underscoring the urgent 
need for novel and mechanistically informed therapeutic strategies. Identifying 
genetically supported drug targets may accelerate the development of precision 
therapies in NSCLC.
METHODS: We implemented an integrative multi-omics framework combining 
single-cell RNA sequencing (scRNA-seq), genome-wide association studies (GWAS), 
and molecular quantitative trait locus (QTL) datasets including expression 
(eQTL), protein (pQTL), and DNA methylation (mQTL) QTLs. Druggable candidates 
were systematically evaluated using a suite of Mendelian randomization (MR) 
approaches-including summary data-based MR (SMR), generalized SMR (GSMR), and 
genetic risk score (GRS) analysis. Epigenetic regulation and downstream 
signaling were further explored through mediation MR analysis.
RESULTS: C4BPA, a complement-regulatory macromolecule, emerged as a risk factor 
for NSCLC across multiple MR models, with consistent findings validated at both 
transcriptomic and proteomic levels. Epigenetic activation of C4BPA via DNA 
methylation was observed, and C4BPA expression was shown to promote NSCLC 
progression through the inflammatory chemokine CCL8 signaling axis. Sensitivity 
analyses confirmed the robustness of association inference.
CONCLUSIONS: Our findings identify C4BPA as a genetically validated and 
biologically plausible therapeutic target for NSCLC. This study demonstrates the 
power of integrating single-cell transcriptomics with population-scale omics and 
association inference to uncover actionable targets, offering a scalable 
framework for advancing precision oncology in lung cancer.

© 2025. The Author(s).

DOI: 10.1186/s40246-025-00829-3
PMCID: PMC12502296
PMID: 41053817 [Indexed for MEDLINE]

Conflict of interest statement: Declarations. Ethics approval and consent to 
participate: Not applicable. Consent for publication: Not applicable. Competing 
interests: The authors declare no competing interests.",TRUE
