pmid,title,authors,journal,pubdate,doi,abstract,has_epigenetic_content
40962798,RBM39 degrader invigorates innate immunity to eradicate neuroblastoma despite cancer cell plasticity.,Singh S; Fang J; Jin H; Van De Velde LA; Cortes A; Chen J; Natarajan S; Poon E; Wu Q; Morton CL; Woolard MA; Quarni W; Steele JA; Connelly JP; He L; Thorne R; Turner G; Confer T; Johnson M; Caufield WV; Freeman BB 3rd; Lockey T; Murphy AJ; Murray PJ; Owa T; Pruett-Miller SM; Wang R; Chesler L; Park JR; Davidoff AM; Easton J; Chen X; Thomas PG; Yang J,Nature communications,2025 Sep 17,10.1038/s41467-025-63979-x,"1. Nat Commun. 2025 Sep 17;16(1):8287. doi: 10.1038/s41467-025-63979-x.

RBM39 degrader invigorates innate immunity to eradicate neuroblastoma despite 
cancer cell plasticity.

Singh S(#)(1), Fang J(#)(1), Jin H(#)(2), Van De Velde LA(#)(3), Cortes A(#)(1), 
Chen J(4), Natarajan S(4), Poon E(5), Wu Q(1), Morton CL(1), Woolard MA(1), 
Quarni W(1), Steele JA(6), Connelly JP(6), He L(3), Thorne R(7), Turner G(7), 
Confer T(7), Johnson M(7), Caufield WV(8), Freeman BB 3rd(8), Lockey T(9), 
Murphy AJ(1), Murray PJ(10), Owa T(11), Pruett-Miller SM(6), Wang R(12), Chesler 
L(5), Park JR(13), Davidoff AM(1)(14)(15), Easton J(4), Chen X(4), Thomas PG(3), 
Yang J(16)(17)(18).

Author information:
(1)Department of Surgery, St. Jude Children's Research Hospital, Memphis, TN, 
USA.
(2)Center for Applied Bioinformatics, St. Jude Children's Research Hospital, 
Memphis, TN, USA.
(3)Department of Host Microbe Interactions, St. Jude Children's Research 
Hospital, Memphis, TN, USA.
(4)Department of Computational Biology, St. Jude Children's Research Hospital, 
Memphis, TN, USA.
(5)Division of Clinical Studies, The Institute of Cancer Research, London, UK.
(6)Center for Advanced Genome Engineering (CAGE) and Department of Cell and 
Molecular Biology, St. Jude Children's Research Hospital, Memphis, TN, USA.
(7)Center for In Vivo Imaging & Therapeutics, St. Jude Children's Research 
Hospital, Memphis, TN, USA.
(8)Preclinical Pharmacokinetics Shared Resource, St. Jude Children's Research 
Hospital, Memphis, TN, USA.
(9)Therapeutics Production and Quality, St. Jude Children's Research Hospital, 
Memphis, TN, USA.
(10)Max Planck Institute of Biochemistry, Martinsried, Germany.
(11)Eisai Inc., Nutley, NJ, USA.
(12)Center for Childhood Cancer Research, Abigail Wexner Research Institute, 
Nationwide Children's Hospital, The Ohio State University, Columbus, OH, USA.
(13)Department of Oncology, St. Jude Children's Research Hospital, Memphis, TN, 
USA.
(14)Department of Surgery, The University of Tennessee Health Science Center, 
Memphis, TN, USA.
(15)Department of Pathology, College of Medicine, The University of Tennessee 
Health Science Center, Memphis, TN, USA.
(16)Department of Surgery, St. Jude Children's Research Hospital, Memphis, TN, 
USA. Jun.Yang2@stjude.org.
(17)Department of Pathology, College of Medicine, The University of Tennessee 
Health Science Center, Memphis, TN, USA. Jun.Yang2@stjude.org.
(18)College of Graduate Health Sciences, University of Tennessee Health Science 
Center, Memphis, TN, USA. Jun.Yang2@stjude.org.
(#)Contributed equally

Update of
    bioRxiv. 2024 Mar 25:2024.03.21.586157. doi: 10.1101/2024.03.21.586157.

The cellular plasticity of neuroblastoma is defined by a mixture of two major 
cell states, adrenergic and mesenchymal, which may contribute to therapy 
resistance. However, how neuroblastoma cells switch cellular states during 
therapy remains largely unknown, and how to eradicate neuroblastoma regardless 
of its cell state is a clinical challenge. To better understand the cellular 
plasticity of neuroblastoma in chemoresistance, we define the transcriptomic and 
epigenetic map of adrenergic and mesenchymal types of neuroblastomas using human 
and murine models treated with indisulam, a selective RBM39 degrader. We show 
that cancer cells not only undergo a bidirectional switch between adrenergic and 
mesenchymal states, but also acquire additional cellular states, reminiscent of 
the developmental pliancy of neural crest cells. These cell state alterations 
are coupled with epigenetic reprogramming and dependency switching of cell 
state-specific transcription factors, epigenetic modifiers, and targetable 
kinases. Through targeting RNA splicing, indisulam induces an inflammatory tumor 
microenvironment and enhances the anticancer activity of natural killer cells. 
The combination of indisulam with anti-GD2 immunotherapy results in a durable, 
complete response in high-risk transgenic neuroblastoma models, providing an 
innovative, rational therapeutic approach to eradicate tumor cells regardless of 
their potential to switch cell states.

© 2025. The Author(s).

DOI: 10.1038/s41467-025-63979-x
PMCID: PMC12443969
PMID: 40962798 [Indexed for MEDLINE]

Conflict of interest statement: Competing interests: Jun Yang is a subject 
Editor of the British Journal of Cancer. Other authors declare no competing 
interests.",TRUE
40961678,Dietary short-chain fatty acid Sodium Butyrate orchestrates pro-apoptotic and anti-angiogenic pathways in HCC cells by targeting the novel SND1/hTERT axis.,Charmanna SO; Karunakara SH; Srinivasa S; Panchakshari PM; Prakash M; Mehtani R; Kumar DP; Santhekadur PK,Biochemical and biophysical research communications,2025 Oct 10,10.1016/j.bbrc.2025.152651,"1. Biochem Biophys Res Commun. 2025 Oct 10;784:152651. doi: 
10.1016/j.bbrc.2025.152651. Epub 2025 Sep 14.

Dietary short-chain fatty acid Sodium Butyrate orchestrates pro-apoptotic and 
anti-angiogenic pathways in HCC cells by targeting the novel SND1/hTERT axis.

Charmanna SO(1), Karunakara SH(2), Srinivasa S(3), Panchakshari PM(4), Prakash 
M(5), Mehtani R(6), Kumar DP(7), Santhekadur PK(8).

Author information:
(1)Centre of Excellence in Molecular Biology and Regenerative Medicine, 
Department of Biochemistry, JSS Medical College, Mysuru, Karnataka, India. 
Electronic address: shuchioc@jssuni.edu.in.
(2)Centre of Excellence in Molecular Biology and Regenerative Medicine, 
Department of Biochemistry, JSS Medical College, Mysuru, Karnataka, India. 
Electronic address: shreyashk@jssuni.edu.in.
(3)Centre of Excellence in Molecular Biology and Regenerative Medicine, 
Department of Biochemistry, JSS Medical College, Mysuru, Karnataka, India. 
Electronic address: 24pbm001@jssuni.edu.in.
(4)Centre of Excellence in Molecular Biology and Regenerative Medicine, 
Department of Biochemistry, JSS Medical College, Mysuru, Karnataka, India. 
Electronic address: 24PLM035@jssuni.edu.in.
(5)Centre of Excellence in Molecular Biology and Regenerative Medicine, 
Department of Biochemistry, JSS Medical College, Mysuru, Karnataka, India. 
Electronic address: maheshkumari@jssuni.edu.in.
(6)Department of Hepatology, Amrita Hospital, Faridabad, Haryana, India. 
Electronic address: rohitmehtani.14@gmail.com.
(7)Centre of Excellence in Molecular Biology and Regenerative Medicine, 
Department of Biochemistry, JSS Medical College, Mysuru, Karnataka, India. 
Electronic address: divyapkumar@jssuni.edu.in.
(8)Centre of Excellence in Molecular Biology and Regenerative Medicine, 
Department of Biochemistry, JSS Medical College, Mysuru, Karnataka, India. 
Electronic address: prasannakumars@jssuni.edu.in.

Hepatocellular Carcinoma (HCC) is the primary type of liver malignancy, which 
stands as the third leading contributor to cancer-related death worldwide. Its 
development is associated with multifactors, which include viral hepatitis, 
metabolic syndrome, lifestyle factors, and dysregulation of many genetic and 
epigenetic signalling pathways. MicroRNAs play the main role in gene regulation 
in eukaryotic cells, which functions primarily through RISC, and their 
dysregulations with enhanced expression of RNA-induced silencing complex (RISC) 
activity contribute to HCC pathogenesis. Staphylococcal nuclease 
domain-containing protein 1 (SND1), a core component of the RISC machinery, acts 
as an oncogene promoting tumor growth, invasion, and angiogenesis in HCC. 
Furthermore, aberrant telomerase activation, largely attributed to elevated 
expression of its catalytic subunit of human telomerase reverse transcriptase 
(hTERT), is a hallmark of approximately 90 % of cancers. Short-chain fatty acid 
(SCFA), Sodium Butyrate (NaBu), are gut microbiota-derived metabolites with 
emerging anti-cancer properties. NaBu acts as an HDAC inhibitor, exhibiting 
anti-proliferative, pro-apoptotic, and anti-inflammatory effects in various 
cancer models. In this study, we investigate the novel molecular mechanism by 
which NaBu regulates SND1 meditated hTERT expression in HCC and assess its 
anti-tumor efficacy through in-vitro cellular models.

Copyright © 2025 Elsevier Inc. All rights reserved.

DOI: 10.1016/j.bbrc.2025.152651
PMID: 40961678 [Indexed for MEDLINE]

Conflict of interest statement: Declaration of competing interest We declare 
that this manuscript is original, has not been published before, and is not 
currently under consideration for publication elsewhere. The authors confirm 
that there are no conflicts of interest associated with this work and that all 
authors have read and approved the manuscript for submission.",TRUE
40952538,S1PR5 as a prognostic biomarker in colon cancer: insights into efferocytosis-related mechanisms and immune modulation.,Pei A; Lu L; Wu X,Journal of molecular histology,2025 Sep 15,10.1007/s10735-025-10608-y,"1. J Mol Histol. 2025 Sep 15;56(5):315. doi: 10.1007/s10735-025-10608-y.

S1PR5 as a prognostic biomarker in colon cancer: insights into 
efferocytosis-related mechanisms and immune modulation.

Pei A(1), Lu L(2), Wu X(3).

Author information:
(1)Department of Anesthesia, The First Affiliated Hospital, Zhejiang University 
School of Medicine, Hangzhou, 310003, Zhejiang, China.
(2)Center for Rehabilitation Medicine Center, Department of Anesthesiology, 
Zhejiang Provincial People's Hospital (Affiliated People's Hospital), Hangzhou 
Medical College, 158 Shangtang Road, Gongshu District, Hangzhou, 310014, 
Zhejiang, China.
(3)Center for Rehabilitation Medicine Center, Department of Anesthesiology, 
Zhejiang Provincial People's Hospital (Affiliated People's Hospital), Hangzhou 
Medical College, 158 Shangtang Road, Gongshu District, Hangzhou, 310014, 
Zhejiang, China. wuxiaolin0301@163.com.

Colon cancer remains a major cause of global cancer mortality, characterized by 
complex interactions between genetic, epigenetic, and immune factors. This study 
investigates the prognostic value of efferocytosis-related genes and their role 
in colon cancer progression and immune modulation. A prognostic signature relied 
on efferocytosis-related genes was developed using univariate Cox and least 
absolute shrinkage and selection operator (LASSO) regression analyses. Immune 
infiltration, immune checkpoint expression, and tumor microenvironment 
characteristics were analyzed using single-sample gene set enrichment analysis 
(ssGSEA), ESTIMATE, and tumor immunophenotype (TIP) frameworks. S1PR5 was 
knocked down in SW1116 and SW620 cells. The effect of S1PR5 on colon cancer 
growth and macrophage regulation in vivo and in vitro. Colon cancer patients 
were stratified into high- and low-risk groups, with high-risk patients 
demonstrating significantly worse survival outcomes. S1PR5, a key gene in the 
model, was markedly overexpressed in colon cancer tumors and correlated with 
advanced clinical stages, poor survival outcomes, and diminished responses to 
immunotherapy. Furthermore, S1PR5 knockdown could inhibit colon cancer cell 
activity and increase macrophage polarization from M0 to M1. Our research 
developed an efferocytosis-related gene prognostic model and identified S1PR5 as 
a key biomarker. S1PR5 showed significant associations with advanced clinical 
stages, immunosuppressive microenvironments, and unfavorable survival outcomes, 
underscoring its potential as both a prognostic marker and a therapeutic target 
in colon cancer.

© 2025. The Author(s), under exclusive licence to Springer Nature B.V.

DOI: 10.1007/s10735-025-10608-y
PMID: 40952538 [Indexed for MEDLINE]

Conflict of interest statement: Declarations. Conflict of interest: The authors 
declare no competing interests. Ethical approval and consent to participate: All 
experiments were approved by the Institutional Animal Care and Use Committee of 
the Hubei Provincial Center for Disease Control and Prevention (License Number: 
202410146). Consent for publication: Not applicable.",TRUE
40943642,Cell-Free DNA Bisulfite Sequencing Reveals Epithelial-Mesenchymal Transition Signatures for Breast Cancer.,Jeon MS; Ding Z; Pei C; Li J; Xie L; Sauter E; Zhang KK,International journal of molecular sciences,2025 Sep 7,10.3390/ijms26178723,"1. Int J Mol Sci. 2025 Sep 7;26(17):8723. doi: 10.3390/ijms26178723.

Cell-Free DNA Bisulfite Sequencing Reveals Epithelial-Mesenchymal Transition 
Signatures for Breast Cancer.

Jeon MS(1)(2), Ding Z(1)(3), Pei C(2), Li J(1)(2), Xie L(3), Sauter E(4), Zhang 
KK(1)(2)(3).

Author information:
(1)Center for Epigenetics and Disease Prevention, Institute of Biosciences & 
Technology, Texas A&M Health Science Center, Houston, TX 77030, USA.
(2)Rigor and Reproducibility Core, Institute of Biosciences & Technology, Texas 
A&M Health Science Center, Houston, TX 77030, USA.
(3)Department of Nutrition, Texas A&M University, College Station, TX 77843, 
USA.
(4)National Cancer Institute, Division of Cancer Prevention, Rockville, MD 
20850, USA.

Cell-free DNA (cfDNA), shed by malignant tumor cells into extracellular fluid, 
provides valuable epigenetic information indicative of cancer status. Nipple 
aspirate fluid (NAF), a noninvasive liquid biopsy from at-risk women, contains 
nucleic acid and protein biomarkers from adjacent cancer cells, showing promise 
for breast cancer (BrC) detection. However, despite its potential, the 
application of cfDNA in NAF for BrC screening is still underexplored. Here, we 
report a proof-of-concept study for using cfDNA bisulfite sequencing (cfBS) to 
assess tumor DNA methylation signatures from NAF samples. For four healthy 
individuals and three BrC patients, cfBS achieved greater than 20× sequencing 
depth with an average coverage of 26.5× on the genome. A total of 7471 
differentially methylated regions were identified, with significant 
hypermethylation in BrC samples compared to healthy controls. Gene set 
enrichment analysis indicated that the differentially methylated genes (DMGs) 
were significantly associated with epithelial-mesenchymal transition (EMT). By 
developing a novel EMT scoring metric, we found that BrC samples had more of a 
mesenchymal phenotype than samples from healthy individuals. CDH1, WNT2, and 
TRIM29 were hypermethylated near the promoter region, while COL5A2 was 
hypermethylated in the coding region. The DNA methylation and EMT changes were 
validated through The Cancer Genome Atlas Breast Invasive Carcinoma study, which 
confirmed that DMGs were associated with gene expression change and that our 
methylation-based EMT score reliably distinguished tumors from healthy controls. 
Our findings support the utilization of the NAF cfDNA cfBS methylation profile 
for noninvasive BrC screening and pave the way for enhanced early detection of 
this disease.

DOI: 10.3390/ijms26178723
PMCID: PMC12429146
PMID: 40943642 [Indexed for MEDLINE]

Conflict of interest statement: The authors declare no conflict of interest.",TRUE
40939530,Multi-omics investigation of Bisphenol A in gastrointestinal carcinogenesis: a network toxicology and molecular docking approach.,Guan J; Yang K; Chen T; Li Z; Gao Y; Huang Y; Zhou R; Huang Z; Du Y; Li T; Zhuang B; Rong X,Environment international,2025 Sep,10.1016/j.envint.2025.109785,"1. Environ Int. 2025 Sep;203:109785. doi: 10.1016/j.envint.2025.109785. Epub 2025
 Sep 8.

Multi-omics investigation of Bisphenol A in gastrointestinal carcinogenesis: a 
network toxicology and molecular docking approach.

Guan J(1), Yang K(1), Chen T(1), Li Z(1), Gao Y(1), Huang Y(1), Zhou R(1), Huang 
Z(1), Du Y(2), Li T(3), Zhuang B(4), Rong X(5).

Author information:
(1)Department of Oncology, Nanfang Hospital, Southern Medical University, 1838 
North of Guangzhou Avenue, Guangzhou 510517, China.
(2)Department of Oncology, Changde Hospital, Xiangya School of Medicine, Central 
South University (The first people's hospital of Changde city), Changde 415003, 
China.
(3)Department of Oncology, Changde Hospital, Xiangya School of Medicine, Central 
South University (The first people's hospital of Changde city), Changde 415003, 
China. Electronic address: tiffany880215@163.com.
(4)Department of General Surgery, Nanfang Hospital, Southern Medical University, 
1838 North of Guangzhou Avenue, Guangzhou 510517, China. Electronic address: 
zhuangbaoxiongnfyy@163.com.
(5)Department of Oncology, Nanfang Hospital, Southern Medical University, 1838 
North of Guangzhou Avenue, Guangzhou 510517, China. Electronic address: 
rongxx@smu.edu.cn.

Our study aims to systematically investigate the potential carcinogenic 
mechanisms of bisphenol A (BPA) in three gastrointestinal tumors: intrahepatic 
cholangiocarcinoma (ICC), colorectal cancer (CRC), and esophageal cancer. By 
systematically integrating multi-omics databases, including transcriptomics and 
single-cell transcriptomics, we identified overlapping targets between 
BPA-associated molecules and tumor-related genes. Functional enrichment revealed 
that these targets converge on key oncogenic pathways, includingcellular 
metabolic reprogramming (particularly glycolysis), tumor microenvironment 
remodeling via cancer-associated fibroblast (CAF) activation, and dysregulation 
of cell cycle progression. Molecular docking verified strong binding affinity 
between BPA and key targets. Survival analysis linked GAPDH and HSP90AA1 in ICC, 
CDKN1A, CEBPB, and EGR1 in CRC, and DCN and CXCL12 in esophageal cancer to poor 
survival rates, highlighting their potential as prognostic biomarkers. Our 
findings demonstrate that BPA promotes gastrointestinal carcinogenesisthrough 
disrupting energy metabolism, activating CAFs to remodel the tumor 
microenvironment, and enhancing cancer cell proliferation. This multi-level 
evidence advances the risk assessment of BPA and identifies potential targets 
for prevention and therapy of BPA-linked gastrointestinal cancers. Environmental 
Implication. In addition to well-documented role in promoting endocrine-related 
diseases, the mechanisms by which hazardous compound bisphenol A (BPA) 
contributes to other pathological conditions must not be overlooked. Through 
systematic integration of biological evidence chains, this study revealed BPA's 
triple carcinogenic mechanism involving interference with cell cycle 
checkpoints, remodeling of tumor microenvironment stroma, and disruption of 
epigenetic regulation, thereby providing a novel target system for preventing 
environmental toxicant-induced gastrointestinal tumors.

Copyright © 2025 The Authors. Published by Elsevier Ltd.. All rights reserved.

DOI: 10.1016/j.envint.2025.109785
PMID: 40939530 [Indexed for MEDLINE]

Conflict of interest statement: Declaration of competing interest The authors 
declare that they have no known competing financial interests or personal 
relationships that could have appeared to influence the work reported in this 
paper.",TRUE
40935222,PCGMMF: a prediction method for breast cancer prognostic recurrence and metastasis risk based on enhanced multimodal feature fusion.,Du W; Gao L; Xu X; Yao Y; Li Z,Journal of biomedical informatics,2025 Oct,10.1016/j.jbi.2025.104907,"1. J Biomed Inform. 2025 Oct;170:104907. doi: 10.1016/j.jbi.2025.104907. Epub
2025  Sep 9.

PCGMMF: a prediction method for breast cancer prognostic recurrence and 
metastasis risk based on enhanced multimodal feature fusion.

Du W(1), Gao L(2), Xu X(3), Yao Y(4), Li Z(5).

Author information:
(1)School of Information Engineering, Huzhou University, Huzhou, Zhejiang, 
China, 313000.
(2)Department of Oncology, Zhejiang Provincial People's Hospital, Hangzhou, 
Zhejiang, China, 310014.
(3)Department of Pathology, Hainan Cancer Hospital, Affiliated Cancer Hospital 
of Hainan Medical University, Haikou, Hainan, China, 570312.
(4)School of Mathematics and Statistics, Hainan Normal University, Haikou, 
Hainan, China, 571158.
(5)School of Information Engineering, Huzhou University, Huzhou, Zhejiang, 
China, 313000. Electronic address: lizhong@zjhu.edu.cn.

BACKGROUND: Breast cancer is a highly heterogeneous disease with high morbidity 
and mortality rates. Despite the availability of various treatments, a 
significant number of patients still face a high probability of recurrence or 
metastasis, which severely impacts their survival status. Traditional prognostic 
methods based on single-modality data and machine learning algorithms often fail 
to adequately capture the complex biological relationships and heterogeneous 
characteristics of breast cancer, leading to suboptimal prognostic performance. 
Therefore, there is an urgent need for a more accurate and effective method to 
predict the risk of recurrence and metastasis in breast cancer prognosis.
METHODS: In this study, we propose a novel method termed PCGMMF for breast 
cancer prognostic analysis. This method integrates histopathological images, 
clinical data, gene expression data, and DNA methylation data through multimodal 
fusion. We leverage a pre-trained Vision-LSTM model based on transfer learning 
to extract features from histopathological images. Additionally, we design a 
comprehensive feature selection strategy that includes support vector machine 
(SVM), Mantel test, and correlation analysis to filter features from gene 
expression data and DNA methylation data. Furthermore, to address the high 
heterogeneity of breast cancer and the independence and intersectionality of 
multimodal features, we propose a bidirectional attention and self-attention 
based enhanced multimodal feature fusion module called BSAMF.
RESULTS: Through a series of experiments, we evaluate the performance of PCGMMF. 
When predicting the recurrence and metastasis risk of breast cancer prognosis, 
PCGMMF achieves an accuracy of 0.903 and an AUC value of 0.924, outperforming 
other state-of-the-art methods. Furthermore, we provide an interpretability 
analysis of highly significant regions from histopathological images, which can 
serve as a reference for clinical practice.
CONCLUSION: PCGMMF offers a robust and innovative solution for breast cancer 
prognostic analysis by effectively integrating multimodal data and utilizing 
advanced deep learning techniques. It can effectively conduct breast cancer 
prognostic analysis and provide significant references for personalized 
precision treatment and clinical practice.

Copyright © 2025 Elsevier Inc. All rights reserved.

DOI: 10.1016/j.jbi.2025.104907
PMID: 40935222 [Indexed for MEDLINE]

Conflict of interest statement: Declaration of competing interest The authors 
declare that they have no known competing financial interests or personal 
relationships that could have appeared to influence the work reported in this 
paper.",TRUE
