pmid,title,authors,journal,pubdate,doi,abstract,has_epigenetic_content
41028045,Epigenetic aging acceleration among World Trade Center-exposed community members.,Tuminello S; Ashebir YA; Schroff C; Ramaswami S; Durmus N; Chen Y; Snuderl M; Shao Y; Reibman J; Arslan AA,Scientific reports,2025 Sep 30,10.1038/s41598-025-10141-8,"1. Sci Rep. 2025 Sep 30;15(1):33942. doi: 10.1038/s41598-025-10141-8.

Epigenetic aging acceleration among World Trade Center-exposed community 
members.

Tuminello S(1), Ashebir YA(1), Schroff C(2), Ramaswami S(2), Durmus N(3), Chen 
Y(1)(4), Snuderl M(2), Shao Y(1)(4), Reibman J(3)(5), Arslan AA(6)(7)(8).

Author information:
(1)Department of Population Health, NYU Grossman School of Medicine, 180 Madison 
Avenue, New York, NY, 10016, USA.
(2)Department of Pathology, NYU Grossman School of Medicine, New York, NY, 
10016, USA.
(3)Department of Medicine, NYU Grossman School of Medicine, New York, NY, 10016, 
USA.
(4)NYU Perlmutter Comprehensive Cancer Center, New York, NY, 10016, USA.
(5)Division of Environmental Medicine, Department of Medicine, NYU Grossman 
School of Medicine, New York, NY, 10016, USA.
(6)Department of Population Health, NYU Grossman School of Medicine, 180 Madison 
Avenue, New York, NY, 10016, USA. Alan.Arslan@nyulangone.org.
(7)NYU Perlmutter Comprehensive Cancer Center, New York, NY, 10016, USA. 
Alan.Arslan@nyulangone.org.
(8)Department of Obstetrics and Gynecology, NYU Grossman School of Medicine, New 
York, NY, 10016, USA. Alan.Arslan@nyulangone.org.

Aging is a complex biological process, and some individuals are aging faster or 
slower than expected. This phenomenon of aging acceleration occurs when 
biological age exceeds chronological age and can be assessed by epigenetic clock 
estimation. As aging acceleration is known to occur in response to some 
environmental exposures as well as trauma, we hypothesized that World Trade 
Center (WTC) exposures may have led to epigenetic aging acceleration. 
WTC-exposed women were selected from the World Trade Center Environmental Health 
Center (WTC EHC) clinic, with peripheral blood collected during routine clinical 
monitoring visits. The reference group was selected from the NYU Women's Health 
Study (NYUWHS), a prospective cohort study that collected blood samples before 
9/11/2001. Epigenomes of WTC-exposed vs. unexposed women were profiled using the 
Infinium MethylationEPIC array. DNA-based epigenetic aging was estimated using 
Hannum, Horvath, PhenoAge and GrimAge epigenetic clocks. Age acceleration was 
defined as the residual from regressing estimated epigenetic age on 
chronological age. Ordinary least squares regression was used to investigate the 
relationship between WTC exposure and accelerated aging. After adjustment for 
race/ethnicity, smoking status, Body Mass Index (BMI), batch and cell type 
composition, WTC exposure was associated with epigenetic aging acceleration 
using the Hannum epigenetic clock (βWTC Exposed vs. Unexposed: 3.789; p-value: 
<0.001). WTC exposure was also associated with epigenetic aging acceleration 
when using other epigenetic clock types (Horvath and PhenoAge, but not GrimAge), 
and when stratifying by breast cancer case (βWTC Exposed vs. Unexposed: 3.473; 
p-value: <0.001) or cancer-free participant (βWTC Exposed vs. Unexposed: 4.369; 
p-value: 0.001) status. Among all participants, having a breast cancer diagnosis 
was statistically significantly associated with accelerated aging (βCancer vs. 
cancer-free: 1.658; p-value: 0.021). WTC exposure is statistically significantly 
associated with epigenetic aging acceleration. This was true even after 
stratifying on cancer status. WTC exposure was positively associated with 
epigenetic aging acceleration in the overall cohort, among only those women who 
were cancer-free, and among breast cancer cases.

© 2025. The Author(s).

DOI: 10.1038/s41598-025-10141-8
PMCID: PMC12484928
PMID: 41028045 [Indexed for MEDLINE]

Conflict of interest statement: Declarations. Competing interests: The authors 
declare no competing interests. Institutional Review Board Statement: The study 
was conducted according to the guidelines of the Declaration of Helsinki and 
approved by the Institutional Review Boards of NYU Grossman School of Medicine 
and Bellevue Hospital (IRB numbers: s17-01207 and i21-00717). Informed consent 
was obtained from all study participants.",TRUE
41027193,PARP1 promoter hypermethylation promotes arsenic-induced skin damage by driving telomere dysfunction-mediated keratinocyte senescence.,Yang L; Wang W; Zhang A,Ecotoxicology and environmental safety,2025 Oct 1,10.1016/j.ecoenv.2025.119108,"1. Ecotoxicol Environ Saf. 2025 Oct 1;304:119108. doi: 
10.1016/j.ecoenv.2025.119108. Epub 2025 Sep 29.

PARP1 promoter hypermethylation promotes arsenic-induced skin damage by driving 
telomere dysfunction-mediated keratinocyte senescence.

Yang L(1), Wang W(1), Zhang A(2).

Author information:
(1)The Key Laboratory of Environmental Pollution Monitoring and Disease Control, 
Ministry of Education, Department of Toxicology, School of Public Health, 
Guizhou Medical University, Guiyang, Guizhou 550025, PR China.
(2)The Key Laboratory of Environmental Pollution Monitoring and Disease Control, 
Ministry of Education, Department of Toxicology, School of Public Health, 
Guizhou Medical University, Guiyang, Guizhou 550025, PR China. Electronic 
address: aihuagzykd@163.com.

Arsenic, a common environmental pollutant, causes skin damage with long-term 
exposure. Although its pathogenic mechanism remains unclear, skin cell 
senescence creates a microenvironment that promotes cancer development, with the 
mechanisms accelerating disease progression in arsenic-induced skin damage 
attracting significant attention. This study utilised previously collected skin 
samples to evaluate the associations between skin senescence and damage 
indicators. According to the presence or absence of arsenic exposure, 
participants were divided into a reference group and an arsenic exposure group. 
Additionally, the arsenic exposure group was further divided into a common 
pathological changes group, a hyperkeratosis group, and a skin cancer group, 
based on skin histopathological examination. Compared with the reference group, 
the arsenic exposure group exhibited increased expression of 
senescence-associated secretory phenotypes (IL-6 and IL-17) and shortened 
relative telomere length (RTL). With increasing severity of skin damage, IL-6 
and IL-17 levels progressively increased, while RTL progressively decreased. 
Examination of representative indicators of arsenic-induced skin damage 
(epithelial-mesenchymal transition [EMT] indicators) revealed decreased 
E-cadherin expression and increased vimentin expression. With increasing 
severity of skin damage, E-cadherin expression progressively decreased, while 
vimentin expression progressively increased. Moreover, clear correlations were 
observed between senescence-related markers (IL-6, IL-17, and RTL) and 
arsenic-induced skin damage markers (E-cadherin, vimentin) in the human samples. 
In vitro experiments demonstrated that arsenic induced lower expression of the 
telomere-related gene PARP1, reducing its binding to TERF2 and weakening its 
recruitment of BLM, thereby causing telomere dysfunction, promoting the 
senescence of HaCaT cells, and resulting in EMT. Additionally, arsenic exposure 
induced high expression of DNMT3, which mediated PARP1 hypermethylation and low 
expression. Treatment with the DNA methyltransferase inhibitor 
5-aza-2'-deoxycytidine restored PARP1 expression in arsenic-treated HaCaT cells, 
regulated telomere dysfunction, improved cellular senescence, and alleviated 
EMT. This study provides new insights into the mechanisms underlying 
arsenic-induced skin damage from an epigenetic and genetic perspective.

Copyright © 2025 The Authors. Published by Elsevier Inc. All rights reserved.

DOI: 10.1016/j.ecoenv.2025.119108
PMID: 41027193 [Indexed for MEDLINE]

Conflict of interest statement: Declaration of Competing Interest The authors 
declare that they have no known competing financial interests or personal 
relationships that could have appeared to influence the work reported in this 
paper",TRUE
41026782,Telomeres control human telomerase (TERT) expression through non-telomeric TRF2.,Sengupta A; Vinayagamurthy S; Soni D; Deb R; Mukherjee AK; Dutta S; Jaiswal J; Yadav M; Sharma S; Bagri S; Roy SS; Poonia P; Singh A; Khanna D; Bhatt AKK; Sharma A; Saurav S; Motiani RK; Chowdhury S,eLife,2025 Sep 30,10.7554/eLife.104045,"1. Elife. 2025 Sep 30;14:RP104045. doi: 10.7554/eLife.104045.

Telomeres control human telomerase (TERT) expression through non-telomeric TRF2.

Sengupta A(1)(2)(3), Vinayagamurthy S(1)(2)(3), Soni D(1)(2)(3), Deb R(1)(3), 
Mukherjee AK(1)(2)(3), Dutta S(1)(2)(3), Jaiswal J(1)(3), Yadav M(1)(2)(3), 
Sharma S(1)(2)(3), Bagri S(1)(2)(3), Roy SS(1)(2)(3), Poonia P(1)(3), Singh 
A(1)(3), Khanna D(1)(3), Bhatt AKK(1)(3), Sharma A(4), Saurav S(4), Motiani 
RK(4), Chowdhury S(1)(2)(3).

Author information:
(1)Integrative and Functional Biology Unit, CSIR-Institute of Genomics and 
Integrative Biology, Delhi, India.
(2)Academy of Scientific and Innovative Research (AcSIR), Ghaziabad, India.
(3)CSIR-Institute of Genomics and Integrative Biology, New Delhi, India.
(4)Laboratory of Calciomics and Systemic Pathophysiology (LCSP), Regional Centre 
for Biotechnology (RCB), Faridabad, India.

Update of
    doi: 10.1101/2023.10.09.561466.
    doi: 10.7554/eLife.104045.1.
    doi: 10.7554/eLife.104045.2.

The function of the human telomerase reverse transcriptase (referred hereafter 
as TERT) in the synthesis and maintenance of chromosome ends, or telomeres, is 
widely understood. Whether and how telomeres, on the other hand, influence TERT 
regulation is relatively less studied. We found TERT was transcriptionally 
altered depending on telomere length (TL). This resulted from TL-dependent 
binding of TRF2 between telomeres and the TERT promoter. TERT promoter-bound 
TRF2 was non-telomeric and did not involve the looping of telomeres to the TERT 
promoter. Cell lines from different tissue types fibrosarcoma (HT1080), colon 
cancer (HCT116), and breast cancer (MDA-MB-231), engineered for either telomere 
elongation/shortening, gave an increase/decrease in TERT, respectively. 
Mechanistically, we show TERT promoter-bound non-telomeric TRF2 recruits the 
canonical PRC2-complex, inducing repressor histone H3K27-trimethylation in a 
TL-dependent fashion. This was further supported by TL-dependent promoter 
activity from an exogenously inserted TERT reporter. Increase in TL over days 
followed by a gradual decline, resulted in activation followed by repression of 
TERT in a concerted manner, further implicating TL as a key factor for TERT 
regulation. Notably, on reprogramming primary fibroblasts to induced pluripotent 
stem cells (iPSCs), TRF2 loss from the TERT promoter was evident along with 
telomere elongation and TERT upregulation. Conversely, on telomere shortening in 
iPSCs, TERT promoter-bound TRF2 was restored with a marked reduction in TERT, 
further supporting the causal role of TL in TERT transcription. Mechanisms of 
tight control of TERT by TL shown here are likely to have major implications in 
telomere-related physiologies, particularly, cancer, ageing, and pluripotency.

Plain Language Summary: Human cells typically have 23 pairs of structures known 
as chromosomes, each containing a unique set of genes that provides the 
instructions needed to make proteins and other essential molecules found in the 
body. At the end of each chromosome lies a region of repetitive DNA sequences, 
known as the telomere, which protects the chromosome strands from damage or 
tangling. Every time a cell divides, some of the telomere repeats are cut off, 
causing the telomeres to shorten. Specific enzymes known as telomerases can add 
these repeats back on so that the telomeres do not become too short. As we age, 
telomeres naturally shorten in length, but certain lifestyle factors can 
accelerate this process, leading to programmed cell death and contributing to 
various diseases, including cancers. In 2018, researchers showed that TRF2, a 
key telomere protein, helps relay information about telomere length to various 
regulatory genes. However, it remained unclear whether TRF2 could directly 
communicate this information to the telomerase itself. Sengupta et al. – 
including several of the researchers from the 2018 study – set out to answer 
this question by studying multiple human cancer cell lines with different 
telomere lengths. They discovered that TRF2 acts like a messenger that interacts 
with the telomerase gene TERT, in a length-dependent manner. When telomeres were 
long, most TRF2 remained bound at the telomeres and did not interact with TERT, 
allowing continued telomerase activity and telomere elongation. By contrast, 
when telomeres were short, TRF2 was released from the telomeres and bound 
directly to the TERT promoter. There, together with a DNA structure called the 
G-quadruplex, TRF2 suppressed TERT expression and thereby limited further 
telomere extension. In other words, shortened telomeres repressed TERT 
expression, while elongated ones increased it. In this positive feedback–like 
reinforcement system, telomere length is signaled by the amount of free TRF2 
protein. When TERT expression is high and telomeres are long, less TRF2 is 
available to bind the TERT promoter, reducing repression and thereby maintaining 
its expression. Conversely, when TERT expression is low and telomeres are short, 
more TRF2 is available, reinforcing repression and sustaining the low-expression 
state. Regulating telomere length is essential for healthy cell function, and 
its dysregulation is a hallmark of cancer. Sengupta et al. demonstrated that 
TRF2 plays a critical role in this process by feeding back information about 
telomere length directly to the TERT gene. By further dissecting this feedback 
system and refining experimental tools, researchers may gain new insights into 
telomere regulation in cancer and related diseases.

© 2025, Sengupta et al.

DOI: 10.7554/eLife.104045
PMCID: PMC12483519
PMID: 41026782 [Indexed for MEDLINE]

Conflict of interest statement: AS, SV, DS, RD, AM, SD, JJ, MY, SS, SB, SR, PP, 
AS, DK, AB, AS, SS, RM, SC No competing interests declared",TRUE
41023574,"Hypermethylated Long Non-Coding RNA Genes KCNK15-AS1, MAGI2-AS3, and SSTR5-AS1 in Ovarian Cancer and Their Diagnostic Potential.",Lukina SS; Burdenyy AM; Filippova EA; Loginov VI; Pronina IV; Ivanova NA; Selezneva AD; Selezneva AD; Arzhanukhina NA; Kazubskaya TP; Kushlinskii NE; Braga EA,Bulletin of experimental biology and medicine,2025 Jul,10.1007/s10517-025-06486-9,"1. Bull Exp Biol Med. 2025 Jul;179(3):342-347. doi: 10.1007/s10517-025-06486-9. 
Epub 2025 Sep 29.

Hypermethylated Long Non-Coding RNA Genes KCNK15-AS1, MAGI2-AS3, and SSTR5-AS1 
in Ovarian Cancer and Their Diagnostic Potential.

Lukina SS(1), Burdenyy AM(2)(3), Filippova EA(1), Loginov VI(1)(4), Pronina 
IV(1), Ivanova NA(1), Selezneva AD(1), Selezneva AD(1), Arzhanukhina NA(5), 
Kazubskaya TP(5), Kushlinskii NE(5), Braga EA(1)(4).

Author information:
(1)Institute of General Pathology and Pathophysiology, Moscow, Russia.
(2)Institute of General Pathology and Pathophysiology, Moscow, Russia. 
burdennyy@gmail.com.
(3)Emanuel Institute of Biochemical Physics, Russian Academy of Sciences, 
Moscow, Russia. burdennyy@gmail.com.
(4)Research Centre for Medical Genetics, Moscow, Russia.
(5)N. N. Blokhin Russian Cancer Research Center, Ministry of Health of the 
Russian Federation, Moscow, Russia.

We identified new diagnostic markers for ovarian cancer based on the analysis of 
aberrant methylation in a group of long non-coding RNA (lncRNA) genes. Using 
quantitative methyl-specific PCR with the nonparametric Mann-Whitney test, a 
significant (p < 0.01) increase in the methylation levels of three lncRNA genes 
(KCNK15-AS1, MAGI2-AS3, SSTR5-AS1) was demonstrated in a representative cohort 
of 56 clinical ovarian cancer samples. Using quantitative reverse transcription 
PCR on the same sample set, a significant decrease in the expression of these 
three lncRNA genes (p < 0.01) and a statistically significant inverse 
correlation between changes in methylation and expression levels (r < -0.5) were 
demonstrated, which confirms the functional role of methylation in suppressing 
their expression in tumor tissues. ROC analysis was used to assess the 
diagnostic potential of these genes. It was shown that the detection of 
methylation in at least one of the three genes in tissue DNA samples allows for 
identification of ovarian cancer with 98% sensitivity and 100% specificity (test 
> 0, AUC = 0.989). The developed marker panel may be of interest for the 
molecular assessment of at-risk patients when determining a preliminary 
diagnosis. However, the method requires validation on a larger, more 
representative sample set.

© 2025. Springer Science+Business Media, LLC, part of Springer Nature.

DOI: 10.1007/s10517-025-06486-9
PMID: 41023574 [Indexed for MEDLINE]",TRUE
41022800,Genetic determinants of monocyte splicing are enriched for disease susceptibility loci.,Nassiri I; Gilchrist JJ; Tong O; Lau E; Danielli S; Mossawi HA; Neville MJ; Knight JC; Fairfax BP,Nature communications,2025 Sep 29,10.1038/s41467-025-63624-7,"1. Nat Commun. 2025 Sep 29;16(1):8616. doi: 10.1038/s41467-025-63624-7.

Genetic determinants of monocyte splicing are enriched for disease 
susceptibility loci.

Nassiri I(1)(2)(3)(4)(5), Gilchrist JJ(6)(7), Tong O(6), Lau E(8), Danielli 
S(9), Mossawi HA(10), Neville MJ(11)(12), Knight JC(8)(13), Fairfax BP(14)(15).

Author information:
(1)Oxford-GSK Institute of Molecular and Computational Medicine (IMCM), Centre 
for Human Genetics, Nuffield Department of Medicine, University of Oxford, 
Oxford, UK. isar.nassiri@ndcn.ox.ac.uk.
(2)Centre for Human Genetics, Nuffield Department of Medicine, University of 
Oxford, Oxford, UK. isar.nassiri@ndcn.ox.ac.uk.
(3)Nuffield Department of Clinical Neurosciences, University of Oxford, Oxford, 
UK. isar.nassiri@ndcn.ox.ac.uk.
(4)Department of Psychiatry, University of Oxford, Oxford, UK. 
isar.nassiri@ndcn.ox.ac.uk.
(5)Department of Oncology, University of Oxford, Old Road Campus Research 
Building, Oxford, UK. isar.nassiri@ndcn.ox.ac.uk.
(6)MRC Weatherall Institute of Molecular Medicine, University of Oxford, 
Headington, Oxford, UK.
(7)Department of Paediatrics, University of Oxford, Oxford, UK.
(8)Centre for Human Genetics, Nuffield Department of Medicine, University of 
Oxford, Oxford, UK.
(9)Department of Oncology, University of Oxford, Old Road Campus Research 
Building, Oxford, UK.
(10)Nuffield Department of Orthopaedics Rheumatology and Musculoskeletal 
Sciences, University of Oxford, Oxford, UK.
(11)Oxford Centre for Diabetes, Endocrinology and Metabolism, University of 
Oxford, Oxford, UK.
(12)NIHR Oxford Biomedical Research Centre, OUH Foundation Trust, Oxford, UK.
(13)Chinese Academy of Medical Science Oxford Institute, University of Oxford, 
Oxford, UK.
(14)Department of Oncology, University of Oxford, Old Road Campus Research 
Building, Oxford, UK. Benjamin.fairfax@oncology.ox.ac.uk.
(15)MRC Weatherall Institute of Molecular Medicine, University of Oxford, 
Headington, Oxford, UK. Benjamin.fairfax@oncology.ox.ac.uk.

Insights into variation in monocyte context-specific splicing and transcript 
usage are limited. Here, we perform paired gene and transcript QTL mapping 
across distinct immune states using RNA sequencing data of monocytes isolated 
from a cohort of 185 healthy Europeans incubated alone or in the presence of 
interferon gamma (IFN-γ) or lipopolysaccharide (LPS). We identify regulatory 
variants for 5749 genes and 8727 transcripts, with 291 context-specific 
transcript QTL colocalizing with GWAS loci. Notable disease relevant 
associations include IFN-γ specific transcript QTL at COVID-19 severity locus 
rs10735079, where allelic variation modulates context-specific splicing of OAS1, 
and at rs4072037, a risk allele for gastro-esophageal cancer, which associates 
with context-specific splicing of MUC1. We use DNA methylation data from the 
same cells to demonstrate overlap between methylation QTL and causal 
context-specific expression QTL, permitting inference of the direction of 
effect. Finally, we identify a subset of expression QTL that uncouple genes from 
proximally acting regulatory networks, creating 'co-expression QTL' with 
different allele-specific correlation networks. Our findings highlight the 
interplay between context and genetics in the regulation of the monocyte gene 
expression and splicing, revealing putative mechanisms of diverse disease risk 
alleles including for COVID-19 and cancer.

© 2025. The Author(s).

DOI: 10.1038/s41467-025-63624-7
PMCID: PMC12480492
PMID: 41022800 [Indexed for MEDLINE]

Conflict of interest statement: Competing interests: The authors declare no 
competing interests.",TRUE
41016387,Aflatoxin B1 induces subtle but coordinated histone modifications in Epstein-Barr virus infected and non-infected Burkitt lymphoma cells.,Michailidis TM; Corveleyn L; Almey R; Bader Y; Odongo GA; Herceg Z; Khoueiry R; Saeger S; Boevre M; Dhaenens M,Environment international,2025 Oct,10.1016/j.envint.2025.109813,"1. Environ Int. 2025 Oct;204:109813. doi: 10.1016/j.envint.2025.109813. Epub 2025
 Sep 23.

Aflatoxin B1 induces subtle but coordinated histone modifications in 
Epstein-Barr virus infected and non-infected Burkitt lymphoma cells.

Michailidis TM(1), Corveleyn L(2), Almey R(2), Bader Y(3), Odongo GA(4), Herceg 
Z(5), Khoueiry R(5), Saeger S(6), Boevre M(7), Dhaenens M(8).

Author information:
(1)Centre of Excellence in Mycotoxicology and Public Health, Faculty of 
Pharmaceutical Sciences, Ghent University, Ghent, Belgium; Epigenomics and 
Mechanisms Branch, International Agency for Research on Cancer/World Health 
Organization, Lyon, France; CRIG, Cancer Research Institute Ghent, Ghent, 
Belgium. Electronic address: thanosmichailidis@ugent.be.
(2)CRIG, Cancer Research Institute Ghent, Ghent, Belgium; Laboratory of 
Pharmaceutical Biotechnology, Faculty of Pharmaceutical Sciences, Ghent 
University, Gent, Belgium.
(3)Centre of Excellence in Mycotoxicology and Public Health, Faculty of 
Pharmaceutical Sciences, Ghent University, Ghent, Belgium; CRIG, Cancer Research 
Institute Ghent, Ghent, Belgium.
(4)Epigenomics and Mechanisms Branch, International Agency for Research on 
Cancer/World Health Organization, Lyon, France; Institute of Cancer Research and 
Genomic Sciences, University of Birmingham, Birmingham, United Kingdom.
(5)Epigenomics and Mechanisms Branch, International Agency for Research on 
Cancer/World Health Organization, Lyon, France.
(6)Centre of Excellence in Mycotoxicology and Public Health, Faculty of 
Pharmaceutical Sciences, Ghent University, Ghent, Belgium; CRIG, Cancer Research 
Institute Ghent, Ghent, Belgium; Department of Biotechnology and Food 
Technology, Faculty of Science, University of Johannesburg, Gauteng, South 
Africa.
(7)Centre of Excellence in Mycotoxicology and Public Health, Faculty of 
Pharmaceutical Sciences, Ghent University, Ghent, Belgium; CRIG, Cancer Research 
Institute Ghent, Ghent, Belgium. Electronic address: marthe.deboevre@ugent.be.
(8)CRIG, Cancer Research Institute Ghent, Ghent, Belgium; Laboratory of 
Pharmaceutical Biotechnology, Faculty of Pharmaceutical Sciences, Ghent 
University, Gent, Belgium. Electronic address: maarten.dhaenens@ugent.be.

Aflatoxin B1 (AFB1), a potent dietary carcinogen, and Epstein-Barr virus (EBV), 
an oncogenic virus, are both implicated in cancer development, particularly in 
endemic regions. However, the combined effects of AFB1 exposure and EBV 
infection on the epigenetic landscape remain poorly understood. This study 
investigates the impact of AFB1 and EBV on histone post-translational 
modifications (hPTMs) in Burkitt lymphoma (BL) cells through an integrative 
approach combining untargeted mass spectrometry-based profiling and a time-lapse 
experimental design. Our results reveal subtle, yet reproducible and dynamic 
alterations in histone methylation and acetylation patterns over time in all 
cells. Specifically, AFB1 exposure induced an increase in H3K27me3 levels, which 
in the case of EBV infected cells, counteracts the decrease observed at baseline 
compared to uninfected cells. Additionally, changes in acetylation patterns of 
H4 N-tail residues and key regulatory proteins suggest potential disruptions in 
chromatin accessibility and transcriptional regulation. Our correlation and 
network-based analyses further highlight coordinated epigenetic shifts in 
response to AFB1, with key acetylation hubs emerging within the histone PTM 
profile. Despite subtle differences, no significant divergence in overall hPTM 
responses was detected between EBV-infected and uninfected cells, emphasizing 
the subtlety of the EBV effect on AFB1 exposure. Future research should explore 
locus-specific epigenetic changes and therapeutic interventions targeting hPTMs 
to mitigate cancer risk associated with AFB1 exposure and EBV infection.

Copyright © 2025. Published by Elsevier Ltd.

DOI: 10.1016/j.envint.2025.109813
PMID: 41016387 [Indexed for MEDLINE]

Conflict of interest statement: Declaration of competing interest The authors 
declare that they have no known competing financial interests or personal 
relationships that could have appeared to influence the work reported in this 
paper.",TRUE
