pmid,title,authors,journal,pubdate,doi,abstract,has_epigenetic_content
41166122,SLAMF8 expression and prognostic significance in melanoma: A multi-omics and Mendelian randomization study.,Liu J; Han W; Shen G,Cancer biomarkers : section A of Disease markers,2025 Oct,10.1177/18758592251392828,"1. Cancer Biomark. 2025 Oct;42(10):18758592251392828. doi: 
10.1177/18758592251392828. Epub 2025 Oct 30.

SLAMF8 expression and prognostic significance in melanoma: A multi-omics and 
Mendelian randomization study.

Liu J(1), Han W(2), Shen G(1).

Author information:
(1)Department of Burn and Plastic Surgery, The First Affiliated Hospital of 
Soochow University, Suzhou, China, 215000.
(2)Institute of Lung Health and Immunity, Helmholtz Zentrum München, Munich 
81377, Germany.

BackgroundMelanoma represents one of the most aggressive skin cancers, 
responsible for over 75% of skin cancer-related deaths despite comprising only 
5% of cases. Despite therapeutic advances, patient responses remain variable and 
unpredicv. The Signaling Lymphocytic Activation Molecule (SLAM) family regulates 
immune cell communication, with SLAMF8 being predominantly expressed on myeloid 
cells. However, SLAMF8's specific role in melanoma pathogenesis remains largely 
unexplored.MethodsIn this retrospective integrative study, we systematically 
investigated SLAMF8's role in melanoma through multi-omics analyses using TIMER, 
GEPIA, and UALCAN databases, following the STROBE (Strengthening the Reporting 
of Observational Studies in Epidemiology) guidelines for observational data 
reporting. Functional studies were conducted in A-375 and SK-MEL-28 melanoma 
cell lines using siRNA-mediated knockdown, followed by migration, invasion, and 
proliferation assays. DNA methylation patterns were analyzed via the SMART 
database, while mutation profiles were examined using cBioPortal and COSMIC. 
Immune infiltration analysis was performed through TIMER, and pathway 
associations were investigated using Gene Set Enrichment Analysis and 
protein-protein interaction networks. Finally, two-sample Mendelian 
Randomization analysis assessed the causal relationship between SLAMF8 
expression and melanoma susceptibility.ResultsSLAMF8 expression was 
significantly higher in metastatic melanoma compared to primary tumors, with 
expression patterns varying across disease stages and between sexes. Higher 
SLAMF8 expression correlated with improved disease-free and overall survival. 
Functional studies demonstrated that SLAMF8 knockdown significantly enhanced 
melanoma cell proliferation, migration, and invasion. DNA methylation analysis 
revealed significant negative correlations between methylation at specific CpG 
sites and SLAMF8 expression, with hypermethylation associated with worse 
survival outcomes. Mutation analysis identified alterations in 10.21% of 
melanoma patients. Immune infiltration studies demonstrated strong correlations 
between SLAMF8 expression and enhanced immune cell presence. GSEA linked SLAMF8 
to critical immune pathways including allograft rejection, inflammatory 
response, and interferon signaling. Mendelian Randomization analysis established 
a protective causal relationship between SLAMF8 and melanoma risk (OR = 0.39, 
95% CI = 0.21-0.74, p = 3.34e-03).ConclusionOur study demonstrates that SLAMF8 
plays a critical role in melanoma by suppressing tumor progression and 
modulating the immune microenvironment. Elevated SLAMF8 expression in metastatic 
melanoma is associated with improved patient survival, suggesting its utility as 
a prognostic biomarker. Furthermore, its tumor-suppressive effects and 
immune-regulatory functions highlight SLAMF8 as a promising therapeutic target 
for melanoma treatment strategies.

DOI: 10.1177/18758592251392828
PMID: 41166122 [Indexed for MEDLINE]

Conflict of interest statement: Declaration of conflicting interestsThe authors 
declared no potential conflicts of interest with respect to the research, 
authorship, and/or publication of this article. Data availability statementThe 
datasets used and analyzed during the current study available from the 
corresponding author on reasonable request.",TRUE
41146333,Peripheral blood mononuclear cell DNA methylation biomarkers for prognostic stratification in Chinese lung adenocarcinoma: a genome-wide epigenetic profiling study.,Li P; Zhang C; Yang S; Wu Y; Chen H; Ma S; Wu Y; He Z; Wang L; Liu Y; Wang Q,Clinical epigenetics,2025 Oct 27,10.1186/s13148-025-01992-z,"1. Clin Epigenetics. 2025 Oct 27;17(1):177. doi: 10.1186/s13148-025-01992-z.

Peripheral blood mononuclear cell DNA methylation biomarkers for prognostic 
stratification in Chinese lung adenocarcinoma: a genome-wide epigenetic 
profiling study.

Li P(1)(2), Zhang C(1)(2), Yang S(1)(2), Wu Y(1)(2), Chen H(1)(2), Ma S(1)(2), 
Wu Y(1)(2), He Z(1)(2), Wang L(1)(2), Liu Y(3), Wang Q(4)(5).

Author information:
(1)Department of Internal Medicine, The Affiliated Cancer Hospital of Zhengzhou 
University & Henan Cancer Hospital, Zhengzhou, 450008, China.
(2)Institute of Cancer Research, Henan Academy of Innovations in Medical 
Science, Zhengzhou, 450008, China.
(3)Department of Radiation Oncology, The Affiliated Cancer Hospital of Zhengzhou 
University & Henan Cancer Hospital, Zhengzhou, 450008, China. 
zlyyliuyang1440@zzu.edu.cn.
(4)Department of Internal Medicine, The Affiliated Cancer Hospital of Zhengzhou 
University & Henan Cancer Hospital, Zhengzhou, 450008, China. 
qimingwang1006@126.com.
(5)Institute of Cancer Research, Henan Academy of Innovations in Medical 
Science, Zhengzhou, 450008, China. qimingwang1006@126.com.

BACKGROUND: While DNA methylation profiling from peripheral blood mononuclear 
cells (PBMCs) has demonstrated utility in cancer risk prediction, notably for 
non-small cell lung cancer (NSCLC), its prognostic value for survival 
stratification in Chinese lung adenocarcinoma (LUAD) patients remains 
unestablished. This study addresses whether PBMC-derived methylation signatures 
can discriminate clinical outcomes in EGFR-mutation LUAD subgroups.
METHODS: We performed genome-wide methylation analysis of PBMCs from LUAD 
patients using the Infinium Methylation EPIC 850 K array. Clinical 
characteristics were associated with overall survival (OS) through Cox 
regression. Prognostic differentially methylated positions (DMPs) were 
identified via Lasso regression, followed by the construction of risk-score 
models. Functional enrichment (KEGG/GO) and tissue microarray-based 
immunohistochemistry (IHC) for FKBP4 expression (n = 90 LUAD samples) were 
conducted. Analyses were conducted in R 4.4.1 with curated Bioconductor 
packages.
RESULTS: In the retrospective cohort of 174 Chinese LUAD patients (April 
2014-September 2019), PBMC analysis of 128 cases revealed 12 hypomethylated DMPs 
were associated with OS. EGFR-mutant patients (n = 66) showed 325 significant 
DMPs (|Δβ|≥ 0.06, P ≤ 0.01), with four DMPs (cg05802998, cg19313959, cg00685115, 
cg15224444) independently predicting OS. The cg19313959 located in the TSS1500 
region of FKBP4 gene (Δβ = 0.21) demonstrated the strongest methylation shift. 
Reduced FKBP4 protein expression was associated with improved survival 
(HR = 0.42, 95%CI 0.24-0.72). In EGFR-wildtype patients (n = 51), three 
prognostic DMPs emerged from 2,531 candidates. EGFR mutation-specific prognostic 
scoring models were established successfully, while pathway analyses revealed 
divergent biological processes between EGFR subgroups.
CONCLUSION: In this epigenome-wide study based on PBMCs in Chinese patients with 
LUAD, methylation signatures dependent on EGFR mutations and predictive of 
survival were identified.

© 2025. The Author(s).

DOI: 10.1186/s13148-025-01992-z
PMCID: PMC12560486
PMID: 41146333 [Indexed for MEDLINE]

Conflict of interest statement: Declarations. Ethics approval and consent to 
participate: The study was conducted in accordance with the principles of the 
Declaration of Helsinki, and the study protocol was approved by the Institute 
Review Board of the Cancer Hospital Affiliated to Zhengzhou University. Because 
of the retrospective nature of the study without any intervention, and the data 
were anonymous, the requirement for patient consent was waived. Competing 
interests: The authors declare that they have no known competing financial 
interests or personal relationships that could have appeared to influence the 
work reported in this paper.",TRUE
41121288,DNA methylation profiles and cancer in children conceived after assisted reproductive technology.,Ducreux B; Firmin J; Ferreux L; Patrat C; Clavel J; Ghantous A; Herceg Z; Callanan M; Fauque P,Clinical epigenetics,2025 Oct 21,10.1186/s13148-025-01982-1,"1. Clin Epigenetics. 2025 Oct 21;17(1):174. doi: 10.1186/s13148-025-01982-1.

DNA methylation profiles and cancer in children conceived after assisted 
reproductive technology.

Ducreux B(1)(2), Firmin J(1)(3), Ferreux L(1)(3), Patrat C(1)(3), Clavel J(4), 
Ghantous A(5), Herceg Z(5), Callanan M(#)(2), Fauque P(#)(6)(7).

Author information:
(1)Faculty of Medicine, INSERM 1016, Université de Paris Cité, 75014, Paris, 
France.
(2)Faculty of Medicine, INSERM 1231, CHU Dijon, Université de Bourgogne-Europe, 
2100, Dijon, France.
(3)Department of Reproductive Biology-CECOS, Aphp.Centre-Université Paris Cité, 
Cochin, 75014, Paris, France.
(4)INSERM 1153, Université de Paris Cité, 75014, Paris, France.
(5)Epigenomics and Mechanisms Branch, International Agency for Research on 
Cancer, 69366, Lyon, France.
(6)Faculty of Medicine, INSERM 1016, Université de Paris Cité, 75014, Paris, 
France. pat.fauque@outlook.com.
(7)Department of Reproductive Biology-CECOS, Aphp.Centre-Université Paris Cité, 
Cochin, 75014, Paris, France. pat.fauque@outlook.com.
(#)Contributed equally

BACKGROUND: Epidemiological studies have shown a small but significantly 
increased risk of leukemia in children conceived by in vitro fertilization. 
Atypical DNA methylation patterns observed in pediatric cancers are suspected to 
occur in utero, and it is known that periconceptional conditions linked to 
assisted reproductive technologies (ART) are responsible for DNA methylation 
modifications.
RESULTS: Using databases and systematic literature screens, we derived a list of 
cancer/leukemia genes (n = 1246 and n = 532 genes, respectively, corresponding 
to 1466 individual genes) and of differentially methylated genes (DMG) in 
leukemia (n = 2642) and pre-leukemia (n = 381). These lists were 
cross-referenced with DMG (n = 93) curated from 18 ART Epigenome-Wide 
Association Studies (EWAS) (2369 samples). Among the ART DMG, more than 
one-third (n = 33) were leukemia, and six were pre-leukemia DMG, all 
representing a significant enrichment. Seven of the enriched genes (NTM, PRSS16, 
SCAND3, SYCP1, TP73, ZNF184, and ISL1-DT) showed concordant methylation between 
ART and leukemia/pre-leukemia. Moreover, five of the ART DMG are known targets 
for somatic/germline alterations in leukemia: ATP10A, CHD2, FBRSL1, FGFR2, and 
SORCS1. The ART DMG were not significantly enriched in cancer genes, supporting 
the hypothesis that ART may not link broadly to any cancer type but rather to 
leukemia.
CONCLUSION: This study indicates that relatively few genes that are known 
targets for somatic/germline mutation in cancer experience DNA methylation 
changes in individuals conceived through ART. By contrast, DNA methylation 
disturbances reported in leukemia represent more than one-third of those 
associated with ART conception, thus raising the question of their role in 
leukemia risk in ART-conceived individuals. Among them, a few critical genes 
such as TP73, a tumor suppressor, were shown to be targeted for 
hypermethylation, both in ART and leukemia, warranting further investigation.

© 2025. The Author(s).

DOI: 10.1186/s13148-025-01982-1
PMCID: PMC12542189
PMID: 41121288 [Indexed for MEDLINE]

Conflict of interest statement: Declarations. Ethics approval and consent to 
participate: Not applicable. Consent for publication: Not applicable. Competing 
interests: The authors declare no competing interests.",TRUE
41104469,EndoCompass project: research roadmap for pituitary and neuroendocrine tumor endocrinology.,Castano JP; Dattani MT; Grozinsky-Glasberg S; Karavitaki N; Pavel ME; Andoniadou C; Alexandraki K; Capatina C; Cerbone M; Ferone D; Gan HW; Hofland J; Hofland LJ; Ibanez-Costa A; Ilie MD; Isidori AM; Korbonits M; Kos-Kudła B; Maghnie M; Mantovani G; Marazuela M; Raverot G; Scarpa A; Schilbach K; Theodoropoulou M; van Santen HM; Zatelli MC,European journal of endocrinology,2025 Oct 17,10.1093/ejendo/lvaf035,"1. Eur J Endocrinol. 2025 Oct 17;193(Supplement_2):ii84-ii96. doi: 
10.1093/ejendo/lvaf035.

EndoCompass project: research roadmap for pituitary and neuroendocrine tumor 
endocrinology.

Castano JP(1)(2)(3), Dattani MT(4)(5), Grozinsky-Glasberg S(6), Karavitaki 
N(7)(8), Pavel ME(9), Andoniadou C(10)(11), Alexandraki K(12), Capatina 
C(13)(14), Cerbone M(15)(16), Ferone D(17), Gan HW(16)(18), Hofland J(19), 
Hofland LJ(19), Ibanez-Costa A(1)(2)(20), Ilie MD(21)(22), Isidori AM(23)(24), 
Korbonits M(25)(26), Kos-Kudła B(27)(28), Maghnie M(29)(30), Mantovani 
G(31)(32), Marazuela M(33), Raverot G(34)(35)(36), Scarpa A(37), Schilbach 
K(38), Theodoropoulou M(39), van Santen HM(40)(41), Zatelli MC(42).

Author information:
(1)Department of Cell Biology, Physiology, and Immunology, University of 
Córdoba, Cordoba 14004, Spain.
(2)Maimonides Biomedical Research Institute of Cordoba, Córdoba 14004, Spain.
(3)Reina Sofia University Hospital, Córdoba 14004, Spain.
(4)Genetics and Genomic Medicine Programme, UCL GOS Institute of Child Health, 
London, United Kingdom.
(5)Endocrinology Department, Great Ormond Street Hospital For Children NHS 
Trust, London, WC1N 3JH, United Kingdom.
(6)Neuroendocrine Tumor Unit, ENETS Centre of Excellence, Division of Medicine, 
Hadassah University Hospital and Faculty of Medicine, the Hebrew University, 
Jerusalem, 91120, Israel.
(7)Institute of Metabolism and Systems Research, University of Birmingham, and 
Centre for Endocrinology, Diabetes and Metabolism, Birmingham Health Partners, 
Birmingham B15 2TT, UK.
(8)Department of Endocrinology, Queen Elizabeth Hospital, University Hospitals 
Birmingham NHS Foundation Trust, Birmingham B15 2TH, UK.
(9)Medizinische Klinik 1, Schwerpunkt Endokrinologie und Diabetologie, 
Uniklinikum Erlangen, ENETS Center of Excellence Erlangen, CCC Erlangen-EMN, 
Friedrich-Alexander-Universität Erlangen-Nürnberg, Ulmenweg 18, 91054, Erlangen, 
Deutschland.
(10)Faculty of Medicine Carl Gustav Carus, Department of Medicine III, 
Technische Universität Dresden, Dresden, Germany.
(11)Department of Endocrinology, Carol Davila University of Medicine and 
Pharmacy, Bucharest, Romania.
(12)2nd Department of Surgery, Aretaieio Hospital, National and Kapodistrian 
University of Athens, Athens, Greece.
(13)Department of Endocrinology, Carol Davila University of Medicine and 
Pharmacy, Bucharest 050474  Romania.
(14)Department of Pituitary and Neuroendocrine Pathology, C.I. Parhon National 
Institute of Endocrinology, Bucharest, Romania.
(15)Genetics and Genomic Medicine Research and Teaching Department, Great Ormond 
Street Hospital for Children, London, WC1N 1EH, United Kingdom.
(16)Department of Endocrinology, Great Ormond Street Hospital for Children, 
London WC1N 3JH, United Kingdom.
(17)Endocrinology, Department of Internal Medicine and Medical Specialties 
(DiMI), University of Genova, 16132 Genova, Italy.
(18)Genetics and Genomic Medicine Research and Teaching Department, University 
College London Great Ormond Street Institute of Child Health, London, United 
Kingdom.
(19)ENETS Center of Excellence, Section of Endocrinology, Department of Internal 
Medicine, Erasmus Medical Center Cancer Institute, 3015 GD Rotterdam, The 
 Netherlands.
(20)Reina Sofia University Hospital, 14004 Córdoba, Spain.
(21)Inserm U1052, CNRS UMR5286, Claude Bernard Lyon 1 University, Cancer 
Research Center of Lyon, 69008 Lyon, France.
(22)Endocrinology Department, ""C.I. Parhon"" National Institute of Endocrinology, 
011863, Bucharest, Romania.
(23)Section of Medical Pathophysiology and Endocrinology, Department of 
Experimental Medicine, Sapienza University of Rome, Rome 00161, Italy.
(24)Endocrine and Andrological Regional Rare Disease Center (Endo-ERN 
accredited), Policlinico Umberto I, Rome 00161, Italy.
(25)Department of Endocrinology, Barts and The London School of Medicine, Queen 
Mary University of London, London EC1M 6BQ, United Kingdom.
(26)William Harvey Research Institute, London EC1M 6BQ, United Kingdom.
(27)Department of Endocrinology and Neuroendocrine Tumours, Medical University 
of Silesia, Katowice 40-055, Silesian Voivodeship, Poland.
(28)Department of Pathophysiology and Endocrinology, Medical University of 
Silesia, Katowice 40-055, Silesian Voivodeship, Poland.
(29)Pediatric Clinic and Endocrinology Unit, Istituto di Ricovero e Cura a 
Carattere Scientifico (IRCCS) Istituto Giannina Gaslini, Genoa 16147, Italy.
(30)DINOGMI (Department of Neuroscience, Rehabilitation, Ophthalmology, 
Genetics, Maternal and Child Health), University of Genoa, 16132 Genoa, Italy.
(31)Department of Clinical Sciences and Community Health, University of Milan, 
Milan 20122, Lombardy, Italy.
(32)Endocrinology Unit, Fondazione IRCCS Ca' Granda Ospedale Maggiore 
Policlinico, Milan 20122, Lombardy, Italy.
(33)Universidad Autónoma de Madrid, Department of Endocrinology and Nutrition, 
Hospital Universitario de La Princesa, Instituto de Investigación Sanitaria de 
La Princesa, Madrid 28006, Spain.
(34)Endocrinology Department, Hospices civils de Lyon, Reference Centre for Rare 
Pituitary Diseases HYPO, ""Groupement Hospitalier Est,"" Bron 69500, France.
(35)Faculté de Médecine, Universite Claude Bernard Lyon 1-Domaine de Rockefeller 
institution, Lyon 69373, France.
(36)Cancer Research Centre Lyon, Inserm U1052, CNRC UMR5286, Lyon, 
Auvergne-Rhône-Alpes, France.
(37)Department of Diagnostics and Public Health, Section of Pathology, 
University of Verona, Verona 37134, Italy.
(38)Medizinische Klinik & Poliklinik IV, LMU Klinikum München, Munich 80336, 
Germany.
(39)Department of Medicine IV, LMU University Hospital, LMU Munich, 
Ziemssenstraße 5, Munich 80336, Germany.
(40)Division of Pediatric Endocrinology, Wilhelmina Children's Hospital, 
University Medical Centre, Utrecht 3508 AB, Netherlands.
(41)Division of Pediatric Oncology, Princess Máxima Center for Pediatric 
Oncology, Utrecht 3720 AC, The  Netherlands.
(42)Section of Endocrinology & Internal Medicine, Dept of Medical Sciences, 
University of Ferrara, Ferrara 44121, Italy.

BACKGROUND: Endocrine science remains underrepresented in European Union 
research programs despite the fundamental role of hormone health in human 
wellbeing. Analysis of the CORDIS database reveals a persistent gap between the 
societal impact of endocrine disorders and their research prioritization. At 
national funding level, endocrine societies report limited or little attention 
of national research funding toward endocrinology. The EndoCompass project-a 
joint initiative between the European Society of Endocrinology and the European 
Society of Paediatric Endocrinology, aimed to identify and promote strategic 
research priorities in endocrine science to address critical hormone-related 
health challenges.
METHODS: Research priorities were established through comprehensive analysis of 
the EU CORDIS database covering the Horizon 2020 framework period (2014-2020). 
Expert consultation in pituitary and neuroendocrine tumor endocrinology was 
conducted to identify key research priorities, followed by broader stakeholder 
engagement including society members and patient advocacy groups.
RESULTS: Research priorities encompass congenital and acquired disorders, tumor 
development and progression, and neuroendocrine neoplasms. Key areas include 
genetic/epigenetic factors, tumor microenvironment, personalized treatment 
approaches, developing preclinical models, and implementing artificial 
intelligence. Special emphasis is placed on aggressive tumors, hypothalamic 
syndromes, and establishing pan-European biobanks and databases.
CONCLUSIONS: This component of the EndoCompass project provides an 
evidence-based roadmap for strategic research investment. This framework 
identifies crucial investigation areas into pituitary-neuroendocrine disease 
pathophysiology, prevention, and treatment strategies, ultimately aimed at 
reducing the burden of these disorders on individuals and society. The findings 
support the broader EndoCompass objective of aligning research funding with 
areas of highest potential impact in endocrine health.

© The Author(s) 2025. Published by Oxford University Press on behalf of European 
Society of Endocrinology.

DOI: 10.1093/ejendo/lvaf035
PMID: 41104469 [Indexed for MEDLINE]

Conflict of interest statement: Conflict of interest: None declared.",TRUE
